"creative","uid"
"HOUSE/CA16 COSTA BROKEN WATER SYSTEM","NoChannel"
"HOUSE/CA16 COSTA FIGHTS FOR OUR VALUES","NoChannel"
"HOUSE/CA17 HONDA BILLIONAIRES","TcBaIiK8je4"
"HOUSE/CA20 FARR MAKE A DIFFERENCE 60","1VWfl5v-O54"
"HOUSE/CA21 DCCC&RENTERIA FALLING IN THE POLLS","zACyEPJoXpk"
"HOUSE/CA21 NRCC&VALADAO GREG MORENO","NoChannel"
"HOUSE/CA21 RENTERIA BORN AND RAISED","qK5KdM0Uj-Q"
"HOUSE/CA21 RENTERIA FRESNO BEE","-3joGJXFu7Y"
"HOUSE/CA21 VALADAO GREG MORENO","NoChannel"
"HOUSE/CA21 VALADAO HELP US","NoChannel"
"HOUSE/CA21 VALADAO SON OF IMMIGRANTS","NoChannel"
"HOUSE/CA21 VALADAO WASHINGTON INSIDER","NoChannel"
"HOUSE/CA21 VALADAO WATER","NoChannel"
"HOUSE/CA22 NUNES WATER IS LIFE","NoChannel"
"HOUSE/CA22 NUNES WATER RALLY","NoChannel"
"HOUSE/CA23 MCCARTHY CAROL FEIL","5Szo610AbVU"
"HOUSE/CA23 MCCARTHY DARRELL FEIL","6ji9YpSHzVs"
"HOUSE/CA23 MCCARTHY LAARY STARRH","N-EFnX6TS0k"
"HOUSE/CA23 MCCARTHY LEON THOMAS","3VDBxMNv3A4"
"HOUSE/CA23 MCCARTHY SERVE YOU","yOVu-aG5llI"
"HOUSE/CA24 CAPPS ENDORSED","NoMatch"
"HOUSE/CA24 CAPPS MITCHUMS TEA PARTY AGENDA","NoMatch"
"HOUSE/CA24 CAPPS WHAT DO YOU KNOW","NoMatch"
"HOUSE/CA24 CAPPS WHO WILL CHRIS MITCHUM REPRESENT","NoMatch"
"HOUSE/CA24 MITCHUM DEBT AND A SHAKY ECONOMY","lgNqgi2UpHk"
"HOUSE/CA24 MITCHUM INDEPENDENT LEADER","-bWYDzpIz6g"
"HOUSE/CA24 MITCHUM NEW KIND OF LEADER","vNR9MbxEf7o"
"HOUSE/CA26 BROWNLEY GORELL DIDN'T SUPPORT WOMEN","NoMatch"
"HOUSE/CA26 BROWNLEY SACRAMENTO POLITICIAN","NoMatch"
"HOUSE/CA26 BROWNLEY STRONGEST","fgqN1tqrCJU"
"HOUSE/CA26 DCCC&BROWNLEY UNSPEAKABLE","NoMatch"
"HOUSE/CA26 DCCC&BROWNLEY UNSPEAKABLE REV","NoMatch"
"HOUSE/CA33 CARR TERESA KENNARD","g3B5Qdhe9NI"
"HOUSE/CA33 LIEU PERFECT RATING","ILO9vIvpsJg"
"HOUSE/CA33 LIEU SON OF HARD WORKING IMMIGRANT PARENTS","0zz2Fk08d5U"
"HOUSE/CA36 NESTANDE SHAME ON YOU","xxbeOTPPbBo"
"HOUSE/CA36 NESTANDE SUFFERING","nHX4zfE7H0o"
"HOUSE/CA36 NESTANDE THE CHOICE IS CLEAR","PXdbxCT1nfk"
"HOUSE/CA36 RUIZ ANDREW WALKER","KHm7Pj4HWCg"
"HOUSE/CA36 RUIZ ER DOCTOR","IrgxqhzVSec"
"HOUSE/CA36 RUIZ GROWING UP","bFKis9jmKvA"
"HOUSE/CA36 RUIZ HERBERT JACKSON","WvBfEk-uuWw"
"HOUSE/CA36 RUIZ JERRY MOYNIHAN","NoMatch"
"HOUSE/CA36 RUIZ THANKS TO MEDICARE","3yTg4LDjaZA"
"HOUSE/CA36 RUIZ THE GOOD LIFE","ILYG3qLolJg"
"HOUSE/CA36 RUIZ THIS CAR","NoMatch"
"HOUSE/CA52 DCCC&PETERS ACTIONS SPEAK LOUDER THAN WORDS","9bAuOfdhUX4"
"HOUSE/CA52 DEMAIO FIX A BROKEN CONGRESS","5NpF2xJpvro"
"HOUSE/CA52 DEMAIO KNOW THIS MAN","NoMatch"
"HOUSE/CA52 DEMAIO PROUD GAY AMERICAN","qx8LmBtSoHc"
"HOUSE/CA52 DEMAIO SCOTT PETERS IS LYING","cWu-Tk52aBg"
"HOUSE/CA52 DEMAIO THE MISSION","NoMatch"
"HOUSE/CA52 DEMAIO UNWAVERING PRINCIPLES","yx8hujWmltg"
"HOUSE/CA52 PETERS BUDGET","PSaKi6HqLqE"
"HOUSE/CA52 PETERS DEMAIO HIDING SOMETHING","smRIEZldOG4"
"HOUSE/CA52 PETERS MICHAEL RENSTROM","oBwuefz-vE4"
"HOUSE/CA52 PETERS OFF TO SCHOOL","YisGeUbvQL4"
"HOUSE/CA52 PETERS RIGHT THING","wTOeMRIiIPo"
"HOUSE/CA52 PETERS SMEAR CAMPAIGN","NoMatch"
"HOUSE/CO03 TIPTON RECKLESS SPENDING","s7Mov1-1RfU"
"HOUSE/CO05 HALTER 32 YEARS IN THE AIRFORCE","g1sSt5WPTng"
"HOUSE/CO05 HALTER AWOL","CMBNBVDMwtk"
"HOUSE/CO05 HALTER SPENDS OUR MONEY","w_ZagLBY_ws"
"HOUSE/CO06 COFFMAN DENVER POST","NoMatch"
"HOUSE/CO06 COFFMAN DISTURBING REPORTS","FFTEcxlosY4"
"HOUSE/CO06 COFFMAN EVEN FELLOW DEMOCRATS","NoMatch"
"HOUSE/CO06 COFFMAN OVER THE TOP","NoMatch"
"HOUSE/CO06 ROMANOFF BARBARA HALL","W39ixEQCXEM"
"HOUSE/CO06 ROMANOFF COLLEGE","rmlr26FickY"
"HOUSE/CO06 ROMANOFF EVERY HOUR EVERY DOLLAR","mwLZjTRBXEo"
"HOUSE/CO06 ROMANOFF IF","Jy47aTBw9Gk"
"HOUSE/CO06 ROMANOFF IF YOU SIT HERE","NoMatch"
"HOUSE/CO06 ROMANOFF KAREN","LDMWbJOiHvo"
"HOUSE/CO06 ROMANOFF PRETTY SIMPLE","FQLNaMyCi2k"
"HOUSE/CT05 ESTY CHOICE TO MAKE","1yeBv63YI6w"
"HOUSE/CT05 ESTY MR AND MRS BUONANNI","CMaC3mWRlNs"
"HOUSE/CT05 ESTY OUR MOM","3lrFgU5rN9A"
"HOUSE/CT05 ESTY PAID INTO IT","qkLhzINT_-s"
"HOUSE/CT05 ESTY PRO DEATH","xNw5Vr8Zdtk"
"HOUSE/CT05 ESTY TOM CAMPBELL","NS95W2kzaEE"
"HOUSE/CT05 ESTY WAR NEVER LEAVES YOU","stXe38U3jis"
"HOUSE/CT05 GREENBERG BARKING","qtqaUQ_pApc"
"HOUSE/CT05 GREENBERG DISTURBING PATTERN","pouf82rk0U4"
"HOUSE/CT05 GREENBERG FAILURE","q-Lb0Y1qUJ0"
"HOUSE/CT05 GREENBERG THERE THEY GO AGAIN","KWGf5zsDJZM"
"HOUSE/FL02 FLDP&GRAHAM NORTH FLORIDA WAY","gq7u-VNuiCc"
"HOUSE/FL02 GRAHAM ANOTHER WEEK","NoMatch"
"HOUSE/FL02 GRAHAM BELIEVE ME","Lax9m-6SYc4"
"HOUSE/FL02 GRAHAM DISHONESTY","2kiEoJk3oHU"
"HOUSE/FL02 GRAHAM IMPORTANT","Wbszxf7W2lw"
"HOUSE/FL02 GRAHAM NEGATIVE ADS SO FALSE","Q8sG3nupAss"
"HOUSE/FL02 GRAHAM ONE THING","_uK4pQfQoAI"
"HOUSE/FL02 GRAHAM PROBLEM SOLVER","NoMatch"
"HOUSE/FL02 GRAHAM PROBLEM SOLVER REV","NoMatch"
"HOUSE/FL02 GRAHAM TROUBLING","zMDmleXO0yc"
"HOUSE/FL02 NRCC&SOUTHERLAND PROVEN JOB CREATOR","NoChannel"
"HOUSE/FL02 SOUTHERLAND AMERICA IS NOT SECURE","NoChannel"
"HOUSE/FL02 SOUTHERLAND ELECTIONS MATTER","NoChannel"
"HOUSE/FL02 SOUTHERLAND ERICA PRICE","NoChannel"
"HOUSE/FL02 SOUTHERLAND FIRST OBLIGATION OF GOVERNMENT","NoChannel"
"HOUSE/FL02 SOUTHERLAND HANDPICKED","NoChannel"
"HOUSE/FL02 SOUTHERLAND KELLY STIVERS","NoChannel"
"HOUSE/FL02 SOUTHERLAND LEADERSHIP WE CAN TRUST","NoChannel"
"HOUSE/FL02 SOUTHERLAND LUKE MURPHY","NoChannel"
"HOUSE/FL09 GRAYSON AMERICAN FLAGS","cT76BX83cr8"
"HOUSE/FL13 JOLLY OBAMACARE REV","NoMatch"
"HOUSE/FL13 JOLLY PERSONAL","f1bBJOnnCcE"
"HOUSE/FL13 JOLLY THE DIFFERENCE","JIP30gkdiRE"
"HOUSE/FL13 JOLLY WHERE I STAND","LBEWQBIZTL4"
"HOUSE/FL13 SINK OUT OF STEP","NoChannel"
"HOUSE/FL13 SINK RECORD","NoChannel"
"HOUSE/FL13 SINK RECORD REV","NoChannel"
"HOUSE/FL13 SINK SICK AND TIRED","NoChannel"
"HOUSE/FL13 SINK SOLUTIONS","NoChannel"
"HOUSE/FL13 SINK WORKING TOGETHER","NoChannel"
"HOUSE/FL16 BUCHANAN HIS STORY 60","NoMatch"
"HOUSE/FL18 DOMINO ACTION HERO","NoChannel"
"HOUSE/FL18 DOMINO ALL ABOARD FLORIDA","NoChannel"
"HOUSE/FL18 DOMINO GOVERNMENT HEALTHCARE TAKEOVER","NoChannel"
"HOUSE/FL18 DOMINO LIKE HIS FATHER","NoChannel"
"HOUSE/FL18 DOMINO MURPHY BRAGS","NoChannel"
"HOUSE/FL18 DOMINO RUNNING AWAY","NoChannel"
"HOUSE/FL18 MURPHY AGILIS","NoMatch"
"HOUSE/FL18 MURPHY FLORIDA'S WATERS","2jqSd3_X4Vo"
"HOUSE/FL18 MURPHY HAVEN'T STOPPED MOVING","05dXNSz7e3o"
"HOUSE/FL18 MURPHY INDIAN RIVER LAGOON","kWgycVI_uTA"
"HOUSE/FL18 MURPHY MY DAD","NoMatch"
"HOUSE/FL18 MURPHY MY HOME","51sJkNhJTqE"
"HOUSE/FL18 MURPHY NUMBERS","ng0Lji1w8nM"
"HOUSE/FL18 MURPHY NUMBERS ARE MY THING","pPbvBFxlTOI"
"HOUSE/FL18 MURPHY RARE","KJOcgSL6EE4"
"HOUSE/FL18 MURPHY REALLY DELIVERS","fx6nkBCCsXI"
"HOUSE/FL18 MURPHY UNIQUE CHARACTER","hdDcnIMXPyY"
"HOUSE/FL18 MURPHY WE'RE ALL SUPPORTING PATRICK MURPHY","SdODyl-tFE0"
"HOUSE/FL19 CLAWSON BASKETBALL","ykJmlU1vsTg"
"HOUSE/FL19 FREEMAN GOOD MORNING 15","NoChannel"
"HOUSE/FL19 FREEMAN GOOD MORNING 15 REV","NoChannel"
"HOUSE/FL19 FREEMAN RUNNING FOR CONGRESS 15","NoChannel"
"HOUSE/FL19 FREEMAN RUNNING FOR CONGRESS 15 REV","NoChannel"
"HOUSE/FL22 FRANKEL SAID TWO YEARS AGO","xr2PwjeQS2Y"
"HOUSE/FL26 CURBELO MONEY AND CORRUPTION","RkG9NE9p7ok"
"HOUSE/FL26 CURBELO SEE THIS","NoMatch"
"HOUSE/FL26 GARCIA SOUTH FLORIDIANS","yWqbtfMM7-8"
"HOUSE/FL26 GARCIA TWO FACED CORPORATE LOBBYIST","tW-mErPLRX4"
"HOUSE/GA01 CARTER FAITH FAMILY FREEDOM","NoChannel"
"HOUSE/GA01 JOHNSON CARTER SHOULD BE ASHAMED","NoChannel"
"HOUSE/GA01 JOHNSON PROFESSIONAL POLITICIAN","NoChannel"
"HOUSE/GA12 ALLEN BARROWS ATTACKS","rwGuXQak7x0"
"HOUSE/GA12 ALLEN CAUGHT LYING","Eb7BIIowx5E"
"HOUSE/GA12 ALLEN LIE OF THE YEAR","zBSOMhEjur4"
"HOUSE/GA12 ALLEN MESS","Q3Xj6OAJ4Mc"
"HOUSE/GA12 ALLEN SHAMEFUL ATTACK ADS","AM609j8lb8A"
"HOUSE/GA12 ALLEN WANTS OUR TRUST AGAIN","79j1jxny4SY"
"HOUSE/GA12 ALLEN WORST POLITICIANS","3-Pm6QQAAss"
"HOUSE/GA12 BARROW 85 PERCENT OF THE TIME","bL0gdqIUfkg"
"HOUSE/GA12 BARROW BEFORE THE VA SCANDAL","dGSNM7v-RYw"
"HOUSE/GA12 BARROW ENERGY INDEPENDENT","ARHyWdHI2ZA"
"HOUSE/GA12 BARROW GET A DOG","9pcHZ0Gx4K0"
"HOUSE/GA12 BARROW GET ANYTHING DONE","BKvzvEegbLQ"
"HOUSE/GA12 BARROW JOHNNY CROSBY","4sd71cvmtao"
"HOUSE/GA12 BARROW PORT OF SAVANNAH","ogaGZpdvBCg"
"HOUSE/GA12 BARROW SHOW YOU","TzRAoILd5QA"
"HOUSE/GA12 BARROW THE TRUTH ON IMMIGRATION","NoMatch"
"HOUSE/GA12 BARROW WASHINGTON DEMOCRATS","l5qAu2fJiRo"
"HOUSE/GA12 BARROW YOU WORK HARD","NoMatch"
"HOUSE/GA12 NRCC MESS","NoChannel"
"HOUSE/HI01 DCCC&TAKAI CHAMPION FOR OUR FAMILIES","cPY7H8GRXw0"
"HOUSE/HI01 DCCC&TAKAI OUR VALUES","aiQ7y167qRM"
"HOUSE/HI01 DJOU CARING AND COURAGEOUS","NoChannel"
"HOUSE/HI01 DJOU CONTENT","NoChannel"
"HOUSE/HI01 DJOU FRUSTRATED WITH THE GRIDLOCK","NoChannel"
"HOUSE/HI01 DJOU KEEP IT CLEAN","NoChannel"
"HOUSE/HI01 DJOU MOST IMPORTANT TITLE 15","NoChannel"
"HOUSE/HI01 DJOU RISING COST","NoChannel"
"HOUSE/HI01 DJOU THE FACES OF HAWAII","NoChannel"
"HOUSE/HI01 TAKAI DAY AT THE BEACH","DvPFNVhQYbM"
"HOUSE/HI01 TAKAI FROM FDR TO LBJ","wquw_0GPJxo"
"HOUSE/HI01 TAKAI MY OPPONENT","42rYcIO5emA"
"HOUSE/HI01 TAKAI SWAM","TeBbu_aKYeE"
"HOUSE/HI01 TAKAI TAMMY DUCKWORTH","QWtWl8zLZeE"
"HOUSE/IA01 BLUM ANGRY CAREER POLITICIAN","NoMatch"
"HOUSE/IA01 BLUM GREW UP","wyU9U-BSCPY"
"HOUSE/IA01 BLUM JANET","2zMou4-aXFo"
"HOUSE/IA01 BLUM MALCOLM STEWART","ikq1ODpxLn8"
"HOUSE/IA01 BLUM TEAMWORK","NoMatch"
"HOUSE/IA01 BLUM WE KNOW PAT MURPHY","NoMatch"
"HOUSE/IA01 DCCC&MURPHY CUT TO THE CHASE","snMjJO1DSeY"
"HOUSE/IA01 MURPHY 268 MILLIONAIRES","Rnmh2--XxWw"
"HOUSE/IA01 MURPHY BLACK AND WHITE","erYoIWh-toE"
"HOUSE/IA01 MURPHY FIRST ONES IN","NoMatch"
"HOUSE/IA01 MURPHY SHARON","VmSkhHHihDI"
"HOUSE/IA01 NRCC&BLUM CHUCK GRASSLEY","u4Br_xWqNiE"
"HOUSE/IA02 DCCC&LOEBSACK OUTSOURCING","sPlNlna0Xeo"
"HOUSE/IA02 LOEBSACK DEPENDS ON MEDICARE","ktNqfjNegUY"
"HOUSE/IA02 LOEBSACK SEE THE SIGNS","NoMatch"
"HOUSE/IA02 LOEBSACK THESE DOORS","Uz2D_oQH4U0"
"HOUSE/IA02 MILLER-MEEKS LOEBSACK VOTED FOR OBAMACARE","CDbuGrKOpXw"
"HOUSE/IA02 MILLER-MEEKS MARTY FORD","nCNxKdW3ZPo"
"HOUSE/IA02 MILLER-MEEKS PROMISED","QTRzC1ADFgs"
"HOUSE/IA03 APPEL DISTORTING MY RECORD","-t1KUdQ59vU"
"HOUSE/IA03 APPEL HARD WORK AND DETERMINATION","7pskhoYUWaY"
"HOUSE/IA03 APPEL IOWA INDEPENDENCE","COG1eM-U7HQ"
"HOUSE/IA03 APPEL LIKE ALL PARENTS","U8E6_o2JG1c"
"HOUSE/IA03 APPEL MESS IN WASHINGTON","kOyPsxUdXp8"
"HOUSE/IA03 APPEL NO SUPRISE","xmD6gahv2KA"
"HOUSE/IA03 APPEL POSING IN AN IOWA DINER","e8W3jCkVsXA"
"HOUSE/IA03 APPEL SIX CHILDREN","W2d9tXpt2ic"
"HOUSE/IA03 APPEL WASHINGTON INSIDER","NoMatch"
"HOUSE/IA03 NRCC&YOUNG APPEL VOTED AGAINST","NoChannel"
"HOUSE/IA03 YOUNG GOOD MEAL AND GOOD GOVERNMENT","NoChannel"
"HOUSE/IA03 YOUNG OBAMA MAKE NO MISTAKE","NoChannel"
"HOUSE/IA03 YOUNG THESE TWO","NoChannel"
"HOUSE/IA03 YOUNG WHERE I'M FROM","NoChannel"
"HOUSE/IA03 YOUNG YOUR OWN HEALTHCARE","NoChannel"
"HOUSE/IA04 KING GREW UP","okLR3JXse_I"
"HOUSE/IA04 KING ONLY GOOD THING LEFT","NxZRQbknP3g"
"HOUSE/IA04 KING TELL IT LIKE IT IS","4Vm46ipn0KU"
"HOUSE/IA04 MOWRER CHOICES","NoChannel"
"HOUSE/IA04 MOWRER CHOICES REV","NoChannel"
"HOUSE/IA04 MOWRER GOOD THING","NoChannel"
"HOUSE/IA04 MOWRER GREW UP ON A FARM","NoChannel"
"HOUSE/IA04 MOWRER GROWING UP","NoChannel"
"HOUSE/IA04 MOWRER WAR ZONE","NoChannel"
"HOUSE/ID02 SIMPSON MITT ROMNEY","I7JKVHu1pO4"
"HOUSE/ID02 STALLINGS IMMIGRATION REFORM 15","NoMatch"
"HOUSE/ID02 STALLINGS MINIMUM WAGE 15","NoMatch"
"HOUSE/ID02 STALLINGS WORKING WOMEN  15","NoMatch"
"HOUSE/ID02 STALLINGS WORST CONGRESS 15","NoMatch"
"HOUSE/IL08 DUCKWORTH GO SLOW","T5mBaMD4XH0"
"HOUSE/IL10 DCCC&SCHNEIDER DECISIONS","NoMatch"
"HOUSE/IL10 DCCC&SCHNEIDER END THE MEDICARE GUARANTEE","RUaj__lXlEs"
"HOUSE/IL10 DCCC&SCHNEIDER THE FACTS","NoMatch"
"HOUSE/IL10 DCCC&SCHNEIDER TRY THIS AGAIN","rFXuYFyGs_Q"
"HOUSE/IL10 DOLD DIRTY CAMPAIGN","Ovk5oQlU6UI"
"HOUSE/IL10 DOLD KRISTIE DOLD-BENNET","NoMatch"
"HOUSE/IL10 DOLD MARK KIRK","_Av3LQ0yYvE"
"HOUSE/IL10 SCHNEIDER&DCCC ICE CREAM","NEZolqDe-fI"
"HOUSE/IL10 SCHNEIDER TIRED OF POLITICAL ADS","PKEvBCcGsiE"
"HOUSE/IL11 FOSTER AS A KID","sHXVFcUFNSQ"
"HOUSE/IL12 BOST&NRCC CHICAGO POLITICIANS","NoChannel"
"HOUSE/IL12 BOST BARACK OBAMA'S RECORD","NoChannel"
"HOUSE/IL12 BOST CHICAGO POLITICIANS","NoChannel"
"HOUSE/IL12 BOST LEARNED A LOT FROM CHICAGO POLITICIANS","NoChannel"
"HOUSE/IL12 BOST TRACY BOST","NoChannel"
"HOUSE/IL12 DCCC&ENYART 20 YEAR SPRINGFIELD POLITICIAN","NoMatch"
"HOUSE/IL12 DCCC&ENYART 20 YEARS","NoMatch"
"HOUSE/IL12 DCCC&ENYART DIME","NoMatch"
"HOUSE/IL12 ENYART LEAD","O_KjiGAJoBw"
"HOUSE/IL12 ENYART LOOKING OUT FOR OUR MIDDLE CLASS","hIG-9lj9jqk"
"HOUSE/IL12 ENYART SPRINGFIELD POLITICIAN MIKE BOST","xGEaf-yybS4"
"HOUSE/IL12 ENYART THE MISSISSIPPI","NoMatch"
"HOUSE/IL12 ENYART THIS IS THE PROBLEM","4ufAJe2qWE4"
"HOUSE/IL13 CALLIS AS A MOM AND A JUDGE","TGmqy0DC2Mc"
"HOUSE/IL13 CALLIS BACK HOME AND ALIVE","lft6hp6lKjw"
"HOUSE/IL13 CALLIS DAVIS WILL TELL YOU","H4I8napsVcA"
"HOUSE/IL13 CALLIS DO WHAT'S RIGHT","f2HRHC_b59Y"
"HOUSE/IL13 CALLIS GOOD GUYS","FidGQBg9Z0A"
"HOUSE/IL13 CALLIS STEAK","opQZitcCrtU"
"HOUSE/IL13 DAVIS DISHONEST CAMPAIGN","4OCbOxbZZVI"
"HOUSE/IL13 DAVIS FRUSTRATED","0l5HlzmS7bk"
"HOUSE/IL13 DAVIS HARRISON BELER","Jqw7rIKkVSI"
"HOUSE/IL13 DAVIS HOUSING DILEMMA","NoMatch"
"HOUSE/IL13 DAVIS PART OF A TEAM","4Vdho_fn2X4"
"HOUSE/IL13 DAVIS TORYN DAVIS","YG6MVVJvFMI"
"HOUSE/IL13 DAVIS WASHINGTON ALLIES","PkStRnZNgTE"
"HOUSE/IL13 DAVIS WHAT KIND OF JUDGE","NoMatch"
"HOUSE/IL17 BUSTOS DISHONEST AND SHAMEFULLY MISLEADING","MbVXnKT0AGI"
"HOUSE/IL17 BUSTOS GERRY","OxqfDuokxyg"
"HOUSE/IL17 BUSTOS HONOR GUARD","K2bC-guFzHM"
"HOUSE/IL17 BUSTOS SOME PEOPLE SEE","LArYhQCwa-Q"
"HOUSE/IL17 BUSTOS THEY WORKED HARD","NoMatch"
"HOUSE/IL17 BUSTOS TOM GAULRAPP","NoMatch"
"HOUSE/IL17 BUSTOS WASHINGTON RIGS THE GAME","V0GOI2HygaE"
"HOUSE/IL17 BUSTOS WILLIAM THOMAS AND KATE DELANEY","YcW1B1GmNYg"
"HOUSE/IL17 SCHILLING ACCOUNTABLE","_b3kW-vRjAg"
"HOUSE/IL17 SCHILLING ERIC TURNER","vjW1YVT8W2A"
"HOUSE/IL17 SCHILLING MOTORCYCLE","Iq2F_45zDmI"
"HOUSE/IL17 SCHILLING RISKED OUR LIVES","Hek_A6fYtj0"
"HOUSE/IL17 SCHILLING VOICEMAIL","_Jq0SCOFzt4"
"HOUSE/IN02 BOCK BEEN AROUND THE WORLD","NoChannel"
"HOUSE/IN02 BOCK DELIVER AID","NoChannel"
"HOUSE/IN02 BOCK OLD POLITICAL TRICK","NoChannel"
"HOUSE/IN02 BOCK RUN TOWARD THE FIRE","NoChannel"
"HOUSE/IN02 WALORSKI EVERY 9 SECONDS","2FeMvVZfVQI"
"HOUSE/IN02 WALORSKI GROWING SCANDAL","VSkIhSS0B4U"
"HOUSE/IN02 WALORSKI LISA WILKEN","c8W85wUhZPs"
"HOUSE/IN02 WALORSKI MARTHA","fDzhbAlQM3w"
"HOUSE/IN02 WALORSKI MEET JOE BOCK","NoMatch"
"HOUSE/IN02 WALORSKI PROMISED","e8j9xjFsuzw"
"HOUSE/IN02 WALORSKI PROPANE CRISIS","NoMatch"
"HOUSE/IN02 WALORSKI PROVEN RECORD","NoMatch"
"HOUSE/IN02 WALORSKI WORK ACROSS THE AISLE","zG7M1qmphgk"
"HOUSE/IN08 BUCSHON NOT A POLITICIAN","rYjSLvWiiuY"
"HOUSE/KS02 JENKINS 1 IN 5 AMERICANS","3Uw21yz86X0"
"HOUSE/KS02 JENKINS EVERY 9 SECONDS","WkvX1oJ8lU4"
"HOUSE/KS02 JENKINS MY WHOLE LIFE","RyUMxk6-D2E"
"HOUSE/KS02 JENKINS REMEMBER THIS","NoMatch"
"HOUSE/KS02 JENKINS TELL A LOT","NoMatch"
"HOUSE/KS03 KULTALA SKINNY DIPPING","NoChannel"
"HOUSE/KS03 YODER GOOD LEADERSHIP","UlZ5l_feDjg"
"HOUSE/KS03 YODER PROUD","kOFqeK3cjxQ"
"HOUSE/KS03 YODER SUPPORT US","ndTcYTEGlv0"
"HOUSE/KS03 YODER TOP PRIORITIES","NoMatch"
"HOUSE/KS04 POMPEO FLATLANDERS 60","NoChannel"
"HOUSE/KY02 LEACH BUDGETS REFLECT OUR VALUES","NoChannel"
"HOUSE/KY03 MACFARLANE 6 YEARS 15","NoChannel"
"HOUSE/KY03 MACFARLANE DEAR JOHN","NoChannel"
"HOUSE/KY03 MACFARLANE DEAR JOHN 15","NoChannel"
"HOUSE/KY03 MACFARLANE SACRED TRUST 15","NoChannel"
"HOUSE/KY03 YARMUTH ECONOMY MOVING AGAIN","NoChannel"
"HOUSE/KY06 BARR CAROL BARR","T5dYE3wIp34"
"HOUSE/KY06 BARR DISTORING FACTS","9xpEMxEVNGw"
"HOUSE/KY06 BARR DISTORTING THE FACTS","D4oeIF7FP08"
"HOUSE/KY06 BARR DONNA BARR","sEt-wPsYXDs"
"HOUSE/KY06 BARR SOME SCARS","sgp0bhFrC9I"
"HOUSE/KY06 BARR TEACHING OUR GIRLS","9BinLiMgHK0"
"HOUSE/KY06 BARR THOMAS RICHARDS","7qlq8881KSA"
"HOUSE/KY06 BARR WASHINGTON IS BROKEN","EMZQMmM7nQ0"
"HOUSE/KY06 JENSEN KENTUCKY MOMS","NoChannel"
"HOUSE/KY06 JENSEN KENTUCKY MOMS REV","NoChannel"
"HOUSE/KY06 JENSEN NO WONDER","NoChannel"
"HOUSE/KY06 JENSEN THEIR PERKS","NoChannel"
"HOUSE/LA01 SCALISE HE'S BEEN CALLED","NoChannel"
"HOUSE/LA01 SCALISE OVER 350 BILLS","NoChannel"
"HOUSE/LA02 RICHMOND LEADER ON THE ISSUES","NoChannel"
"HOUSE/LA03 BOUSTANY TRUST","NoChannel"
"HOUSE/LA05 ABRAHAM BULL","NoMatch"
"HOUSE/LA06 CLAITOR POWERFUL WASHINGTON INSIDERS","NoChannel"
"HOUSE/LA06 CLAITOR PROSECUTED SOUTH AMERICAN DRUG DEALERS","NoChannel"
"HOUSE/LA06 GRAVES RALSTON","ZeoMhqrdiEE"
"HOUSE/LA06 GRAVES SPECIAL PLACE","3jhvRF5fTl0"
"HOUSE/LA06 GRAVES STRONG RECORD","zukhusby_0I"
"HOUSE/LA06 WHITNEY EXPERIENCES SHAPE US","NoChannel"
"HOUSE/LA06 WHITNEY RUNNING FOR CONGRESS","NoChannel"
"HOUSE/MA06 DCCC&MOULTON COMFORTABLE","NoMatch"
"HOUSE/MA06 DCCC&MOULTON OUR VETERANS","NoMatch"
"HOUSE/MA06 DCCC&MOULTON WHO IS THIS SETH MOULTON","mb_3N7RUl9s"
"HOUSE/MA06 MOULTON ASHAMED","qzTo1Fp81gU"
"HOUSE/MA06 MOULTON REAL CHANGE REV","C_ZVsptlMWY"
"HOUSE/MA06 TISEI MOULTON'S CAMPAIGN","g0R8l6Gz1-Q"
"HOUSE/MA06 TISEI WALL STREET DARLING","NoMatch"
"HOUSE/MA09 CHAPMAN WRONG TRACK","mnm2wodSt4Y"
"HOUSE/MA09 KEATING BREAK RANKS","kEf5unIyDBw"
"HOUSE/MD01 TILGHMAN PROBLEM IN WASHINGTON","j5XSwCLK8mA"
"HOUSE/MD06 DELANEY IN MY HOUSE","FXeWi-XrVnI"
"HOUSE/MD06 DELANEY THE MESS IN WASHINGTON","NoMatch"
"HOUSE/ME01 PINGREE SERVICE","aYcFAXBo7TE"
"HOUSE/ME02 CAIN AS A LEADER IN AUGUSTA","NoChannel"
"HOUSE/ME02 CAIN DOING THE RIGHT THING","NoChannel"
"HOUSE/ME02 CAIN ENDORSED","NoChannel"
"HOUSE/ME02 CAIN FALSE ATTACK ADS","NoChannel"
"HOUSE/ME02 CAIN THE ATTACKS","NoChannel"
"HOUSE/ME02 DCCC&CAIN COMES DOWN TO TRUST","NoChannel"
"HOUSE/ME02 POLIQUIN DANGEROUS LIBERAL","NoChannel"
"HOUSE/ME02 POLIQUIN DANGEROUS LIBERAL REV","NoChannel"
"HOUSE/ME02 POLIQUIN HOW EXTEME","NoChannel"
"HOUSE/ME02 POLIQUIN OUR MAINE CANDIDATE REV","NoChannel"
"HOUSE/ME02 POLIQUIN PROTECT SOCIAL SECURITY AND MEDICARE","NoChannel"
"HOUSE/ME02 POLIQUIN UNPREPARED","NoChannel"
"HOUSE/MI03 GOODRICH MAVERICK LIBERTARIAN","TkdOzWMBTF4"
"HOUSE/MI04 MOOLENAAR THEIR OWN MONEY","NoMatch"
"HOUSE/MI06 CLEMENTS MAN ON THE MOON","NoChannel"
"HOUSE/MI06 CLEMENTS WHAT HAPPENED TO FRED UPTON","NoChannel"
"HOUSE/MI06 HEDGE WORKING MIDDLE CLASS","NoChannel"
"HOUSE/MI06 UPTON CARES","rBKlCMnlAWY"
"HOUSE/MI06 UPTON LIES AND MORE LIES","6xCV-i4wP00"
"HOUSE/MI06 UPTON LOTS OF NOISE","8WLRLNgxI0Q"
"HOUSE/MI06 UPTON PAIN AND HARDSHIP","QM8ijgEv8AM"
"HOUSE/MI06 UPTON THIS IS BROOKE","VeA5pTttQwI"
"HOUSE/MI07 BYRNES HEIGHT OF DECEPTION","NoChannel"
"HOUSE/MI07 BYRNES WALBERG MAKES WHAT","NoChannel"
"HOUSE/MI07 BYRNES WALBERG SALARY","NoChannel"
"HOUSE/MI07 BYRNES WORST TYPE OF POLITICIAN","NoChannel"
"HOUSE/MI07 WALBERG BETTER SCHOOLS","GddXqwm-2HQ"
"HOUSE/MI07 WALBERG CREATE JOBS","NoMatch"
"HOUSE/MI07 WALBERG EASY CHOICE","NoMatch"
"HOUSE/MI07 WALBERG INDEPENDENT WATCHDOG GROUPS","NoMatch"
"HOUSE/MI07 WALBERG IS SHE KIDDING","NoMatch"
"HOUSE/MI07 WALBERG WORRIED","NoMatch"
"HOUSE/MI08 BISHOP PROTECTED OUR CHILDREN","WCA1HONUqjA"
"HOUSE/MI08 SCHERTZING FAMILY FARM","NoChannel"
"HOUSE/MI08 SCHERTZING SOCIAL SECURITY SHOULD BE THERE","NoChannel"
"HOUSE/MI11 MCKENZIE BETH AYERS","3iPoxmnbobA"
"HOUSE/MI11 MCKENZIE FORECLOSURE KING","tcJ2wx_9H9s"
"HOUSE/MI11 TROTT AS A DAD","NrVWzxBefWE"
"HOUSE/MI11 TROTT DANGEROUS WORLD","NoMatch"
"HOUSE/MI11 TROTT DOESN'T GET IT","NoMatch"
"HOUSE/MI11 TROTT MY WHOLE LIFE","u5yX2-kRhKA"
"HOUSE/MI11 TROTT STEVE BANCROFT","NoMatch"
"HOUSE/MI14 PRUDEN LOOKING FOR SOMEONE","NoChannel"
"HOUSE/MN02 KLINE COST YOU MONEY","hXgEopHeBdM"
"HOUSE/MN02 KLINE LOVES TO SPEND YOUR MONEY","NoMatch"
"HOUSE/MN02 KLINE NOTHING GETS DONE","-XJUlr-ehuc"
"HOUSE/MN02 OBERMUELLER VOTE THEM OUT","wW-HihLyLmc"
"HOUSE/MN03 PAULSEN CAMPING","NoMatch"
"HOUSE/MN03 PAULSEN HUMAN TRAFFICKING","NoMatch"
"HOUSE/MN06 BACHMANN GREAT NEWS","NoChannel"
"HOUSE/MN07 PETERSON MOST POLITICIANS","hYLIJ-epPd4"
"HOUSE/MN07 PETERSON MY OPPONENTS","9lHwHrtzaUQ"
"HOUSE/MN07 PETERSON STEVE WILLIAMS","ePyBx9JlY5c"
"HOUSE/MN07 PETERSON TIM SWENSON","2Fa9najMzJ4"
"HOUSE/MN07 WESTROM FAMILY FARM","NoChannel"
"HOUSE/MN08 NOLAN IT HAPPENED HERE","NoMatch"
"HOUSE/MN08 NOLAN PATTY YOREK","TE-LcZSaxjk"
"HOUSE/MN08 NOLAN PHIL OLSON","BCFmD7BzTNg"
"HOUSE/MN08 NOLAN SMEAR CAMPAIGN","NoMatch"
"HOUSE/MN08 NOLAN SOME CHOOSE BICKERING AND GRIDLOCK","0p9FhBl5Wg0"
"HOUSE/MN08 NOLAN WASHINGTON CAN'T SEEM TO SEE IT","Ghp2kPVpUIQ"
"HOUSE/MO07 LONG FED UP","NoChannel"
"HOUSE/MO08 SMITH GROWING UP IN A SMALL TOWN","NoChannel"
"HOUSE/MO08 STOCKER GREW UP","NoMatch"
"HOUSE/MO08 STOCKER REALLY FAST","NoMatch"
"HOUSE/MO08 STOCKER REALLY FAST REV","NoMatch"
"HOUSE/MS03 MAGEE DEEP WATER HORIZON OIL SPILL","NoChannel"
"HOUSE/MS03 MAGEE TIME IN OFFICE","NoChannel"
"HOUSE/MT01 LEWIS MONTANA ROOTS","NoChannel"
"HOUSE/MT01 LEWIS MY FAMILY","NoChannel"
"HOUSE/MT01 LEWIS THE JOB","NoChannel"
"HOUSE/MT01 LEWIS THIS IS DONNA JEAN","NoChannel"
"HOUSE/MT01 LEWIS THIS LAND IS YOUR LAND","NoChannel"
"HOUSE/MT01 NRCC&ZINKE THE RIGHT CONSERVATIVE","86LVPQ9dk8g"
"HOUSE/MT01 ZINKE 1988","6D2tDYGsgLw"
"HOUSE/MT01 ZINKE 2004","ldzHdelhH90"
"HOUSE/MT01 ZINKE DAVID KEENE","rVgrKliZ_G8"
"HOUSE/MT01 ZINKE HOLDER OF TWO MASTERS DEGREES","NoMatch"
"HOUSE/MT01 ZINKE NAVY SEAL","h1AijIXPps4"
"HOUSE/NC02 AIKEN GOOD INTENTIONS","fHro0yFNeKo"
"HOUSE/NC06 FJELD CLEAR CHOICE","A5yvmb2_4HU"
"HOUSE/NC06 FJELD DRESS UP IN A WHITE COAT","NoMatch"
"HOUSE/NC06 WALKER ANOTHER NEGATIVE AD","GJU8Jk1QbhA"
"HOUSE/NC06 WALKER DIFFERENT","MItu0LubSw4"
"HOUSE/NC06 WALKER SPENT HIS LIFE","04wfxf7txz8"
"HOUSE/NC13 CLEARY DESERVE 15","NoMatch"
"HOUSE/NC13 CLEARY LISTEN 15","NoMatch"
"HOUSE/NC13 HOLDING FROM THE BEGINNING","-FU48jvvRM0"
"HOUSE/NC13 HOLDING US ATTORNEY","toxJ6K3kFpg"
"HOUSE/ND01 CRAMER COMMON SENSE","xutd8gM_fMw"
"HOUSE/ND01 CRAMER GRAND FORKS HERALD","cuHYyqDhnjU"
"HOUSE/ND01 CRAMER HONORED","NzeNleMeFBg"
"HOUSE/ND01 CRAMER NATIONAL ECONOMY","D9RKfQDoPzQ"
"HOUSE/ND01 CRAMER OUR SENIORS","_xhYnAUArXY"
"HOUSE/ND01 CRAMER OUR VETERANS","TTcKQ3LZtc4"
"HOUSE/ND01 CRAMER WORKED AGAINST","NdypNxxC5lo"
"HOUSE/ND01 SEAMAN REAL CHANGE","NoChannel"
"HOUSE/ND01 SINNER CRAMER VIOLATED THE LAW","ia-GuotN9bY"
"HOUSE/ND01 SINNER LONG WAY FROM WASHINGTON","lxU1RIa5Enc"
"HOUSE/ND01 SINNER MY DAD","0o8YJm70OwM"
"HOUSE/ND01 SINNER TELEGRAM","CXZEJRh5Tuc"
"HOUSE/NE02 ASHFORD LAST ELECTION","NoMatch"
"HOUSE/NE02 ASHFORD MY DAD","X98VUvaknww"
"HOUSE/NE02 ASHFORD RUNNING","RGeZnXJbRNU"
"HOUSE/NE02 ASHFORD TERRY WILL SAY ANYTHING","_YouijHqgf8"
"HOUSE/NE02 ASHFORD TIME","J7guAKxp_DU"
"HOUSE/NE02 ASHFORD TOO MANY IN CONGRESS","PtTlNXDMZRk"
"HOUSE/NE02 DCCC&ASHFORD COMPLETELY DESPERATE","MrXcLMio-yA"
"HOUSE/NE02 NRCC&TERRY PASTOR HARRY WALLER","1iJpiKFCurU"
"HOUSE/NE02 TERRY&NRCC OBAMACARE","dOZwa8DsOGU"
"HOUSE/NE02 TERRY AMERICA'S UNIFORMS","-Av_T4m2uow"
"HOUSE/NE02 TERRY ANDREA","NoMatch"
"HOUSE/NE02 TERRY BAD GUYS","d12z677QSGc"
"HOUSE/NE02 TERRY BRAD ASHFORD SAYS","MkNGnsapQQc"
"HOUSE/NE02 TERRY FIGHTING","4NnGxqDIFnw"
"HOUSE/NE02 TERRY FUNDAMENTALLY TRANSFORMING","Oz7xBhwPbcw"
"HOUSE/NE02 TERRY ONE BULLET","ZIK-o6JaCN0"
"HOUSE/NE02 TERRY TIMOTHY F JOHNSON","n6MqAYQVsEc"
"HOUSE/NE02 TERRY WILLIAM KING JR","kwEZRYMoco4"
"HOUSE/NH01 GUINTA LYING","pZslVFVb4i8"
"HOUSE/NH01 GUINTA WHO SHE STANDS FOR","idonXvt1ULI"
"HOUSE/NH01 NRCC&GUINTA MORGAN AND GINNY","-kOw0aRNzMg"
"HOUSE/NH01 NRCC NANCY PELOSI'S DEMOCRATS","NoChannel"
"HOUSE/NH01 SHEA-PORTER BACK IN THE FIFTIES REV","2ZEjLNrVPGA"
"HOUSE/NH01 SHEA-PORTER MINIMUM WAGE JOBS","a-ugVB391GQ"
"HOUSE/NH01 SHEA-PORTER SNOOPING","NoMatch"
"HOUSE/NH02 DCCC&KUSTER SONIA PRINCE","2ce7jbk5uas"
"HOUSE/NH02 GARCIA CHRISTINE PETERS","NoMatch"
"HOUSE/NH02 GARCIA STATE INCOME TAX","1lXS_K4KNqo"
"HOUSE/NH02 KUSTER ALL ABOUT","NoMatch"
"HOUSE/NH02 KUSTER SANDRA MATHESON","DTRxsy-Q2P8"
"HOUSE/NH02 KUSTER TED CRUZ","CPDd-vbEHGo"
"HOUSE/NH02 KUSTER THE TRUTH","NoMatch"
"HOUSE/NH02 KUSTER WHAT REALLY CONCERNS ME","BcqPIeSK_Yw"
"HOUSE/NJ01 NORCROSS MOST RESPECTED COMMUNITY LEADERS","6DZxSfFX5Tk"
"HOUSE/NJ01 NORCROSS UP AND DOWN THIS RIVER","0K68tklDqDQ"
"HOUSE/NJ01 TOMASZEWSKI VOTE","NoChannel"
"HOUSE/NJ02 LOBIONDO THREATENED","NoMatch"
"HOUSE/NJ03 BELGARD TOM MACARTHUR'S WORLD","8-36_sqi_X0"
"HOUSE/NJ03 MACARTHUR BELGARD LIED 15","eFLLKfIJIkI"
"HOUSE/NJ03 MACARTHUR DISHONEST 15","NoMatch"
"HOUSE/NJ03 MACARTHUR DISHONEST POLITICIAN","eAGz0f85D2w"
"HOUSE/NJ03 MACARTHUR SUCCESS STORY","fxtTaRzDjys"
"HOUSE/NJ03 MACARTHUR THE TRUTH","DzglKaXEkUU"
"HOUSE/NJ05 GARRETT SEND HIM TO WASHINGTON","NoMatch"
"HOUSE/NJ05 GARRETT WHAT'S WITH ROY CHO","NoMatch"
"HOUSE/NM01 FRESE AFFORDABLE CARE ACT","NoChannel"
"HOUSE/NM01 FRESE FREE THE ECONOMY 60","NoChannel"
"HOUSE/NM01 FRESE LOST FAITH","NoChannel"
"HOUSE/NM01 FRESE MOTHER IN LAW 60","NoChannel"
"HOUSE/NM01 GRISHAM THELMA WEST","gY7cag7QD_E"
"HOUSE/NM01 GRISHAM YOU HEAR IT EVERYDAY","Oq96U2SxAy0"
"HOUSE/NM02 LARA DOROTHY PERKOWSKI","NoChannel"
"HOUSE/NM02 LARA FIFTH GENERATION NEW MEXICAN","NoChannel"
"HOUSE/NM02 LARA MY DAD MY MOM","NoChannel"
"HOUSE/NM02 LARA SPENT HER CAREER","NoChannel"
"HOUSE/NM02 PEARCE LARA'S ATTACKS","NoMatch"
"HOUSE/NM02 PEARCE NOT SUPPOSED TO BE THIS WAY","NoMatch"
"HOUSE/NM02 PEARCE OUR NEIGHBOR","NoMatch"
"HOUSE/NM02 PEARCE WANTS OUR VOTE","NoMatch"
"HOUSE/NM02 PEARCE WHO IS ROXANNE LARA","NoMatch"
"HOUSE/NV03 BILBRAY CAROLINE","S1YRsTOygcU"
"HOUSE/NV03 BILBRAY STRUGGLE","dFclOZkO_eY"
"HOUSE/NV03 HECK ARGUING","YXmeGgg9YD0"
"HOUSE/NV03 HECK GETTING THINGS DONE","RV4r_hWhgow"
"HOUSE/NV03 HECK IN TIMES OF CRISIS","VKDat6gESAk"
"HOUSE/NV03 HECK MARIA TACKETT","MGGFBKXAXnw"
"HOUSE/NV03 HECK OUR DAD","TqHePmEoZx0"
"HOUSE/NV04 HARDY ONE CANDIDATE","1st9M6UDKvE"
"HOUSE/NV04 HORSFORD ATTACK ADS","NoMatch"
"HOUSE/NV04 HORSFORD FIGHT FOR THEM","PIF347QZ2K4"
"HOUSE/NY01 BISHOP FBI","AGZ4ciA7Mzw"
"HOUSE/NY01 BISHOP RIGHT WING SMEAR","GymPUCeEy1A"
"HOUSE/NY01 DCCC&BISHOP TOXIC WASTE","NoMatch"
"HOUSE/NY04 RICE 2005 CAMPAIGN AD","1vXc97-Kzy0"
"HOUSE/NY04 RICE PROBLEMS","5hjjfMe0Hro"
"HOUSE/NY04 RICE THE CHOICE IS CLEAR","iQhrFHHQJT8"
"HOUSE/NY11 DCCC&RECCHIA CRUCIAL MEETING","NoChannel"
"HOUSE/NY18 HAYWORTH PHONY BALONEY","vQ-TMwP8OZU"
