"creative","uid"
"HOUSE/NY18 HAYWORTH PHONY BALONEY 15","NoMatch"
"HOUSE/NY18 HAYWORTH WILL","9r1DuHYhDtU"
"HOUSE/NY18 MALONEY AGREE","A6m85ka4pxg"
"HOUSE/NY18 MALONEY MIDDLE CLASS 15","NoMatch"
"HOUSE/NY18 MALONEY MY DAD","KK2vrQBG2yg"
"HOUSE/NY18 MALONEY SHE'S BACK","yU7ru2uY6XQ"
"HOUSE/NY18 MALONEY SHE'S BACK REV","NoMatch"
"HOUSE/NY18 MALONEY TEA PARTY POLITICIAN 15","NoMatch"
"HOUSE/NY19 ELDRIDGE A DIME","C-nU2NqIQSc"
"HOUSE/NY19 ELDRIDGE EVERYDAY","602Pdnpq7lU"
"HOUSE/NY19 ELDRIDGE IN THE NEXT FEW MONTHS","GCZfUXXS5D8"
"HOUSE/NY19 ELDRIDGE NOT LOOKING OUT FOR US","atPXvzXf7OM"
"HOUSE/NY19 ELDRIDGE RESPECT","QVelU7fZPzE"
"HOUSE/NY19 ELDRIDGE RIGHT NOW","YW4Bx4pRM4Y"
"HOUSE/NY19 ELDRIDGE THINK YOU KNOW CHRIS GIBSON","1NdA9rz93b8"
"HOUSE/NY19 ELDRIDGE THINK YOU KNOW CHRIS GIBSON REV","v7tA4ZbtXeU"
"HOUSE/NY19 ELDRIDGE TRUTH","qsMvQEdlGCU"
"HOUSE/NY19 GIBSON CALLED UPSTATE HOME 60","SOaTg2oDYrs"
"HOUSE/NY19 GIBSON KALEIGH AHERN","NoMatch"
"HOUSE/NY19 GIBSON KALEIGH AHERN 60","uQOz6etH42Q"
"HOUSE/NY19 GIBSON LIFE OF SERVICE","ybJtNfJK68U"
"HOUSE/NY19 GIBSON LIVING HERE","-VvpQg9rZ-U"
"HOUSE/NY19 GIBSON PROFITING","C_IpGDWWqgo"
"HOUSE/NY19 GIBSON THINK YOU KNOW SEAN ELDRIDGE 15","KoyHCBPT45A"
"HOUSE/NY19 NRCC&GIBSON ANNE MARIE MINK","i21eJakWkb4"
"HOUSE/NY20 FISCHER PUBLIC SERVICE ANNOUNCEMENT","-V6cBQxk6so"
"HOUSE/NY20 FISCHER PUBLIC SERVICE ANNOUNCEMENT 60","21Nluwyzok4"
"HOUSE/NY20 TONKO MAKE PROGRESS","NoMatch"
"HOUSE/NY21 STEFANIK&NRCC WOOLF'S POSITION ON SOCIAL SECURITY","lsCx8tKnUJQ"
"HOUSE/NY21 STEFANIK GREAT EXPERIENCE","LrAm9oYaDLI"
"HOUSE/NY21 STEFANIK MY GENERATION","KO7Uc3r0JTY"
"HOUSE/NY21 STEFANIK NEW IDEAS","wN2sKqIczHo"
"HOUSE/NY21 STEFANIK PROTECT AND PRESERVE","0OKUJlE6mlI"
"HOUSE/NY21 WOOLF AS FAR AS WE CAN TELL","NoChannel"
"HOUSE/NY21 WOOLF FIGHTING FOR YOUR FAMILY","NoChannel"
"HOUSE/NY21 WOOLF GOOD JOBS IN THE NORTH COUNTRY","NoChannel"
"HOUSE/NY21 WOOLF IT'S TRUE","NoChannel"
"HOUSE/NY21 WOOLF NEW NAME","NoChannel"
"HOUSE/NY21 WOOLF WALKED ACROSS THE AISLE","NoChannel"
"HOUSE/NY23 REED DOUBLE TROUBLE","jO1s3qT6duQ"
"HOUSE/NY23 REED FAR OUT","NoMatch"
"HOUSE/NY23 REED HER WORDS","-pftOu8iTV8"
"HOUSE/NY23 REED HOW DO YOU KNOW","Ebh4QNLBzR4"
"HOUSE/NY23 REED HURTING US","DgOfeOS6rc4"
"HOUSE/NY23 REED LISTENING","YwvXUduyI-k"
"HOUSE/NY23 REED MY BROTHER 60","ppIs9cfgCPI"
"HOUSE/NY23 ROBERTSON COUNTRY FIRST","NoMatch"
"HOUSE/NY23 ROBERTSON FALSE ATTACKS","m6H01FAxVo8"
"HOUSE/NY23 ROBERTSON FALSE NEGATIVE TV ADS","NoMatch"
"HOUSE/NY23 ROBERTSON REED GONE TO BAT FOR EVERYONE","NoMatch"
"HOUSE/NY23 ROBERTSON SMALL HOUSE","6vjPimxjNFs"
"HOUSE/NY23 ROBERTSON THOUSANDS OF OLDER AMERICANS","NoMatch"
"HOUSE/NY24 DCCC&MAFFEI KRISTINA SHERMAN","9xzyGeWsHrE"
"HOUSE/NY24 KATKO APPREONNA SULLIVAN","NoChannel"
"HOUSE/NY24 KATKO BEBETTE YUNIS","NoChannel"
"HOUSE/NY24 KATKO CHANGE WASHINGTON","NoChannel"
"HOUSE/NY24 KATKO OBSESSED","NoChannel"
"HOUSE/NY24 KATKO ROBIN KATKO","NoChannel"
"HOUSE/NY24 MAFFEI ABOUT THESE STREETS","6m3eFC15LFI"
"HOUSE/NY24 MAFFEI ATTACKS SO FALSE","1glirKzkCOA"
"HOUSE/NY24 MAFFEI BILL CLINTON","NoMatch"
"HOUSE/NY24 MAFFEI IT TAKES A LOT","cmQVodQEkmg"
"HOUSE/NY24 MAFFEI KATKO LEFT A PISTOL","cmtwz41oLdg"
"HOUSE/NY24 MAFFEI KATKO LEFT A PISTOL REV","KN9s57K6yM0"
"HOUSE/NY24 MAFFEI LEMONADE STAND","Ok_tJO2OwWU"
"HOUSE/NY24 MAFFEI LIVELY DEBATE ABOUT THE ISSUES","DmcNyO9Yo60"
"HOUSE/NY24 MAFFEI NO TIME","mTYbFpThWbY"
"HOUSE/NY24 MAFFEI PUTTING US FIRST","KYNAYcyH_bg"
"HOUSE/NY24 NRCC&KATKO AWARDED","NoChannel"
"HOUSE/NY25 ASSINI THIS ELECTION","ZRCCxED7xkg"
"HOUSE/NY25 SLAUGHTER TOGETHER","NoMatch"
"HOUSE/OH01 KUNDRATA RETIRED LIEUTENANT COLONEL","eMA_q1TWWaI"
"HOUSE/OH05 LATTA WOULDN'T KNOW IT","daO-xwnoKFM"
"HOUSE/OH06 GARRISON SATISFIED","n1YVoeBL61E"
"HOUSE/OH06 JOHNSON CHILDHOOD HOME","NoMatch"
"HOUSE/OH06 JOHNSON FOR US","NoMatch"
"HOUSE/OH06 JOHNSON GETTING DESPERATE","NoMatch"
"HOUSE/OH06 JOHNSON LEADING THE WAY","NoMatch"
"HOUSE/OH08 BOEHNER BOB 60","NoMatch"
"HOUSE/OH08 BOEHNER CARLENE AND BOB ROBINSON","NoMatch"
"HOUSE/OH08 BOEHNER LEN","NoMatch"
"HOUSE/OH08 BOEHNER SOMETIMES I THINK","NoMatch"
"HOUSE/OH08 BOEHNER THIS PLACE","NoMatch"
"HOUSE/OH08 BOEHNER WHAT I LIKE ABOUT JOHN","NoMatch"
"HOUSE/OH12 TIBERI SON OF ITALIAN IMMIGRANTS","wIb71MMRRyU"
"HOUSE/OH12 TIBERI SON OF ITALIAN IMMIGRANTS 15","NoMatch"
"HOUSE/OH14 JOYCE POWER PLANT","BOT73GIBWro"
"HOUSE/OH14 JOYCE WHO IS MICHAEL WAGER","sqlUWvevsuE"
"HOUSE/OH14 WAGER JUST DAVE","NoChannel"
"HOUSE/OH15 STIVERS THEIR FUTURE","3BiYZNqrDY4"
"HOUSE/OK04 COLE DIFFICULT TIMES","S86ZyEtH5O4"
"HOUSE/OK04 COLE DIFFICULT TIMES 60","NoMatch"
"HOUSE/OK05 DOUGLAS GOES TO WORK","NoChannel"
"HOUSE/OK05 GUILD AMERICAN DREAM","NoChannel"
"HOUSE/OK05 RUSSELL CHANGE WASHINGTON REV","IchEBBc8snI"
"HOUSE/OK05 RUSSELL DEMOCRATS AND REPUBLICANS","NoMatch"
"HOUSE/OK05 RUSSELL FALSELY ATTACKED","NoMatch"
"HOUSE/OK05 RUSSELL FUTURE WORTH PROTECTING","47YBO9ZAqUY"
"HOUSE/OR02 WALDEN LISTENING","NoMatch"
"HOUSE/OR03 BLUMENAUER DRINKING WATER 15","NoMatch"
"HOUSE/OR03 BLUMENAUER REBUILD AMERICA 15","eOvGMXiMSo0"
"HOUSE/OR03 BLUMENAUER WE CAN MOVE FORWARD","HzRjGtubbcA"
"HOUSE/OR03 BLUMENAUER WISHES 15","NoMatch"
"HOUSE/OR05 SCHRADER BARN FULL OF ANIMALS","VnbzKuaTqag"
"HOUSE/PA03 KELLY BRIANNA COMMERFORD","3EnKl5lX1p4"
"HOUSE/PA03 KELLY THIS HOUSE","kgIdvlEXEz4"
"HOUSE/PA03 KELLY WHEN I WAS A BOY","rj5vZO-z8L4"
"HOUSE/PA05 TAYLOR WOMEN'S ISSUES","Ar5PI4DaiHk"
"HOUSE/PA06 COSTELLO CHRISTINE","uS9dfcTEZpw"
"HOUSE/PA06 COSTELLO DROPPED INSURANCE","NoMatch"
"HOUSE/PA06 COSTELLO FAILED POLICIES","NoMatch"
"HOUSE/PA06 TRIVEDI JOINED THE MARINES","WOWgzySePOc"
"HOUSE/PA08 FITZPATRICK OUR VETERANS","NoChannel"
"HOUSE/PA08 FITZPATRICK OUR VETERANS REV","NoChannel"
"HOUSE/PA08 FITZPATRICK SIX AMERICANS","NoChannel"
"HOUSE/PA10 BRION THIS LAND","tBLtDEbP6jA"
"HOUSE/PA10 MARINO AFFORDABLE CARE ACT","oBSyJXLkujw"
"HOUSE/PA10 TROIANO ZOO","NoChannel"
"HOUSE/PA12 ROTHFUS ANSWER IS SIMPLE","VK-zGxUegp4"
"HOUSE/PA12 ROTHFUS CANCER","XSvkony70Kg"
"HOUSE/PA12 ROTHFUS KEITH'S BOSS","AjWdyjgGhOg"
"HOUSE/PA12 ROTHFUS SIX VETERANS","9EkFCgm8fu4"
"HOUSE/PA16 PITTS POLITICAL GAMES","gfJoI-lJmQk"
"HOUSE/PA16 PITTS TIRED OF POLITICS AS USUAL","NoMatch"
"HOUSE/PA17 CARTWRIGHT THIS IS WASHINGTON","wzN1G8SmROc"
"HOUSE/RI01 CICILLINE ANDREA RYDER","PKggSrAld48"
"HOUSE/RI01 CICILLINE FOUGHT FOR THEM","bbtvA8ZWlF0"
"HOUSE/SC01 COLBERTBUSCH&SCDP ALWAYS HEAR","NoChannel"
"HOUSE/SC01 COLBERTBUSCH CHANGE","NoChannel"
"HOUSE/SC01 COLBERTBUSCH CHARACTER","NoChannel"
"HOUSE/SC01 COLBERTBUSCH CUT WASTE","NoChannel"
"HOUSE/SC01 COLBERTBUSCH INDEPENDENT","NoChannel"
"HOUSE/SC01 SANFORD&SCRP DISAGREEMENT","NoChannel"
"HOUSE/SC01 SANFORD THE DIFFERENCE","NoChannel"
"HOUSE/SC01 SANFORD VISION","NoChannel"
"HOUSE/SC01 SANFORD VOICES","NoChannel"
"HOUSE/SC05 MULVANEY MY DAD TOLD ME","mMxGiK9YjOo"
"HOUSE/SD01 NOEM LOSSES","aHf7wBEOBpg"
"HOUSE/SD01 NOEM WORKING FOR SOUTH DAKOTA","gsNZnSGk5X4"
"HOUSE/TN02 DUNCAN MY WIFE","NoMatch"
"HOUSE/TN02 DUNCAN PRACTICED LAW","NoMatch"
"HOUSE/TN03 HEADRICK CHICKAMAUGA LOCK","NoChannel"
"HOUSE/TN03 HEADRICK DISAPPOINTED","NoChannel"
"HOUSE/TN03 HEADRICK JERRY","NoChannel"
"HOUSE/TN03 HEADRICK RUNNING AGAINST","NoChannel"
"HOUSE/TN04 DESJARLAIS OBAMA NOT ON THE BALLOT","NoMatch"
"HOUSE/TN04 DOGGART GREATEST CHALLENGES","NoChannel"
"HOUSE/TN04 SHERRELL GROWING UP","NoChannel"
"HOUSE/TN04 TNDP&SHERRELL DOMESTIC VIOLENCE","NoChannel"
"HOUSE/TN04 TNDP&SHERRELL SORRY TO DISAPPOINT YOU","NoChannel"
"HOUSE/TN06 WINTON GRIDLOCK","NoChannel"
"HOUSE/TX15 HINOJOSA BEST PART","NoChannel"
"HOUSE/TX15 HINOJOSA FIRST ELECTED","NoChannel"
"HOUSE/TX15 ZAMORA AHORA CON ZAMORA","JI_lfUuwZq8"
"HOUSE/TX15 ZAMORA OVER 800,000 BABIES","fU5b5KuJX70"
"HOUSE/TX15 ZAMORA PAST 18 YEARS","tSQcccrFOJY"
"HOUSE/TX23 DCCC&GALLEGO WHO WILL PROTECT OUR BORDERS","NoMatch"
"HOUSE/TX23 GALLEGO IN THE MILITARY","NoMatch"
"HOUSE/TX23 GALLEGO PLAY FAIR","NoMatch"
"HOUSE/TX23 GALLEGO PUTTING TEXAS FIRST","NoMatch"
"HOUSE/TX23 HURD HAVE YOU HEARD","jUq15dtjYgI"
"HOUSE/TX27 FARENTHOLD LOST CONFIDENCE","qTeU0OO2Fn4"
"HOUSE/TX27 FARENTHOLD VOTING","N-ciMuGLx4k"
"HOUSE/TX27 REED AMERICAN DREAM","NoMatch"
"HOUSE/TX27 REED VETERANS DISABILITY BENEFITS","rZMntH6uU-c"
"HOUSE/UT01 MCALEER POLITICIANS IN WASHINGTON","NoChannel"
"HOUSE/UT01 MCALEER SERVE","NoChannel"
"HOUSE/UT04 LOVE AS OUR MAYOR","QDZrXbjPHuM"
"HOUSE/UT04 LOVE AUTUMN IN UTAH","uj8grbmS3u8"
"HOUSE/UT04 LOVE FEDERAL DEPARTMENT OF EDUCATION 15","NoMatch"
"HOUSE/UT04 LOVE GET AWAY FROM MY TRUCK","5pDIAqaLiZo"
"HOUSE/UT04 LOVE KITCHEN TABLE","vagZJERV_S8"
"HOUSE/UT04 LOVE OBAMA MAKE NO MISTAKE","I3VMYzNgD8s"
"HOUSE/UT04 LOVE ONE SIZE FITS ALL","xoWVWsl8hO4"
"HOUSE/UT04 LOVE STUDENT LOAN INDUSTRY 15","Z7L3V5bwzI0"
"HOUSE/UT04 LOVE THE TRUTH","79c8NPAy0ag"
"HOUSE/UT04 OWENS DEPARTMENT OF EDUCATION 15","NoChannel"
"HOUSE/UT04 OWENS GRIDLOCK 15","NoChannel"
"HOUSE/UT04 OWENS NO FEDERAL STUDENT LOANS","NoChannel"
"HOUSE/UT04 OWENS PRIVATIZING SOCIAL SECURITY","NoChannel"
"HOUSE/UT04 OWENS REAL CHOICE","NoChannel"
"HOUSE/UT04 OWENS SIXTH GENERATION UTAHN","NoChannel"
"HOUSE/UT04 OWENS SIXTH GENERATION UTAHN 15","NoChannel"
"HOUSE/UT04 OWENS SIXTH GENERATION UTAHN 15 REV","NoChannel"
"HOUSE/UT04 OWENS THIS RACE 15","NoChannel"
"HOUSE/UT04 OWENS THIS RACE 15 REV","NoChannel"
"HOUSE/UT04 OWENS UTAH VALUES","NoChannel"
"HOUSE/UT04 OWENS WORKING TWO JOBS","NoChannel"
"HOUSE/VA02 PATRICK CENTURY OF SERVICE","NoChannel"
"HOUSE/VA02 PATRICK FOR CENTURIES","NoChannel"
"HOUSE/VA02 PATRICK NATION'S UNIFORM","NoChannel"
"HOUSE/VA02 PATRICK PROGRESS","NoChannel"
"HOUSE/VA02 PATRICK TAKING CARE OF MY MOTHER","NoChannel"
"HOUSE/VA02 RIGELL ROUNDTABLE","8b7JKpCPFrs"
"HOUSE/VA02 RIGELL TERRI CAMPBELL","nIvquBnwWgE"
"HOUSE/VA07 BRAT BIG SPENDING POLITICIANS","NoMatch"
"HOUSE/VA07 BRAT TURMOIL","NoMatch"
"HOUSE/VA07 BRAT WASHINGTON IS BROKEN","NoMatch"
"HOUSE/VA07 TRAMMELL BIG DIFFERENCE","EhL-pi5U7c8"
"HOUSE/VA07 TRAMMELL LIVE ON THIS FARM","JHzALz19ZeY"
"HOUSE/VA10 COMSTOCK FRANK WOLF","3c3SVliCyRA"
"HOUSE/VA10 COMSTOCK REDUCE TAXES","No-zcUbekQA"
"HOUSE/VA10 DCCC&FOUST MAKE ABORTION ILLEGAL","iv-YscLpXuk"
"HOUSE/VA10 FOUST CREATIVELEY MISLEADING","gWW_ujBo7yk"
"HOUSE/VA10 FOUST CUT A LOT OF WASTE","qZWHDzbEBno"
"HOUSE/WA01 DELBENE CONGRESS IS A MESS","uVuxCtwvMv0"
"HOUSE/WA01 DELBENE THE BRIDGE COLLAPSE","gp2-XtiWXhk"
"HOUSE/WA04 NEWHOUSE BOLD CONSERVATIVE LEADER","NoMatch"
"HOUSE/WA05 PAKOOTAS HEATHER FOLEY","4j2TaLiwGA8"
"HOUSE/WA05 PAKOOTAS HEATHER FOLEY REV","vZuY7ee4Cgc"
"HOUSE/WA05 RODGERS BIGGEST CHALLENGES","s5r9gJAPFy0"
"HOUSE/WA05 RODGERS GREG BEVER","NoMatch"
"HOUSE/WA06 KILMER GO TO BAT FOR YOU","5ddflVaB6C4"
"HOUSE/WA08 REICHERT NATIONALLY RESPECTED SHERIFF","I0t8UqXpBWE"
"HOUSE/WI01 RYAN DISGRACEFUL","_rMWewBaE2E"
"HOUSE/WI01 RYAN MOM AND AUNT","TStFOILzRZE"
"HOUSE/WI01 RYAN STEP UP TO THE PLATE","vm4tALnRNGo"
"HOUSE/WI01 RYAN THE IRS","esyk9oRQ9LM"
"HOUSE/WI06 GROTHMAN POLITICIANS LOVE TWO THINGS","7Y8xrOTjEI0"
"HOUSE/WI06 GROTHMAN ROLLS UP HIS SLEEVES","UFM5OeoqDW8"
"HOUSE/WI06 GROTHMAN THAT TIME OF YEAR","cb2Tlmw63Qw"
"HOUSE/WI06 GRUETT SPONSOR A BILL 15 REV","NoChannel"
"HOUSE/WI06 HARRIS TOO BIZARRE","NoChannel"
"HOUSE/WI08 GRUETT CLEAR CHOICE 15","jYwX1oWoOQs"
"HOUSE/WI08 GRUETT SPONSOR A BILL 15","NoMatch"
"HOUSE/WI08 RIBBLE EVERY AMERICAN","hVkOBqgBr_A"
"HOUSE/WV02 CASEY CAREER POLITICIAN","NoChannel"
"HOUSE/WV02 CASEY CHAMELEON","NoChannel"
"HOUSE/WV02 CASEY FOR 20 YEARS","NoChannel"
"HOUSE/WV02 CASEY GREW UP","NoChannel"
"HOUSE/WV02 CASEY MISLEADING ADS","NoChannel"
"HOUSE/WV02 CASEY MOONEY ATTACK ADS","NoChannel"
"HOUSE/WV02 CASEY MOONEY FROM MARYLAND","NoChannel"
"HOUSE/WV02 CASEY MY DAD","NoChannel"
"HOUSE/WV02 CASEY SUE HECHT","NoChannel"
"HOUSE/WV02 MOONEY BARACK OBAMA'S CANDIDATE","5CAdm6VcOwA"
"HOUSE/WV02 MOONEY LATE TERM ABORTION","ymHfZfUl27I"
"HOUSE/WV02 MOONEY MIKE HUCKABEE","URkM2jK_G3Q"
"HOUSE/WV02 MOONEY NOT ON THE BALLOT","GpFAF_8uYSw"
"HOUSE/WV02 MOONEY ON OUR SIDE","FHtLGz7LSUk"
"HOUSE/WV02 MOONEY STANDING UP TO OBAMA","xFmoesvya6k"
"HOUSE/WV02 NRCC&MOONEY LEAVE A MESSAGE","9aMhBfrIU88"
"HOUSE/WV03 JENKINS&NRCC EARLENE ANGLIN","mXrcEpWVHqc"
"HOUSE/WV03 JENKINS&NRCC IF BARACK OBAMA HAD HIS WAY","WjPainZF5Mc"
"HOUSE/WV03 JENKINS EACH DAY","S_Lm0xTej0I"
"HOUSE/WV03 JENKINS GOTTEN RICH","JnxY9d6FDak"
"HOUSE/WV03 JENKINS HIDING","PwwuK1-YRds"
"HOUSE/WV03 JENKINS ON A FIXED INCOME","Vz4K4UrNmMc"
"HOUSE/WV03 JENKINS WHEN HE THINKS NO ONE IS WATCHING","7XSs8C0s_KU"
"HOUSE/WV03 RAHALL BETTY HARRAH","NoMatch"
"HOUSE/WV03 RAHALL BILLIONAIRE BACKERS","NoMatch"
"HOUSE/WV03 RAHALL BLACK LUNG BENEFITS","NoMatch"
"HOUSE/WV03 RAHALL CECIL","NoMatch"
"HOUSE/WV03 RAHALL HERE WE STAND","NoMatch"
"HOUSE/WV03 RAHALL JENKINS MINIMUM WAGE","G_uVPCsbEqI"
"HOUSE/WV03 RAHALL JOE MANCHIN","6gEJomnsj0Q"
"HOUSE/WV03 RAHALL NEW YORK CITY","NoMatch"
"HOUSE/WV03 RAHALL RONALD AND LIBBY PAULEY","NoMatch"
"HOUSE/WV03 RAHALL SECOND AMENDMENT","NoMatch"
"HOUSE/WV03 RAHALL SPECIAL PLACE","NoMatch"
"HOUSE/WV03 RAHALL STRONG VOICE FOR COAL MINERS","NoMatch"
"HOUSE/WV03 RAHALL THEY'RE BACK","9dm8as9KveM"
"HOUSE/WV03 RAHALL WHEN MONEY TALKS","qy5PTqy0nWs"
"HOUSE/WV03 RAHALL WHO CAN YOU COUNT ON","NoMatch"
"USSEN/AK AKDP&BEGICH WHATEVER IT TAKES","0Q36RVHKzQs"
"USSEN/AK BEGICH AD IDEAS","hdGYDt7AF24"
"USSEN/AK BEGICH AVIATION","hxFGToX34jw"
"USSEN/AK BEGICH BELLA","Axwxi7p9ov0"
"USSEN/AK BEGICH BRYAN BOX","3Ad8gNA6stg"
"USSEN/AK BEGICH CHEAP","NeWBOWdZ92M"
"USSEN/AK BEGICH CLOUT","NoMatch"
"USSEN/AK BEGICH CRIME SCENE","NoMatch"
"USSEN/AK BEGICH DON'T LET HIM","NoMatch"
"USSEN/AK BEGICH FATHER TO SON 60","fnVDAfkLHK8"
"USSEN/AK BEGICH FRIGHTENING","N0IYCGBKY6w"
"USSEN/AK BEGICH JUST GOT HERE","M0ds6ldi7Mw"
"USSEN/AK BEGICH MARGIE","xRwJxwfFxaU"
"USSEN/AK BEGICH OUTSIDER AD","FMArORE6D3o"
"USSEN/AK BEGICH RIPPED OFF","DQuqQWG43ns"
"USSEN/AK BEGICH ROAD","N6LXyj62FVQ"
"USSEN/AK BEGICH TERRY","zC-UBP6IMEo"
"USSEN/AK BEGICH THIS SPOT","NoMatch"
"USSEN/AK BEGICH TOOK ON OBAMA","nbNAvbuRgE4"
"USSEN/AK BEGICH WE WON","MacCj2bCNYg"
"USSEN/AK BEGICH WHO'S BEHIND","m5JFAMJ-9Uk"
"USSEN/AK BEGICH WORK WITH ANYONE","_WtLKmT25_w"
"USSEN/AK SULLIVAN&NRSC JULIE","xLugQ-sThnE"
"USSEN/AK SULLIVAN ADVANCING ALASKA'S INTERESTS","YQL3QfGkfNQ"
"USSEN/AK SULLIVAN ALASKA'S TEACHERS","OSOQw2ccfKU"
"USSEN/AK SULLIVAN BEGICH'S FRIENDS","pW34DdIfCvI"
"USSEN/AK SULLIVAN COMMITTED","N42fO_JUNpI"
"USSEN/AK SULLIVAN DESPERATE","NoMatch"
"USSEN/AK SULLIVAN ELAINA","wumIqinW404"
"USSEN/AK SULLIVAN LAME TRICKS","sveaZ4OpOo8"
"USSEN/AK SULLIVAN MEGHAN","NoMatch"
"USSEN/AK SULLIVAN RETURNING THE FAVOR","kHPzTMT0Clk"
"USSEN/AK SULLIVAN RIGHT WITH ALASKA","NoMatch"
"USSEN/AK SULLIVAN ROOTS","9xgc2GHRQFY"
"USSEN/AK SULLIVAN RUNNING","tqrIHISHyUE"
"USSEN/AK SULLIVAN SEE THINGS DIFFERENTLY","pRRaiV06YUA"
"USSEN/AK SULLIVAN SHAMEFUL","NoMatch"
"USSEN/AK SULLIVAN STAND UP TO OBAMA","2T7qWr9eZ9w"
"USSEN/AK SULLIVAN STEELFAB","60pD5YEEyN4"
"USSEN/AK SULLIVAN VALUES 60","NoMatch"
"USSEN/AL SESSIONS&ALRP PROTECT","NoChannel"
"USSEN/AL SESSIONS REPUBLICAN LEADERSHIP","NoChannel"
"USSEN/AR BPAC BACK NINE","NoChannel"
"USSEN/AR COTTON&NRSC INDOOR PLUMBING","D5GQn0feKxg"
"USSEN/AR COTTON&NRSC SERVE","xZXUZXwg6BE"
"USSEN/AR COTTON BALLOT","R8OqBBi9nzY"
"USSEN/AR COTTON DECISIONS","wuJKO_fa5V8"
"USSEN/AR COTTON DEEP ROOTS","_x2-lV7vA_8"
"USSEN/AR COTTON EARLY VOTING HAS BEGUN 20","NoMatch"
"USSEN/AR COTTON FAMILY FARM","q47stRkYoO8"
"USSEN/AR COTTON GOOD FOR THE GOOSE","NoMatch"
"USSEN/AR COTTON HEAD ON","WD-o138RG9k"
"USSEN/AR COTTON INFANTRY","NoMatch"
"USSEN/AR COTTON LEAP OF FAITH","NoMatch"
"USSEN/AR COTTON LEAP OF FAITH 60","tgP-05BxfrU"
"USSEN/AR COTTON PRYOR ON TV","RbsJoRiwZaA"
"USSEN/AR COTTON RECOVERY","xKqIyk8E94A"
"USSEN/AR COTTON RETIRE PRYOR","K1l4jgRDvco"
"USSEN/AR COTTON SGT NORTON","PB-y5RdFCik"
"USSEN/AR COTTON STILL DOESN'T GET IT","M3EyrCLXGkg"
"USSEN/AR COTTON THREE DOLLAR BILL","NoMatch"
"USSEN/AR COTTON TOE THE LINE","u467mtj3mBk"
"USSEN/AR PRYOR&ARDP GENERAL WES CLARK","NDoaN7pHDhs"
"USSEN/AR PRYOR&ARDP MEDICARE PROTECTION ACT","HxVSbIdzcjw"
"USSEN/AR PRYOR&ARDP ONLY ONE DISASTER RELIEF","JehxaVGSILQ"
"USSEN/AR PRYOR&ARDP PARTISAN GAMES","V_n-wl9wwt0"
"USSEN/AR PRYOR 24 BILLION","NoMatch"
"USSEN/AR PRYOR AGRICULTURAL DUST","fVB9VOQLhUY"
"USSEN/AR PRYOR AMERICAN JOBS","C6OYWChbZW0"
"USSEN/AR PRYOR ARKANSAS WORKS","NoMatch"
"USSEN/AR PRYOR BLESSING","ONk6qXfpHNU"
"USSEN/AR PRYOR COURTNEY","43OwZnK1ddQ"
"USSEN/AR PRYOR DIAGNOSED","W1-n2g2e0BA"
"USSEN/AR PRYOR END","cZDgMvpBmW4"
"USSEN/AR PRYOR FLOOD","NoMatch"
"USSEN/AR PRYOR FORDYCE","HIJ0lHf4CLg"
"USSEN/AR PRYOR LINDA","MiskpgUMfT0"
"USSEN/AR PRYOR LISTEN TO PEOPLE","lSCMlTp5byg"
"USSEN/AR PRYOR NORTH STAR","NoMatch"
"USSEN/AR PRYOR OLD BOOT","wMGK3Rsuc3Q"
"USSEN/AR PRYOR OUTBREAK","K-DwHaEwXfY"
"USSEN/AR PRYOR RECORD","7_pDvk-b8nY"
"USSEN/AR PRYOR RESPONSIBLE","695VXm8knsQ"
"USSEN/AR PRYOR RETURNING THE FAVOR","C23xnuKsLAY"
"USSEN/AR PRYOR RUNNING 60","NoMatch"
"USSEN/AR PRYOR SEVENTY","NoMatch"
"USSEN/AR PRYOR SILLY","NoMatch"
"USSEN/AR PRYOR TOUGH BUT FAIR","NoMatch"
"USSEN/AR PRYOR WHAT I BELIEVE","dpGPymn9fsI"
"USSEN/CO GARDNER&NRSC BROKE HIS WORD","NoMatch"
"USSEN/CO GARDNER&NRSC HOW OFTEN","TziO7ZniOxI"
"USSEN/CO GARDNER&NRSC NEXT GENERATION ENERGY","NPKzyophmNw"
"USSEN/CO GARDNER ABSENT","6VCGgjdbxFI"
"USSEN/CO GARDNER BETTER COURSE","BuETJw-tHUw"
"USSEN/CO GARDNER BIG CITY","7GgKlYryEIY"
"USSEN/CO GARDNER BIG SHOES","RH81PBdnv1c"
"USSEN/CO GARDNER ENDORSEMENTS","_83itMH7la0"
"USSEN/CO GARDNER FIX IT","B5FqULnVEWI"
"USSEN/CO GARDNER FOR YOU","IdStz3wFObQ"
"USSEN/CO GARDNER MAILBOX","kqfar9h-_Hs"
"USSEN/CO GARDNER NICE GUY","CdLNIGv50WQ"
"USSEN/CO GARDNER RIGHT HERE","9qvjS6I5iDE"
"USSEN/CO GARDNER ROSIE","Pz8WYAGCE2o"
"USSEN/CO SHOGAN EYEBALLS","NoChannel"
"USSEN/CO SHOGAN POLITICAL SURGERY","NoChannel"
"USSEN/CO UDALL&DSCC CALENDAR","kVeVTMFGK7k"
"USSEN/CO UDALL&DSCC CHAMPION","EdPo6Qli_ZY"
"USSEN/CO UDALL&DSCC JOB","dOsnxstP25w"
"USSEN/CO UDALL ALREADY","UrGcd8M6ec0"
"USSEN/CO UDALL BACKWARDS","26sbLmONB2Y"
"USSEN/CO UDALL COLORADO","h8BCgJyOxkQ"
"USSEN/CO UDALL DENIALS","XYWBSdFt9RQ"
"USSEN/CO UDALL DIRECTLY FROM ME","m_V4POLXJV8"
"USSEN/CO UDALL FLASH FLOODING","5hbUmeOWWkU"
"USSEN/CO UDALL FREEDOM","ioHbADdXpKQ"
"USSEN/CO UDALL HISTORY","Uw9TjLdpew0"
"USSEN/CO UDALL IN HERE","NLcfTIrzX2M"
"USSEN/CO UDALL RECORD","EooSyESO7sw"
"USSEN/CO UDALL RESPECT","RtVdT5xPUy0"
"USSEN/CO UDALL SUCCEED","oh71wLfUOwk"
"USSEN/CO UDALL TRUE","vnKGBlE8qQU"
"USSEN/DE COONS AMERICAN MANUFACTURING","l3IqdkCq9Hg"
"USSEN/DE COONS CHILD ABUSE","NoMatch"
"USSEN/DE COONS COMMON GROUND","NoMatch"
"USSEN/DE COONS GET ALONG","lOfpxnMjjfA"
"USSEN/GA NUNN&GAFEC DECENCY","bG7XMfWTeFw"
"USSEN/GA NUNN&GAFEC DO RIGHT","jICNm2S9AOg"
"USSEN/GA NUNN&GAFEC KANNAPOLIS","NoMatch"
"USSEN/GA NUNN&GAFEC LYING","NoMatch"
"USSEN/GA NUNN&GAFEC MANAGER","NoMatch"
"USSEN/GA NUNN&GAFEC MOST OF MY CAREER","5tF0y17qN1U"
"USSEN/GA NUNN&GAFEC OUT OF CONTEXT","NoMatch"
"USSEN/GA NUNN&GAFEC PILLOWTEX","NoMatch"
"USSEN/GA NUNN&GAFEC PILLOWTEX 60","eHhbrOjZSgo"
"USSEN/GA NUNN AMERICAN INGENUITY","NoMatch"
"USSEN/GA NUNN BIASED","7BNzoQWdNS8"
"USSEN/GA NUNN BRIDGE","jNjOLQX2A3o"
"USSEN/GA NUNN DISCOVERY PROGRAM","tTY6JfCh3OI"
"USSEN/GA NUNN END THESE CUTS","NoMatch"
"USSEN/GA NUNN GONE","NoMatch"
"USSEN/GA NUNN HAVE YOU SEEN THIS PICTURE","SB11dMrnY-U"
"USSEN/GA NUNN JACK KINGSTON","NoMatch"
"USSEN/GA NUNN JACKPOT","pwLOyhdLFTw"
"USSEN/GA NUNN MANAGER 60","NoMatch"
"USSEN/GA NUNN MY WHOLE CAREER","fssW7TnYAwE"
"USSEN/GA NUNN PROUD OF IT","UKYdU-owVQw"
"USSEN/GA NUNN REAL","bTREGpKHHKQ"
"USSEN/GA NUNN REV DR GERALD DURLEY","NoMatch"
"USSEN/GA NUNN WARTHOG","NoMatch"
"USSEN/GA NUNN WHEN I HEAR","NukrwDfkZ4Y"
"USSEN/GA PERDUE&NRSC AMERICAN DREAM","imFlbbqSWok"
"USSEN/GA PERDUE&NRSC HELPING GEORGIA GROW","MfqKo1mDoQU"
"USSEN/GA PERDUE&NRSC NUNN ADMITS","IEkFCukkH5Y"
"USSEN/GA PERDUE CLEAR CHOICE","uGbu6mH2AaE"
"USSEN/GA PERDUE GEORGIA VALUES","3PYGPsj8Rec"
"USSEN/GA PERDUE GET US WORKING AGAIN","R9WsqIlKPDk"
"USSEN/GA PERDUE LIKE YOU","RsXn4oa8XNw"
"USSEN/GA PERDUE SECURE OUR BORDER","5Bt6DcMJjE4"
"USSEN/GA PERDUE TRUST","P_vuD3tHcJA"
"USSEN/GA PERDUE WE NEED A NEW DIRECTION","-9UHRD4QoMg"
"USSEN/HI CAVASSO A MESSAGE FROM TULA","NoChannel"
"USSEN/HI CAVASSO BEST CHOICE TO HONOR INOUYE'S LEGACY","NoChannel"
"USSEN/HI CAVASSO HAWAII DESERVES AN APOLOGY","NoChannel"
"USSEN/HI CAVASSO KEEP HAWAII SAFE FROM GLOBAL THREATS","NoChannel"
"USSEN/HI CAVASSO NO DEBATE","NoChannel"
"USSEN/HI CAVASSO PAYING OFF","NoChannel"
"USSEN/HI CAVASSO VOTE FOR FAMILY THIS YEAR","NoChannel"
"USSEN/HI CAVASSO WE LOVE CAM","NoChannel"
"USSEN/IA BRALEY&IADP IOWA FARMERS","NoMatch"
"USSEN/IA BRALEY&IADP STRONG","o7NwzTDnVj8"
"USSEN/IA BRALEY BACK TO WORK","M2W2XtnVmEU"
"USSEN/IA BRALEY BEST FOR IOWA","hngBb4DxsTE"
"USSEN/IA BRALEY BRIDGES","pPi6G4kxFbc"
"USSEN/IA BRALEY CLOSER LOOK","xcrlbqGBE_Q"
"USSEN/IA BRALEY HUGE PRIORITY","kcgYZXYOVHg"
"USSEN/IA BRALEY MINIMUM","nEtpLZuNCvs"
"USSEN/IA BRALEY MOM","x4r1ZpMbaEw"
"USSEN/IA BRALEY PEEP","b3lwSSTEvNU"
"USSEN/IA BRALEY SOLVE PROBLEMS","Xiw9hekSkBU"
"USSEN/IA BRALEY THE TRUTH","vl6pQMT89YQ"
"USSEN/IA BRALEY TODD PRICHARD","1vFQAaRKkiY"
"USSEN/IA BRALEY WORK 60","eE12svo8iug"
"USSEN/IA ERNST&NRSC HANDS","pwGGreYRpXU"
"USSEN/IA ERNST BISCUIT","8yn_AcB0Oog"
"USSEN/IA ERNST CHRIS","KBPEM4Xrre4"
"USSEN/IA ERNST CROSSROADS","dxFtWKKay18"
"USSEN/IA ERNST DIFFERENCE","YokXZ4FzsV8"
"USSEN/IA ERNST DRIVE","p-rpeYufEbE"
"USSEN/IA ERNST LOT","oWXQ3IY8RvY"
"USSEN/IA ERNST RED OAK","E-tq3za3FKc"
"USSEN/IA ERNST SERVICE","cNYKFZktYrs"
"USSEN/IA ERNST VALUES","n6M2rfQxnwU"
"USSEN/IA ERNST WHAT I CARE ABOUT","F_JqmuNkZ30"
"USSEN/IA ERNST WILLIAM","SYZ2Kku5L8Y"
"USSEN/ID RISCH MITT ROMNEY","NoChannel"
"USSEN/IL DURBIN AMERICAN JOBS","NoMatch"
"USSEN/IL DURBIN CAPTAIN TONY 60","ugdwmRETIcs"
"USSEN/IL DURBIN STUDENT LOANS","ZR22BHCU44A"
"USSEN/IL DURBIN TEA PARTY","NoMatch"
"USSEN/IL DURBIN WALGREENS","NoMatch"
"USSEN/IL OBERWEIS BROKE WASHINGTON","NoChannel"
"USSEN/KS ORMAN ATTACK","TDF1-uj7u4w"
"USSEN/KS ORMAN AUTHENTIC","BXBsdl-3MNU"
"USSEN/KS ORMAN DECLARE","axOM1ADtMSQ"
"USSEN/KS ORMAN ELEVEN MILLION","uhNcjOjos9E"
"USSEN/KS ORMAN ENOUGH IS ENOUGH","roO6EtFIC3A"
"USSEN/KS ORMAN HALF RIGHT","2GqyWbmQr-A"
"USSEN/KS ORMAN INDEPENDENCE","lFYb0_Zidw4"
"USSEN/KS ORMAN MUDSLINGING","iCaNyn2Eq7A"
"USSEN/KS ORMAN SILENT SOLDIER","NoMatch"
"USSEN/KS ORMAN STUCK","XEnTDCop-XA"
"USSEN/KS ORMAN WASHINGTON IS BROKEN","6erxUAC1Ncw"
"USSEN/KS ROBERTS ANOTHER VOTE","FSyC8Yk0b1I"
"USSEN/KS ROBERTS COACH","I8iMNndzlKU"
"USSEN/KS ROBERTS MISSING","_99zPXWayyg"
"USSEN/KS ROBERTS MISTAKE","qlLw5-obItE"
"USSEN/KS ROBERTS NOT ANOTHER VOTE","NoMatch"
"USSEN/KS ROBERTS RESULTS","LCLmp4-4DBU"
"USSEN/KS ROBERTS TROUBLING","YQD6PaYRuwg"
"USSEN/KS ROBERTS WHAT A JOKE","VdcQqobPqh8"
"USSEN/KS ROBERTS WORSE","1LmrKQo2NIM"
"USSEN/KS ROBERTS WRONG FOR KANSAS","QUzNKMXqYkM"
"USSEN/KS TAYLOR HOME","NoChannel"
"USSEN/KY GRIMES&DSCC PROUD MAN 60","iP_M0_AwY7E"
"USSEN/KY GRIMES 30 YEARS","G4nH43cmbyY"
"USSEN/KY GRIMES A MOMENT 60","NoMatch"
"USSEN/KY GRIMES ANTI-COAL GROUPS","NoMatch"
"USSEN/KY GRIMES FIGHT FOR JOBS","NoMatch"
"USSEN/KY GRIMES FIRED","Y1Rgs3yso8M"
"USSEN/KY GRIMES HURTING US","NoMatch"
"USSEN/KY GRIMES IT'S TIME","u21gAKeOTF0"
"USSEN/KY GRIMES JOBS PLAN","NoMatch"
"USSEN/KY GRIMES KENTUCKY'S LARGEST NEWSPAPERS","NoMatch"
"USSEN/KY GRIMES LONG ENOUGH","NoMatch"
"USSEN/KY GRIMES LOST IN BATTLE","6GJ5Cac7cYM"
"USSEN/KY GRIMES NEVER WILL","NoMatch"
"USSEN/KY GRIMES NOT OBAMA","z7Pa16JPUlY"
"USSEN/KY GRIMES QUESTION FROM DAVID","ons-sexX2j0"
"USSEN/KY GRIMES QUESTION FROM DON","HnG72T6t3-s"
"USSEN/KY GRIMES QUESTION FROM ILENE","Gab4eZgdzpU"
"USSEN/KY GRIMES RALLY","sMDmiflLv80"
"USSEN/KY GRIMES SENDING A MESSAGE","NoMatch"
"USSEN/KY GRIMES WAYNE CHAMBERS","NoMatch"
"USSEN/KY GRIMES WENDELL","1rojBg1MfHc"
"USSEN/KY GRIMES WHERE WAS HE","ZZYHtzCCtG8"
"USSEN/KY GRIMES WHY I'M RUNNING","NoMatch"
"USSEN/KY MCCONNELL AFTER ALL THAT","z_oWmuLRTes"
"USSEN/KY MCCONNELL ALL ABOUT","NoMatch"
"USSEN/KY MCCONNELL ANSWER ANYTHING","qBG5PfNcp9M"
"USSEN/KY MCCONNELL AS IF","JJmkOjBRhe4"
"USSEN/KY MCCONNELL BAD FOR KENTUCKY","NoMatch"
"USSEN/KY MCCONNELL CHRIS SEXTON","7tmog-MJHOc"
"USSEN/KY MCCONNELL COMMERCIAL","K0GB6lKH0pw"
"USSEN/KY MCCONNELL CONVINCE","RoJ-nOAWT3A"
"USSEN/KY MCCONNELL DANIEL","NoMatch"
"USSEN/KY MCCONNELL DEBBIE SMITH","SJ04b2qrihA"
"USSEN/KY MCCONNELL DETERMINED","NoMatch"
"USSEN/KY MCCONNELL DIFFERENT DIRECTION 60","0B86hsZhKmM"
"USSEN/KY MCCONNELL DR SANDY","R59XywkUyTg"
"USSEN/KY MCCONNELL EMPTY PARKING SPACE","Jl6vHM_CBE8"
"USSEN/KY MCCONNELL FACT CHECKS","MJycGIFva7M"
"USSEN/KY MCCONNELL FARMERS","DQIpXidhQqc"
"USSEN/KY MCCONNELL FREEDOM","dtZCqHyIjl0"
"USSEN/KY MCCONNELL FREEDOM 60","n_J-K6lQw70"
"USSEN/KY MCCONNELL FRESH FACE","NoMatch"
"USSEN/KY MCCONNELL HOME 60","NoMatch"
"USSEN/KY MCCONNELL HYPOCRISY","XxSsolni6zQ"
"USSEN/KY MCCONNELL KATHY WALKER","drTVvto7od4"
"USSEN/KY MCCONNELL LAUGHABLE","-IbqSSO0Ldc"
"USSEN/KY MCCONNELL LEADS","oKekeACF3d8"
"USSEN/KY MCCONNELL LIFELONG","RrR8Xe1N1yg"
"USSEN/KY MCCONNELL NO EXPERIENCE","jtXcPamySC8"
"USSEN/KY MCCONNELL OUR VOICE FOR COAL","AUUuKwOilZ8"
"USSEN/KY MCCONNELL OWENSBORO","NoMatch"
"USSEN/KY MCCONNELL OWENSBORO REV","NoMatch"
"USSEN/KY MCCONNELL PAUSES","SGPbQ6MvkUY"
"USSEN/KY MCCONNELL RAISING MILLIONS","NoMatch"
"USSEN/KY MCCONNELL RAND PAUL","NoMatch"
"USSEN/KY MCCONNELL RIDICULED","NoMatch"
"USSEN/KY MCCONNELL SAVE A FISH","NoMatch"
"USSEN/KY MCCONNELL SAVED","aVrXWftBImA"
"USSEN/KY MCCONNELL SERIOUS TIMES","LomQCIZzA9s"
"USSEN/KY MCCONNELL STRONG KENTUCKY WOMAN","Rq8NhMvo0pY"
"USSEN/KY MCCONNELL STRONG VOICE","NoMatch"
"USSEN/KY MCCONNELL TAKE AMERICA BACK","NoMatch"
"USSEN/KY MCCONNELL THIS FALL","3TDRgcJ0tQA"
"USSEN/KY MCCONNELL TOUR BUS","0O9SF8BhsRQ"
"USSEN/KY MCCONNELL UNDERCOVER VIDEOS","NoMatch"
"USSEN/KY MCCONNELL WHY DO I FIGHT","NoMatch"
"USSEN/KY MCCONNELL WHY DO I FIGHT 2","NoMatch"
