"creative","uid"
"HOUSE/UT04 LOVE MATHESON CHANGED","NoMatch"
"HOUSE/UT04 LOVE MATHESON STANDS WITH OBAMA","NoMatch"
"HOUSE/UT04 LOVE MATHESON WRONG ON TAX RECORD","ULcinFWGclQ"
"HOUSE/UT04 LOVE MITT ROMNEY","JtFiVg0jAk8"
"HOUSE/UT04 LOVE MUCH AT STAKE","ys_FSTGh4a0"
"HOUSE/UT04 LOVE MUDSLINGING","NoMatch"
"HOUSE/UT04 LOVE REALLY JIM","NoMatch"
"HOUSE/UT04 LOVE RECKLESS","NoMatch"
"HOUSE/UT04 LOVE ROMNEY IS CALLING","vZKxFz2MZWE"
"HOUSE/UT04 MATHESON I'M A REPUBLICAN","AKwIIAa8e1c"
"HOUSE/UT04 MATHESON I'VE LEARNED","sg9Wn4l8AZQ"
"HOUSE/UT04 MATHESON LOVE DID RAISE TAXES","NoMatch"
"HOUSE/UT04 MATHESON LOVE GAMBLE YOUR RETIREMENT","NoMatch"
"HOUSE/UT04 MATHESON LOVE ON EDUCATION","h7PTC0kSE6s"
"HOUSE/UT04 MATHESON NORMA","8-GKedv0ksw"
"HOUSE/UT04 MATHESON OLD SAYING","NoMatch"
"HOUSE/UT04 MATHESON PENNY SAVED PENNY EARNED","lfAskJcxaDI"
"HOUSE/VA02 HIRSCHBIEL ACCOUNTABLE","Sb2S12lcjKk"
"HOUSE/VA02 HIRSCHBIEL MARK WARNER ENDORSEMENT","HporDcWBDNA"
"HOUSE/VA02 HIRSCHBIEL PERSONAL ATTACKS","RctILbSwPqw"
"HOUSE/VA02 HIRSCHBIEL PROUD TO BE A TEACHER","NoMatch"
"HOUSE/VA02 HIRSCHBIEL RAISE YOUR KIDS RIGHT","NoMatch"
"HOUSE/VA02 HIRSCHBIEL RIGELL DOESN'T SHARE MY VALUES","YloNXLyEKJE"
"HOUSE/VA02 HIRSCHBIEL TEACHER","J72gLvvsOnk"
"HOUSE/VA02 RIGELL&NRCC 65 YEARS AFTER","mDETEiEqDj8"
"HOUSE/VA02 RIGELL DEFINING MOMENT FOR OUR COUNTRY","J_wjHdSR2W4"
"HOUSE/VA02 RIGELL HIRSCHBIEL A SHAME","JJIassHFztw"
"HOUSE/VA02 RIGELL HIRSCHBIEL WANTED HONEST CAMPAIGN","NoMatch"
"HOUSE/VA02 RIGELL JERSEY","iRPJLngbv8Y"
"HOUSE/VA02 RIGELL PERFORMANCE REVIEW","57I5WC7Ypgs"
"HOUSE/VA02 RIGELL THE BIG DIFFERENCE","NoMatch"
"HOUSE/VA04 FORBES LAND OF THE FREE","HJhqnLxeJsc"
"HOUSE/VA05 DOUGLASS DEALT WITH THE TOUGHEST PROBLEMS","NoChannel"
"HOUSE/VA05 DOUGLASS URANIUM DUST","NoChannel"
"HOUSE/VA05 DOUGLASS URANIUM PARTICLES","NoChannel"
"HOUSE/VA05 HURT DOUGLASS HOW MANY MORE","mucydDFCb4o"
"HOUSE/VA05 HURT DOUGLASS SAID IT WORKED","MErmf4fHXZE"
"HOUSE/VA05 HURT DOUGLASS TOLD US","1WHVpTm5k1o"
"HOUSE/VA05 HURT WILL FIGHT WASHINGTON","5EplQcpi0gA"
"HOUSE/VA06 GOODLATTE HAS LISTENED TO US","NoChannel"
"HOUSE/VA06 GOODLATTE WENT THE EXTRA MILE","NoChannel"
"HOUSE/VA07 CANTOR&RPV SMALL BUSINESS","NoChannel"
"HOUSE/VA07 CANTOR&RPV WAYNE RUIN HIM","NoChannel"
"HOUSE/VA07 CANTOR POWELL RUIN","NoChannel"
"HOUSE/VA07 CANTOR SMALL BUSINESS","NoChannel"
"HOUSE/VA07 CANTOR SMALL BUSINESS SPEAKS","NoChannel"
"HOUSE/VA07 CANTOR TIRED OF ALL THOSE POLITICAL ADS","NoChannel"
"HOUSE/VA07 POWELL EVER WONDER","XVAddLcY3ow"
"HOUSE/VA07 POWELL WHAT'S HE DOING HERE","rviJr3aRpNg"
"HOUSE/VA09 FLACCAVENTO&DPV MEET THE REAL MORGAN GRIFFITH","KsqsJ88UPB4"
"HOUSE/VA09 FLACCAVENTO TOM BOYLE","FTHw0RbcaXU"
"HOUSE/VA09 GRIFFITH IT'S ABOUT PROTECTING","ah59qTpAcTk"
"HOUSE/WA01 DELBENE FOOTBALL REFEREE","gW4es9KUuGM"
"HOUSE/WA01 DELBENE KOSTER'S EXTREME RECORD","NoMatch"
"HOUSE/WA01 DELBENE SOME PEOPLE ARE EXTREME","_Tjl3xCu4-A"
"HOUSE/WA03 HERRERA-BEUTLER MY STORY","ukbR46IUAIY"
"HOUSE/WA03 HERRERA-BEUTLER SOME PEOPLE ASK ME","b_mxW0gKPMY"
"HOUSE/WA03 HERRERA-BEUTLER WOULDN'T STAND FOR IT","i_jJXcJrL9g"
"HOUSE/WA05 COWAN MCMORRIS-RODGERS PARTY BEFORE PEOPLE 15","NoChannel"
"HOUSE/WA05 COWAN MCMORRIS-RODGERS REFUSING","NoChannel"
"HOUSE/WA05 COWAN TIME TO PUT PEOPLE BACK TO WORK 15","NoChannel"
"HOUSE/WA05 COWAN WHERE'S CATHY","NoChannel"
"HOUSE/WA05 MCMORRIS-RODGERS DEBT","l8HIa9tmjFg"
"HOUSE/WA05 MCMORRIS-RODGERS FAIRCHILD","0wewW6EdsVw"
"HOUSE/WA05 MCMORRIS-RODGERS MEANS SOMETHING SPECIAL","63LM7-ba6h0"
"HOUSE/WA05 MCMORRIS-RODGERS SERVICE MEMBERS","Kk0VVI8Z8QA"
"HOUSE/WA06 DRISCOLL A BUSINESSMAN DAD AND MARINE","NoChannel"
"HOUSE/WA06 DRISCOLL VOLUNTEER FOR COMBAT DUTY","NoChannel"
"HOUSE/WA06 DRISCOLL WASHINGTON NEEDS A REPUBLICAN","NoChannel"
"HOUSE/WA06 KILMER LEADING BY EXAMPLE","NoChannel"
"HOUSE/WA06 KILMER TWO OF THE REASONS","NoChannel"
"HOUSE/WA08 REICHERT LOOKING FOR ANSWERS","NoMatch"
"HOUSE/WA10 HECK BUSINESS THE WAY CONGRESS DOES","8lQEoEVT9qY"
"HOUSE/WA10 HECK TUG OF WAR","pYvYRgx_65g"
"HOUSE/WI01 RYAN AMERICA HAS A CHOICE","1J9KyqdcEIc"
"HOUSE/WI01 RYAN CHOICE OF TWO FUTURES","1niuXXPILuI"
"HOUSE/WI01 RYAN CRITICAL CHOICE","WS-M7uYQwwo"
"HOUSE/WI01 RYAN PATIENT CENTERED SOLUTIONS","h56PTRJ_McU"
"HOUSE/WI01 RYAN RIGHT SOLUTIONS","ikOUNSvaVI0"
"HOUSE/WI01 RYAN TAX CODE A MESS","Heynm6KpvJo"
"HOUSE/WI01 RYAN TELL OUR KIDS","0-UFfmAhusE"
"HOUSE/WI01 RYAN WHAT ABOUT OUR DEBT","vqioKjdS8z0"
"HOUSE/WI01 ZERBAN CARES ABOUT THE PEOPLE","NoChannel"
"HOUSE/WI01 ZERBAN RYAN DANGEROUS","NoChannel"
"HOUSE/WI08 RIBBLE&RNC LET'S TRY THE FACTS","NoMatch"
"HOUSE/WI08 RIBBLE AMERICAN MANUFACTURING","5ALHyl5OEv0"
"HOUSE/WI08 RIBBLE EVERY AMERICAN HAS THEIR DREAM","-Mh8eu77F70"
"HOUSE/WI08 RIBBLE FULL SCALE WAR OVER MEDICARE","HxullQ0MrZM"
"HOUSE/WI08 RIBBLE HOW BAD IS POLITICS GOTTEN","5vpGkwiBGqc"
"HOUSE/WI08 RIBBLE NO BUDGET NO PAY","5F8xd-V6ez0"
"HOUSE/WI08 RIBBLE SOLVING PROBLEMS","IgB0rc0uW38"
"HOUSE/WI08 WALL&DCCC DID YOU KNOW","NoMatch"
"HOUSE/WI08 WALL&DCCC RIBBLE FALSLEY ATTACKING","NoMatch"
"HOUSE/WI08 WALL IT'S A SHAME","yhnygIAO9Ts"
"HOUSE/WI08 WALL IT'S A SHAME REV","NoMatch"
"HOUSE/WI08 WALL RIBBLE FULL SCALE WAR OVER MEDICARE","_h7un69zax8"
"HOUSE/WI08 WALL WHOLE MILK AND SKIM","q3Sjbcd4teM"
"HOUSE/WV03 RAHALL&DCCC SNUFFER WHOSE SIDE","NoMatch"
"HOUSE/WV03 RAHALL COAL MINING JOBS","-Fom9f70o40"
"HOUSE/WV03 RAHALL FIGHTS FOR WEST VIRGINIA","MQiUg-Mzb-4"
"HOUSE/WV03 RAHALL FRIENDS","3E3QX3tWY2A"
"HOUSE/WV03 RAHALL OPPOSED OBAMA EPA","MJH0eTlnM9M"
"HOUSE/WV03 RAHALL SNUFFER'S CAMPAIGN","uXKxxq85SJk"
"HOUSE/WV03 RAHALL SNUFFER TOOK MONEY","GkKcei5P3rI"
"HOUSE/WV03 SNUFFER HAMMER","vSnnp5N8htU"
"HOUSE/WV03 SNUFFER RAHALL OBAMA WAR ON COAL","Vj6paT2QrQs"
"HOUSE/WV03 SNUFFER THAT'S ELEANOR","NoMatch"
"USSEN/AZ CARDON HARD WORK","NoChannel"
"USSEN/AZ CARMONA ANSWERED THE CALL","6sRIJWgSlSA"
"USSEN/AZ CARMONA BOTH GOT IT WRONG","q4RMaBiDefo"
"USSEN/AZ CARMONA MCCAIN & KYL TESTIMONIALS","IE8WWcs3QG0"
"USSEN/AZ CARMONA PROBLEM SOLVING","KNJ3dewVOMk"
"USSEN/AZ CARMONA PUT ASIDE POLITICS","i88nHL2Vt2o"
"USSEN/AZ CARMONA STRAIGHT TALKER","nARH9wSx8Oo"
"USSEN/AZ CARMONA THE BEST EDUCATION","NoMatch"
"USSEN/AZ DSCC&CARMONA KATHLEEN BRENNAN","jwbve7xcvF8"
"USSEN/AZ FLAKE ANOTHER OBAMA BIG SPENDER","NoMatch"
"USSEN/AZ FLAKE IT'S A CHOICE","Y3rRJTyeEVs"
"USSEN/AZ FLAKE JUST LIKE OBAMA","NoMatch"
"USSEN/AZ FLAKE LIBERAL BIG GOVERNMENT AGENDA","ZCXbJw6O_X4"
"USSEN/AZ FLAKE MCCAIN & KYL ENDORSEMENT","k16Ky6soFuo"
"USSEN/AZ FLAKE OBAMA'S MAN IN ARIZONA","Wau6Z_SKzI8"
"USSEN/AZ FLAKE OBAMA'S RUBBER STAMP","NoMatch"
"USSEN/AZ NRSC&FLAKE ANGER ISSUES","NoMatch"
"USSEN/AZ NRSC&FLAKE APRIL WHITE","ZXQ7XBAD08o"
"USSEN/AZ NRSC&FLAKE TURNING POINT","Yz7u61zD384"
"USSEN/CA FEINSTEIN ALL OVER CALIFORNIA","L2vdPz5VrG4"
"USSEN/CT BYSIEWICZ TOO MUCH CORRUPTION","NoChannel"
"USSEN/CT MCMAHON ABSENTEE CONGRESSMAN","NoMatch"
"USSEN/CT MCMAHON ABSENTEE CONGRESSMAN 2","NoMatch"
"USSEN/CT MCMAHON ABSENTEE CONGRESSMAN 3","NoMatch"
"USSEN/CT MCMAHON ANOTHER LAWYER","NoMatch"
"USSEN/CT MCMAHON ANTI WOMEN","NoMatch"
"USSEN/CT MCMAHON ANTI WOMEN 2","NoMatch"
"USSEN/CT MCMAHON BEST FOR JOBS","NoMatch"
"USSEN/CT MCMAHON CAN'T BE BOUGHT","bsRq0h-qgto"
"USSEN/CT MCMAHON CAROLYN NAH","wDRSEDqh5to"
"USSEN/CT MCMAHON COMPARE THE CANDIDATES","NoMatch"
"USSEN/CT MCMAHON CONNECT THE DOTS","NoMatch"
"USSEN/CT MCMAHON CONNECTS WITH THE PEOPLE","qKvspCN3ntw"
"USSEN/CT MCMAHON DEFENSE CUTS","NoMatch"
"USSEN/CT MCMAHON FALSE NEGATIVE ADS","NoMatch"
"USSEN/CT MCMAHON FIGHTING FOR YOU","NoMatch"
"USSEN/CT MCMAHON FUNNY GUY","NoMatch"
"USSEN/CT MCMAHON GOTTEN US IN A MESS","dAFymoNZHDM"
"USSEN/CT MCMAHON GREEN STAMPS","NoMatch"
"USSEN/CT MCMAHON I AM A WOMAN","NoMatch"
"USSEN/CT MCMAHON ISN'T TELLING US THE TRUTH","NoMatch"
"USSEN/CT MCMAHON JOB INTERVIEW","NoMatch"
"USSEN/CT MCMAHON JOBLESS RATE MORE THAN DOUBLED","NoMatch"
"USSEN/CT MCMAHON JOBLESS RATE REV 2","upefBfpM2hE"
"USSEN/CT MCMAHON KIDDING","NoMatch"
"USSEN/CT MCMAHON KILLING US","NoMatch"
"USSEN/CT MCMAHON LYING TO YOU","NoMatch"
"USSEN/CT MCMAHON NOT TELLING THE TRUTH","NoMatch"
"USSEN/CT MCMAHON OBAMA SUPPORTERS","2-d5g0pwJws"
"USSEN/CT MCMAHON PATTERN","NoMatch"
"USSEN/CT MCMAHON REPRODUCTIVE RIGHTS","0WbiMlf5JrI"
"USSEN/CT MCMAHON SHOWED UP FOR HER JOB","NoMatch"
"USSEN/CT MURPHY BLUMENTHAL ENDORSEMENT","In7hpJmaY3k"
"USSEN/CT MURPHY BLUMENTHAL ENDORSEMENT REV","NoMatch"
"USSEN/CT MURPHY CLINTON ENDORSEMENT","NoMatch"
"USSEN/CT MURPHY CREATE THEIR OWN RULES","J_M69gmydec"
"USSEN/CT MURPHY DEMEANED WOMEN","YqzS7VeI_zI"
"USSEN/CT MURPHY DO AND SAY ANYTHING","HShhJZ0nyW4"
"USSEN/CT MURPHY IMAGE ISN' T REAL","kMSnjonDMSw"
"USSEN/CT MURPHY JOBS RECORD","qYsQ118aWsE"
"USSEN/CT MURPHY MAKING THINGS UP","NoMatch"
"USSEN/CT MURPHY MCMAHON HAD A PLAN","ETz8vpDIwcU"
"USSEN/CT MURPHY NEVER FOR US","NoMatch"
"USSEN/CT MURPHY NEWSPAPER ENDORSEMENTS","il2OUiw0B98"
"USSEN/CT MURPHY NOBODY HAS WORKED HARDER","NoMatch"
"USSEN/CT MURPHY OBAMA ENDORSEMENT","rNL7_WTBui0"
"USSEN/CT MURPHY ROOTED IN THE MIDDLE CLASS","01-9hCQenQw"
"USSEN/CT MURPHY THE DIFFERENCE","NoMatch"
"USSEN/DE CARPER PAID OFF","RhOISWq-7Ss"
"USSEN/DE PIRES SICK OF THESE PARTIES","NoChannel"
"USSEN/FL DSCC&NELSON EXTREMIST REPUBLICANS","NoMatch"
"USSEN/FL DSCC&NELSON MIDDLE CLASS","XBpdMudXSSs"
"USSEN/FL DSCC&NELSON OUT OF STATE BILLIONAIRES","NoMatch"
"USSEN/FL DSCC&NELSON OUT OF STATE BILLIONAIRES REV","91dtaCfcYOo"
"USSEN/FL DSCC&NELSON RULES ARE DIFFERENT FOR HIM","NoMatch"
"USSEN/FL MACK MEDICARE CUTS 15","NoChannel"
"USSEN/FL MACK POWER OF FREEDOM","NoChannel"
"USSEN/FL MACK PRISCILLA","NoChannel"
"USSEN/FL MACK SIGNIFICANT","NoChannel"
"USSEN/FL MACK VOTING LIBERAL 15","NoChannel"
"USSEN/FL NELSON&DSCC MEET CONNIE MACK IV","Hs2LGKdDPf4"
"USSEN/FL NELSON ABSENTEE CONGRESSMAN","NoMatch"
"USSEN/FL NELSON ALWAYS HAS ALWAYS WILL","NoMatch"
"USSEN/FL NELSON IN NO WAY QUALIFIED","Za8YcX5RLZA"
"USSEN/FL NELSON PERSPECTIVE","9JmNMccRgbg"
"USSEN/HI HIDP&HIRONO NOT BIPARTISAN","NoChannel"
"USSEN/HI HIRONO A GOOD EDUCATION","NGmD8jmVzS0"
"USSEN/HI HIRONO LINGLE SUPPORTING ROMNEY","hIsANI9bxe4"
"USSEN/HI HIRONO MISLEADING US AGAIN","8oSsTWSXFww"
"USSEN/HI HIRONO MITT ROMNEY","6LR1egXAeCI"
"USSEN/HI HIRONO NEGATIVE CAMPAIGN","XBhV8az6bLo"
"USSEN/HI HIRONO NEWSPAPER ENDORSEMENT","7ZIIZA-c-zM"
"USSEN/HI HIRONO NOT BIPARTISAN","NoMatch"
"USSEN/HI HIRONO OBAMA'S TORMENTOR","H6-sRNdaZIw"
"USSEN/HI HIRONO WE CAN DO BETTER","e0xqKxAv7jE"
"USSEN/HI LINGLE AMERICAN PROBLEMS","-33cIZzWwho"
"USSEN/HI LINGLE DEFENSE CUTS","CqUI0GkjlS4"
"USSEN/HI LINGLE DO THE MATH","NoMatch"
"USSEN/HI LINGLE GET THINGS DONE","NoMatch"
"USSEN/HI LINGLE LISTENING","NoMatch"
"USSEN/HI LINGLE NOT WHO I AM","NoMatch"
"USSEN/HI LINGLE PROTECT MEDICARE","NoMatch"
"USSEN/HI LINGLE PUTS PEOPLE FIRST","-2Lrao-0mJQ"
"USSEN/HI LINGLE REWRITE HISTORY","NoMatch"
"USSEN/HI LINGLE SOCIAL SECURITY AND MEDICARE","NoMatch"
"USSEN/HI LINGLE TEACHERS","NoMatch"
"USSEN/HI LINGLE ZERO","6VdLrpmGANk"
"USSEN/IN DONNELLY ANGRY","NoMatch"
"USSEN/IN DONNELLY BIPARTISANSHIP","3qzFMybdMT4"
"USSEN/IN DONNELLY COMMON SENSE MIDDLE","hXlav9oQbfQ"
"USSEN/IN DONNELLY COMPARE THE CANDIDATES","IcaTucJDZxI"
"USSEN/IN DONNELLY INFLICT ON US","t0Svy9ll0pI"
"USSEN/IN DONNELLY MOURDOCK'S WAY","II8w3MB8qiM"
"USSEN/IN DONNELLY MY WAY OR THE HIGHWAY","XjvU0kgH0io"
"USSEN/IN DONNELLY ROAD RAGE","I7Rq_x--_tM"
"USSEN/IN DONNELLY TEENAGERS AND RICHARD MOURDOCK","NoMatch"
"USSEN/IN DONNELLY TROUBLING PATTERN","NoMatch"
"USSEN/IN DONNELLY WATCHES EVERY PENNY","v_e1kBJNXbo"
"USSEN/IN INDCVC&DONNELLY HOOSIER COMMON SENSE","NoMatch"
"USSEN/IN MOURDOCK A CHOICE","Xe05zEO1XSU"
"USSEN/IN MOURDOCK BECKY SKILLMAN","bkxknh9pBk0"
"USSEN/IN MOURDOCK BETTER OFF","NoMatch"
"USSEN/IN MOURDOCK CHRYSLER BAILOUT","NoMatch"
"USSEN/IN MOURDOCK DISTORTED PERSONAL ATTACKS","POqoP5TLltU"
"USSEN/IN MOURDOCK GARBAGE ON TELEVISION","VmjZIPHNCRY"
"USSEN/IN MOURDOCK LIES AND DISTORTIONS","NoMatch"
"USSEN/IN MOURDOCK OBAMA-REID AGENDA","kSoarHs-1fU"
"USSEN/IN MOURDOCK PERFECTLY SYNCHRONIZED","NoMatch"
"USSEN/IN MOURDOCK REAL RECORD","NoMatch"
"USSEN/IN MOURDOCK ROMNEY ENDORSEMENT","pSMkRYZD7P0"
"USSEN/IN NRSC&MOURDOCK 2 PATHS","PRxAc7y8h6E"
"USSEN/IN NRSC&MOURDOCK PERFECTLY SYNCHRONIZED","NoMatch"
"USSEN/MA BROWN ASBESTOS CLAIMS","p53HYpTu7Jk"
"USSEN/MA BROWN ASBESTOS VICTIMS","uizzOZFy7Dk"
"USSEN/MA BROWN ASBESTOS VICTIMS 2","NoMatch"
"USSEN/MA BROWN BIPARTISAN SENATOR","qiq2130HAXI"
"USSEN/MA BROWN CAUGHT IN A LIE","QNY4HL81oIU"
"USSEN/MA BROWN DIDN'T HAVE IT EASY","xf2iAj8ljRE"
"USSEN/MA BROWN FISHING INDUSTRY","AWFcqZjE2Zs"
"USSEN/MA BROWN GAIL HUFF 3","AWuVw_n4NSs"
"USSEN/MA BROWN HERITAGE CLAIMS","d0xWBRNrDfw"
"USSEN/MA BROWN HIRED GUN","n-WlHW4Tj0c"
"USSEN/MA BROWN INSIDER TRADING","aExxgbIuGlU"
"USSEN/MA BROWN KEEP TAXES LOW","jhxNO_VWVFM"
"USSEN/MA BROWN KONNIE LUKES","99L5Ipiw7FA"
"USSEN/MA BROWN LAURIE MYERS","vycWApIe_zw"
"USSEN/MA BROWN NEGATIVE ATTACKS","_sl4Gz56YFQ"
"USSEN/MA BROWN PAUL WALSH","7wUQJTqGR3Y"
"USSEN/MA BROWN PAUL WALSH 2","UAp6tXNhTuU"
"USSEN/MA BROWN RAIDING MEDICARE","NoMatch"
"USSEN/MA BROWN RAY FLYNN ENDORSEMENT","ysTh7eQlCTw"
"USSEN/MA BROWN SPRINGFIELD TORNADOES","Q_GX1NtbD_k"
"USSEN/MA BROWN SUPPORTS WOMEN","5kUdnLx5n5Y"
"USSEN/MA BROWN THE CHOICE","w9CETXKuPoU"
"USSEN/MA BROWN THOMAS HUDNER","Si38w4LZscs"
"USSEN/MA BROWN TOUGH ON THE MIDDLE CLASS","07Pid6Am69I"
"USSEN/MA BROWN VOTE THE PERSON","waEOB6v76A8"
"USSEN/MA BROWN VOTE THE PERSON 60","otMMS-lrg2A"
"USSEN/MA BROWN WANTED TO GET AHEAD","NoMatch"
"USSEN/MA WARREN ATTACKING MY FAMILY","4oIVinDXzOw"
"USSEN/MA WARREN BUFFETT RULE","NoMatch"
"USSEN/MA WARREN CLEAR CHOICE","hcAql-GCCwI"
"USSEN/MA WARREN CORPORATE INTERESTS","U4PLPC75bco"
"USSEN/MA WARREN JUST ONE VOTE","L5kwaViRFWU"
"USSEN/MA WARREN MENINO ENDORSEMENT","ljXva87fDqc"
"USSEN/MA WARREN MESOTHELIOMA VICTIMS","eUDWjSNyTLI"
"USSEN/MA WARREN MESOTHELIOMA VICTIMS 2","mn9G7ZS_2Uo"
"USSEN/MA WARREN MY FIGHT IS FOR YOU","EOgpW0CxKJo"
"USSEN/MA WARREN NOT A BAD GUY 60","l7EIBzZ6sxo"
"USSEN/MA WARREN REAL FIGHTER","W8Lp66KISa4"
"USSEN/MA WARREN REALLY DISAPPOINTED","NoMatch"
"USSEN/MA WARREN SAME OLD BATTLES","gDPcAbqCdR8"
"USSEN/MA WARREN STANDS UP FOR PEOPLE","OWoy9wceXl4"
"USSEN/MA WARREN STUDENT LOAD DEBT","1sLZD0Ne6_8"
"USSEN/MA WARREN SYSTEM IS RIGGED","NoMatch"
"USSEN/MA WARREN THE PEOPLE'S SIDE","OIm351vhQmU"
"USSEN/MA WARREN WOMEN'S ISSUES","GNpDs2o_J8c"
"USSEN/MD BONGINO OUT OF CONTROL","NoChannel"
"USSEN/MD BONGINO OUT OF CONTROL REV","NoChannel"
"USSEN/MD BONGINO TIME FOR REAL CHANGE IS NOW 90","NoChannel"
"USSEN/MD CARDIN HEAVY LIFTING","TE8sPAyegFo"
"USSEN/MD CARDIN LUCKY","Uw0Tef_HgsM"
"USSEN/MD SOBHANI BACK ON TRACK","NoChannel"
"USSEN/MD SOBHANI BROKEN POLITICS","NoChannel"
"USSEN/MD SOBHANI COMMUNITY ENDORSEMENTS","NoChannel"
"USSEN/MD SOBHANI DO MORE","NoChannel"
"USSEN/MD SOBHANI LARRY LORSCHBAUGH","NoChannel"
"USSEN/MD SOBHANI OUT OF IDEAS","NoChannel"
"USSEN/MD SOBHANI SOMETHING NEW","NoChannel"
"USSEN/MD SOBHANI TIME FOR ACTION","NoChannel"
"USSEN/ME KING GODZILLA","pTyD7k8ZS7o"
"USSEN/ME KING KNOW THE TRUTH","UMYIXQglB3I"
"USSEN/ME KING NEW INDEPENDENT DIRECTION","FuJ6kz_OvpU"
"USSEN/ME KING NOTHING GETS DONE","NoMatch"
"USSEN/ME KING SAM WATERSTON","NoMatch"
"USSEN/ME KING STAKES ARE HUGE","iJcGyS7sJDk"
"USSEN/ME KING THERE THEY GO AGAIN","fZgmydmDduk"
"USSEN/ME KING THINKS INDEPENDENTLY","-mSr7xr30-k"
"USSEN/ME KING UNIQUE LIFE","c-JCOuhNpBc"
"USSEN/ME NRSC&SUMMERS LIVED IT","wLnHnYUdtdk"
"USSEN/ME NRSC&SUMMERS WORST THING WE COULD DO","e4qqNaZKP3E"
"USSEN/ME SUMMERS BUDGET SHORTFALL","lahBNPT4IPM"
"USSEN/ME SUMMERS MEET CHARLIE","CJm-Q4EfMbI"
"USSEN/ME SUMMERS SOCIAL SECURITY AND MEDICARE","6UkPs1n66qM"
"USSEN/MI HOEKSTRA MEDICARE CUTS","NoChannel"
"USSEN/MI HOEKSTRA SERIOUS TROUBLE","NoChannel"
"USSEN/MI STABENOW COUNTERFEIT CHINESE PRODUCTS","dcNDu2bBsHU"
"USSEN/MI STABENOW CUT MEDICARE","LxA4wd2b1Do"
"USSEN/MI STABENOW DISHONEST AND RIDICULOUS","BgPs8bPW9KI"
"USSEN/MI STABENOW FARM BILL","Or3WQRW4Kq4"
"USSEN/MI STABENOW FARMERS","9vTp_G9lJLI"
"USSEN/MI STABENOW NEW ENERGY ECONOMY","NoMatch"
"USSEN/MI STABENOW NEWSPAPER ENDORSEMENTS","SIHByr5aS3Q"
"USSEN/MI STABENOW ROGERS FOAM","x4cXoodCFvY"
"USSEN/MN BILLS CASH AND COVER UP","NoMatch"
"USSEN/MN KLOBUCHAR BETSY SATHERS","G65k72N9Z4I"
"USSEN/MN KLOBUCHAR CHAMPION","FHdhSYf_IwM"
"USSEN/MN KLOBUCHAR GET THE ECONOMY MOVING","2b63Mqi99uk"
"USSEN/MN KLOBUCHAR MY MOM","wpUY6gwDHMM"
"USSEN/MN KLOBUCHAR PAUL WALSER","NELmhoBwO-4"
"USSEN/MN KLOBUCHAR VETERANS BENEFITS","L66I6mQXkRQ"
"USSEN/MO AKIN 6 YEAR RECORD","7KEyweLBzrs"
"USSEN/MO AKIN BROKE OUR TRUST","WxAFTbwqVW8"
"USSEN/MO AKIN CORRUPT CLAIRE","lWi178102lo"
"USSEN/MO AKIN GETTING RICH OFF US","NYG8pXyT1n8"
"USSEN/MO AKIN HUCKABEE ENDORSEMENT 3","oqTepM3We_U"
"USSEN/MO AKIN I APOLOGIZE","R57E3S8RO7A"
"USSEN/MO AKIN MISLEADING DECEPTIVE FALSE","OPtwl08gCME"
"USSEN/MO AKIN SELLING US OUT","ESAZbG4V8Co"
"USSEN/MO AKIN STRONGER FAMILIES","9LD24QJaDuU"
"USSEN/MO MCCASKILL CHINESE TRADE VIOLATIONS","XlpIuI0vDbA"
"USSEN/MO MCCASKILL COMMON SENSE WAY","MrhfG0BT2KU"
"USSEN/MO MCCASKILL EMERGENCY CONTRACEPTION","PcpvqEtn-qU"
"USSEN/MO MCCASKILL EMERGENCY CONTRACEPTION 2","ySuGj2vA8_E"
"USSEN/MO MCCASKILL EMERGENCY CONTRACEPTION 3","sxLuYfylgN4"
"USSEN/MO MCCASKILL FAMILY AND MO FIRST","Q63ih_EuTic"
"USSEN/MO MCCASKILL NOT FROM AROUND HERE","1AM4OjHVuKo"
"USSEN/MO MCCASKILL NUMBER 50","jrqAIuC4Yr0"
"USSEN/MO MCCASKILL RESPECT HONOR RESPONSIBILITY","NoMatch"
"USSEN/MO MCCASKILL SCARY","Ag0iHDkXNrg"
"USSEN/MO MCCASKILL SHARED VALUES","1Ml6kP3TIzg"
"USSEN/MO MCCASKILL SHARED VALUES REV","PIH_Xzvm24k"
"USSEN/MO MCCASKILL SOCIAL SECURITY AND MEDICARE","b5uiezh0dqE"
"USSEN/MO MCCASKILL STUDENT LOANS","a1BTJ11-o2k"
"USSEN/MO MCCASKILL THAT'S TODD AKIN 60","NoMatch"
"USSEN/MO MCCASKILL TIMELINE","uT3wcMsb8GA"
"USSEN/MO MCCASKILL TOTALLY UNACCEPTABLE","NoMatch"
"USSEN/MO MCCASKILL TRUE COLORS","VmaEDYPLS2s"
"USSEN/MO MCCASKILL VETERANS AFFAIRS","pJ5mY7Y0nbI"
"USSEN/MS WICKER NATIONAL DEBT","NoChannel"
"USSEN/MT NRSC&REHBERG ENGINES OF ECONOMIC GROWTH","9uAUFSEs6YI"
"USSEN/MT REHBERG BALONEY 3","14J2g_lgmQo"
"USSEN/MT REHBERG BALONEY 4","aJXnistC8rk"
"USSEN/MT REHBERG COAL REGULATIONS","tAjFNueAS7k"
"USSEN/MT REHBERG FALSE ATTACKS","NoMatch"
"USSEN/MT REHBERG GIVE IT THEIR ALL","vSnhMy4cMD4"
"USSEN/MT REHBERG JAN","NoMatch"
"USSEN/MT REHBERG JUST DOESN'T GET IT","2DRmzn6mnTM"
"USSEN/MT REHBERG LINDA & MARSHA FREY","y5L7-nAVWYQ"
"USSEN/MT REHBERG NIGHT AND DAY","eG2HgLugl00"
"USSEN/MT REHBERG NOT TRUE","Qa3Vkx7mXzY"
"USSEN/MT REHBERG ROMNEY ENDORSEMENT","oVSv6lD227Y"
"USSEN/MT REHBERG SUPPORTS FIREFIGHTERS","NoMatch"
"USSEN/MT REHBERG TALK IS CHEAP","WDC11geqCZA"
"USSEN/MT REHBERG TIME FOR YOU TO GO","NoMatch"
"USSEN/MT REHBERG TRADED OUR VALUES","CErRmd6VqRI"
"USSEN/MT REHBERG VOTES WITH US","zbfgVu3POOw"
"USSEN/MT TESTER BROKEN PROMISES","NoMatch"
"USSEN/MT TESTER BUSINESS AS USUAL","NoMatch"
"USSEN/MT TESTER CITIZENS UNITED","NoMatch"
"USSEN/MT TESTER CORPORATE SUPER PACS","NoMatch"
"USSEN/MT TESTER DEATH TAX","NoMatch"
"USSEN/MT TESTER EDUCATION CUTS","NoMatch"
"USSEN/MT TESTER ENDING SOCIAL SECURITY 2","NoMatch"
"USSEN/MT TESTER EVERYWHERE I GO","NoMatch"
"USSEN/MT TESTER FIREFIGHTERS","NoMatch"
"USSEN/MT TESTER GOT IT ALL WRONG","NoMatch"
"USSEN/MT TESTER LIFE OF DIGNITY","NoMatch"
"USSEN/MT TESTER LOGGING JOBS","NoMatch"
"USSEN/MT TESTER TOUR OF MONTANA","NoMatch"
"USSEN/MT TESTER VETERAN HEALTHCARE 2","NoMatch"
"USSEN/ND BERG COMPETING VISIONS","NoChannel"
"USSEN/ND BERG DIFFERENCES MATTER","NoChannel"
"USSEN/ND BERG DON'T HOLD WATER","NoChannel"
"USSEN/ND BERG FAILED POLICIES","NoChannel"
"USSEN/ND BERG HOEVEN ENDORSEMENT 2","NoChannel"
"USSEN/ND BERG IPAB","NoChannel"
"USSEN/ND BERG LIE OF THE YEAR","NoChannel"
"USSEN/ND BERG NOT INDEPENDENT","NoChannel"
"USSEN/ND BERG OUR AMERICAN DREAM 60","NoChannel"
"USSEN/ND BERG PURPLE HEART","NoChannel"
"USSEN/ND BERG REMEMBER THIS","NoChannel"
"USSEN/ND BERG RIGHT OR WRONG","NoChannel"
"USSEN/ND BERG THE COUNCIL FOR A LIVABLE WORLD","NoChannel"
"USSEN/ND BERG THE DIFFERENCE ON MEDICARE","NoChannel"
"USSEN/ND BERG THERE SHE GOES AGAIN","NoChannel"
"USSEN/ND BERG WOMEN'S SHELTER 60","NoChannel"
"USSEN/ND HEITKAMP BATTING CAGE","gVr9cirHglk"
"USSEN/ND HEITKAMP COLLEGE AID","yJrO2_zN390"
"USSEN/ND HEITKAMP HEROES HEALTH CARD","QtGhZJYoZzU"
"USSEN/ND HEITKAMP OIL REFINERY","8HNoavveI8o"
"USSEN/ND HEITKAMP ONLY ANSWER TO YOU","6hZH5G1e26Y"
"USSEN/ND HEITKAMP PAY OUR OWN WAY","z9ToeIhKgXc"
"USSEN/ND HEITKAMP STOP THE SMEAR CAMPAIGN","NoMatch"
"USSEN/ND HEITKAMP STOP THE SMEAR CAMPAIGN 2","NoMatch"
"USSEN/ND HEITKAMP STRENGTHEN MEDICARE","BV0S9VN7cT0"
"USSEN/ND HEITKAMP VOTE FOR THE PERSON","pk2BrRdDUdI"
"USSEN/NE FISCHER ATTACKS ON MY FAMILY","NoChannel"
"USSEN/NE FISCHER GOVERNING RESPONSIBLY","NoChannel"
"USSEN/NE FISCHER GROSSLY EXAGGERATED","NoChannel"
"USSEN/NE FISCHER HEINEMAN ENDORSEMENT","NoChannel"
"USSEN/NE FISCHER HIGH TAX AGENDA","NoChannel"
"USSEN/NE FISCHER MIKE JOHANNS","NoChannel"
"USSEN/NE FISCHER NEW YORK-STYLE NEGATIVE CAMPAIGN","NoChannel"
"USSEN/NE FISCHER PARTY LINE","NoChannel"
"USSEN/NE FISCHER PARTY LINE 2","NoChannel"
"USSEN/NE FISCHER PERSONAL ATTACKS","NoChannel"
"USSEN/NE FISCHER REACH FOR THE STARS","NoChannel"
"USSEN/NE FISCHER SUPPORT OBAMA'S AGENDA","NoChannel"
"USSEN/NE KERREY A CHOICE","pb7TUVyU5V0"
"USSEN/NE KERREY BORN AND BRED","wdXgLwudgeQ"
"USSEN/NE KERREY BOTH WRONG","tiBfCiam1qI"
"USSEN/NE KERREY CHUCK HAGEL ENDORSEMENT","-4S2roTsLkw"
"USSEN/NE KERREY KIMES RANCH","NoMatch"
"USSEN/NE KERREY KIMES RANCH 2","rTKFlcubJCo"
"USSEN/NE KERREY KIMES RANCH 60","it_Bfj0oKtQ"
"USSEN/NE KERREY NO SUBSTITUTE","3t2XbavAmSo"
"USSEN/NE KERREY RELENTLESS DETERMINATION","NDLbQDFbQrE"
"USSEN/NE KERREY WASHINGTON IS A MESS","PM2E78gtD9k"
"USSEN/NE NERP&FISCHER SUPPORT OBAMA'S AGENDA","NoChannel"
"USSEN/NJ KYRILLOS ECONOMIC STRATEGY 15","NoMatch"
"USSEN/NJ MENENDEZ ALL ABOUT FAMILY","5NpDhOINxuo"
"USSEN/NJ MENENDEZ EDUCATION SPENDING","ODk2fE8TTeU"
"USSEN/NJ MENENDEZ MIDDLE CLASS UNDER ATTACK","OfjfJSjkWIY"
"USSEN/NJ MENENDEZ REBUILD THE MIDDLE CLASS","G29LU2TN0SU"
"USSEN/NJ MENENDEZ THIS IS WHO I AM","BM9WeKIPhZo"
"USSEN/NM HEINRICH 14 YEARS AGO","tH2uY5dhrd4"
"USSEN/NM HEINRICH A LONG TIME","U6FBcByIc5o"
"USSEN/NM HEINRICH DIRECTION","5d5d4YsBTM4"
"USSEN/NM HEINRICH HERE THEY COME","ujtQKUURbrI"
"USSEN/NM HEINRICH KNOWS WHAT'S IMPORTANT","hIWa6NgStso"
"USSEN/NM HEINRICH LIVING WITH DIGNITY","mcLPWrOCVrM"
"USSEN/NM HEINRICH MILITARY FAMILIES","O9-3M1Lwzfs"
"USSEN/NM HEINRICH PRIORITIES","fka_UisLg0I"
"USSEN/NM HEINRICH STRUGGLING TO GET BY","8NIJ1LRCvsU"
"USSEN/NM HEINRICH TO DO LIST","Yjd-0191xs4"
"USSEN/NM HEINRICH TOP 5 WAYS","x4JCQjMS2s8"
"USSEN/NM HEINRICH VALUES & PRIORITIES","8o0oDEMmI9Q"
"USSEN/NM NMDP&HEINRICH LEVEL PLAYING FIELD","RL2_jeNkVLQ"
"USSEN/NM WILSON AIR FORCE ACADEMY","VZos36SgHL8"
"USSEN/NM WILSON BARRIERS WERE MEANT TO BE BROKEN","EJ5bcNCOL-w"
"USSEN/NM WILSON DEFENSE CUTS","SGA6V1u-17k"
"USSEN/NM WILSON DEMOCRATS","BY6igjxj0Fc"
"USSEN/NM WILSON EXTREMIST LEFT WING POLITICS","p62fBLbRUeg"
"USSEN/NM WILSON HONOR CODE","dsi8BhRFflE"
"USSEN/NM WILSON HOW I SEE IT","WSHRuQlD0qQ"
"USSEN/NM WILSON KNOWINGLY","mcNOhUkbYG4"
"USSEN/NM WILSON MAKING THINGS WORSE","WhhwvVaAClo"
"USSEN/NM WILSON OUR MOM","Vo14mTfFmhU"
"USSEN/NM WILSON SOCIAL SECURITY CARD","qj2eu9d0lZI"
"USSEN/NM WILSON STICK TO A BUDGET","WAo6OXtRXHM"
"USSEN/NM WILSON STILL WAITING","N_wQ4Qi2TSQ"
"USSEN/NM WILSON THE WASHINGTON DIRECTION","BdyYyMETGjA"
"USSEN/NM WILSON TRUST HER 15","NoMatch"
"USSEN/NM WILSON WALL STREET BONUSES","nHlgrCSedpE"
"USSEN/NV BERKLEY ANOTHER SCAM","NoMatch"
"USSEN/NV BERKLEY ATTACKS AGAINST ME","NoMatch"
"USSEN/NV BERKLEY CLINTON ENDORSEMENT","NoMatch"
"USSEN/NV BERKLEY EDUCATION CUTS","NoMatch"
"USSEN/NV BERKLEY LAW ENFORCEMENT ENDORSEMENTS","NoMatch"
"USSEN/NV BERKLEY MIDDLE CLASS OPPORTUNITIES","NoMatch"
"USSEN/NV BERKLEY NEVER BEEN FOR YOU","kOZ-AwWSc3Q"
"USSEN/NV BERKLEY NEVER BEEN FOR YOU 2","NoMatch"
"USSEN/NV BERKLEY PATRICK CLARY","NoMatch"
"USSEN/NV BERKLEY REAL STORY","NoMatch"
"USSEN/NV BERKLEY REALLY FOR YOU","NoMatch"
"USSEN/NV BERKLEY REALLY NOT FOR YOU","eQfK8x6qR4A"
"USSEN/NV BERKLEY STANLEY COPELAND 60","NoMatch"
"USSEN/NV BERKLEY STRENGTHENED MEDICARE","PXToogaNIio"
"USSEN/NV BERKLEY TWISTED AND NOT TRUE","JO5i4LAnESw"
"USSEN/NV BERKLEY UNEMPLOYMENT BENEFITS","NoMatch"
"USSEN/NV BERKLEY VETERAN MENTAL HEALTH 60","LwuftdKFIBQ"
"USSEN/NV DSCC&BERKLEY REALLY NOT FOR YOU","NoMatch"
"USSEN/NV HELLER BIPARTISANSHIP","NoMatch"
"USSEN/NV HELLER ENERGY TAX","NoMatch"
"USSEN/NV HELLER FACTS","NoMatch"
"USSEN/NV HELLER FORECLOSED HOMES","NoMatch"
"USSEN/NV HELLER FORECLOSED HOMES 2","NoMatch"
"USSEN/NV HELLER ITALY TRIP","NoMatch"
"USSEN/NV HELLER JOBS JOBS JOBS","NoMatch"
"USSEN/NV HELLER LIE OF THE YEAR","NoMatch"
"USSEN/NV HELLER MEDICARE CUTS","NoMatch"
"USSEN/NV HELLER MEDICARE CUTS 2","NoMatch"
"USSEN/NV HELLER MOST CORRUPT 2","NoMatch"
"USSEN/NV HELLER NATIONAL ENERGY TAX","NoMatch"
"USSEN/NV HELLER NONSENSE","NoMatch"
"USSEN/NV NRSC&HELLER CONSEQUENCES","NoMatch"
"USSEN/NV NRSC&HELLER SANDOVAL ENDORSEMENT","NoMatch"
"USSEN/NY GILLIBRAND 9-11 HEALTH BILL","Hs_zvj5H7Ns"
"USSEN/NY GILLIBRAND EXACT SAME RULES","3W3GiJatLg4"
"USSEN/NY GILLIBRAND MANUFACTURING PLANTS","4z_KA8VScos"
"USSEN/NY GILLIBRAND REBUILD OUR ECONOMY","U8iVTQRa3es"
"USSEN/NY GILLIBRAND WOMEN'S ISSUES","WMp6bIu4oHY"
"USSEN/NY NOREN INSIDER TRADING","NoChannel"
"USSEN/NY NOREN STUDENT LOANS","NoChannel"
"USSEN/OH BROWN&DSCC UNQUALIFIED CRONIES","NoMatch"
"USSEN/OH BROWN A REAL CHOICE","YCphesc_LLM"
"USSEN/OH BROWN ALL ABOUT THE NUMBERS","NoMatch"
"USSEN/OH BROWN BOTH FROM OHIO","uebRNfk5td4"
"USSEN/OH BROWN DISHONEST","NoMatch"
"USSEN/OH BROWN DISHONEST REV","NoMatch"
"USSEN/OH BROWN DISPATCH ENDORSEMENT","OwkSYQVgvZs"
"USSEN/OH BROWN DON'T BELIEVE THE ATTACKS","NoMatch"
"USSEN/OH BROWN ENQUIRER ENDORSEMENT","AmPcVYnCy30"
"USSEN/OH BROWN FAIR CHINA TRADE","1k9z7WwaJQY"
