"creative","uid"
"HOUSE/AK01 YOUNG GROWN WITH ALASKA","NoChannel"
"HOUSE/AL02 FORD TIME AND AGAIN","NoChannel"
"HOUSE/AL02 ROBY THESE ARE OUR CHILDREN","NoChannel"
"HOUSE/AL04 ADERHOLT TROUBLE ABROAD TROUBLE AT HOME","NoChannel"
"HOUSE/AL06 BAILEY RUNNING AS A PROUD AMERICAN","NoMatch"
"HOUSE/AL06 BAILEY RUNNING AS A PROUD AMERICAN 10","NoMatch"
"HOUSE/AR01 CRAWFORD IT CAME FROM WASHINGTON","bqAfEUP4evU"
"HOUSE/AR01 CRAWFORD TICKING TIME BOMB","QEtYnTXi_yc"
"HOUSE/AR02 GRIFFIN KEYSTONE XL PIPELINE","NoChannel"
"HOUSE/AR04 COTTON FIGHT THROUGH THE FIRE 15","VQd-oNNr2XQ"
"HOUSE/AR04 COTTON WE ALL TOOK AN OATH","5Cj0q0EbQTs"
"HOUSE/AZ01 KIRKPATRICK COWBOYS","xB8hnNNCbMk"
"HOUSE/AZ01 KIRKPATRICK DRIVEN","H-vApzyuhVc"
"HOUSE/AZ01 KIRKPATRICK REFUNDED","GokdiJLMrpw"
"HOUSE/AZ01 KIRKPATRICK RIGHT WAY","IwzYREAxI0M"
"HOUSE/AZ01 PATON&NRCC LEAD BY EXAMPLE","h-9_m2JpKus"
"HOUSE/AZ01 PATON KIRKPATRICK OBAMACARE","0SxXVygJTWY"
"HOUSE/AZ02 BARBER&DCCC FALSE ATTACKS REV","NoMatch"
"HOUSE/AZ02 BARBER DEMONSTRATED HIS RESILIENCE","NoMatch"
"HOUSE/AZ02 BARBER EXPERIENCE AND DEEP ROOTS","NoMatch"
"HOUSE/AZ02 BARBER FRAN","NoMatch"
"HOUSE/AZ02 BARBER MCSALLY FALSE ATTACKS","NoMatch"
"HOUSE/AZ02 BARBER WORKED HARD","NoMatch"
"HOUSE/AZ02 MCSALLY BARBER FIX WASHINGTON","NoMatch"
"HOUSE/AZ02 MCSALLY BARBER GONE WASHINGTON","NoMatch"
"HOUSE/AZ02 MCSALLY IS NOT AFRAID OF A GOOD FIGHT","NoMatch"
"HOUSE/AZ02 MCSALLY LEADS IN THEIR FOOTSTEPS","NoMatch"
"HOUSE/AZ02 MCSALLY PIONEERING SPIRIT","x3-mcf9owZQ"
"HOUSE/AZ02 MCSALLY REKINDLE","1-edDFTY9iM"
"HOUSE/AZ02 MCSALLY STRIPES","NoMatch"
"HOUSE/AZ08 AZDP&BARBER THE RIGHT WAY","NoChannel"
"HOUSE/AZ08 BARBER BROKE","NoChannel"
"HOUSE/AZ08 BARBER COMMON GROUND","NoChannel"
"HOUSE/AZ08 BARBER FALSE ATTACKS","NoChannel"
"HOUSE/AZ08 BARBER SMALL BUSINESS","NoChannel"
"HOUSE/AZ08 KELLY&NRCC DISTORTING RECORD","NoChannel"
"HOUSE/AZ08 KELLY BARBER'S ATTACKS","NoChannel"
"HOUSE/AZ08 KELLY HIGH COST OF ENERGY","NoChannel"
"HOUSE/AZ08 KELLY NEXT GENERATION","NoChannel"
"HOUSE/AZ08 KELLY SIGNS","NoChannel"
"HOUSE/AZ08 MCSALLY PIONEERING SPIRIT","NoChannel"
"HOUSE/AZ09 PARKER EXPOSES THE ATTACKS","NoMatch"
"HOUSE/AZ09 PARKER SINEMA PRADA SOCIALIST","NoMatch"
"HOUSE/AZ09 PARKER TOUGH UPBRINGING","NoMatch"
"HOUSE/AZ09 SINEMA&DCCC AS A SOCIAL WORKER","vSZXNoa6X5o"
"HOUSE/AZ09 SINEMA MORAL OBLIGATION","eDi3riI1KTg"
"HOUSE/AZ09 SINEMA PARKER FORCE VIEWS ON WOMEN","csM6A65D4cA"
"HOUSE/CA03 GARAMENDI&DCCC VETERANS REV 2","NoMatch"
"HOUSE/CA03 GARAMENDI&DCCC WATER","eysxIRQeGiY"
"HOUSE/CA03 GARAMENDI ALWAYS BEEN A LEADER","NoMatch"
"HOUSE/CA03 GARAMENDI CLINTON IN THIS TOGETHER","G3cJJN1br2o"
"HOUSE/CA03 GARAMENDI GREW UP ON THIS RANCH","0bJq3lTLxEE"
"HOUSE/CA03 GARAMENDI MAKE IT IN AMERICA","-puBEpSWiO8"
"HOUSE/CA03 GARAMENDI VETERANS","NoMatch"
"HOUSE/CA03 VANN NEW DIRECTION","h8xK5cO5TSk"
"HOUSE/CA06 MATSUI AN HONOR","Gzqv96Ie86A"
"HOUSE/CA07 BERA&DCCC IF YOU DON'T DO YOUR JOB","SxMthosRtAY"
"HOUSE/CA07 BERA LUNGREN IS OUT OF STEP","QxFLpBDSVZo"
"HOUSE/CA07 BERA MORE THAN AN OATH","DQm5IiQdH-A"
"HOUSE/CA07 BERA PEOPLE ARE STRUGGLING","mMnmOjgvRkg"
"HOUSE/CA07 BERA SUE LUTZ RAPE IS RAPE","NoMatch"
"HOUSE/CA07 LUNGREN&NRCC MEGAN'S LAW","NoChannel"
"HOUSE/CA07 LUNGREN BERA GAS TAX","NoChannel"
"HOUSE/CA07 LUNGREN BERA TALKING ABOUT RAISING TAXES","NoChannel"
"HOUSE/CA07 LUNGREN SQUEEZE INN","NoChannel"
"HOUSE/CA09 GILL MCNERNEY DOESN'T REPRESENT THE VALLEY","NoMatch"
"HOUSE/CA09 GILL MCNERNEY HASN'T BEEN WORKING FOR US","NoMatch"
"HOUSE/CA09 GILL MCNERNEY JOBS IN DENMARK","NoMatch"
"HOUSE/CA09 GILL MCNERNEY THE TRUTH","NoMatch"
"HOUSE/CA09 GILL SAME POLITICIANS SAME RESULTS","NoMatch"
"HOUSE/CA09 MCNERNEY GILL NEVER HELD A FULL TIME JOB","VLL7Eck2HME"
"HOUSE/CA09 MCNERNEY LOCAL VETERANS","0qs28HbPxtU"
"HOUSE/CA09 MCNERNEY WHOA","mfK1J62rNZI"
"HOUSE/CA09 MCNERNY UNFAIR TRADE","NoChannel"
"HOUSE/CA10 DENHAM BIOGRAPHY","NoChannel"
"HOUSE/CA10 DENHAM DISAGREES","NoChannel"
"HOUSE/CA10 DENHAM HERNANDEZ TRAIN","NoChannel"
"HOUSE/CA10 DENHAM SPECIAL PLACE","NoChannel"
"HOUSE/CA10 HERNANDEZ&DCCC BELIEVE","2AT-rWKnD-I"
"HOUSE/CA10 HERNANDEZ DENHAM MOST HYPOCRITICAL MAN IN CONGRESS","BmWvNmN0DzY"
"HOUSE/CA10 HERNANDEZ FIGHTING","kdDp7jFr_3w"
"HOUSE/CA10 HERNANDEZ WHAT IS HAPPENING","TwlM9jIdqBc"
"HOUSE/CA11 FULLER MUSLIM NIGHTMARE","NoChannel"
"HOUSE/CA16 COSTA ENDORSEMENTS","NoChannel"
"HOUSE/CA16 COSTA HARD WORK LEADERSHIP REV","NoChannel"
"HOUSE/CA16 COSTA LEADERSHIP REV","NoChannel"
"HOUSE/CA16 COSTA YOU CAN'T FAKE FARMING","NoChannel"
"HOUSE/CA17 LI FENDED OFF","NoMatch"
"HOUSE/CA20 FARR IT'S NOT JUST PRETTY SCENERY","NoChannel"
"HOUSE/CA20 FARR PEOPLE ARE SCARED","NoChannel"
"HOUSE/CA20 FARR PEOPLE NEED SOME HELP","NoChannel"
"HOUSE/CA21 HERNANDEZ BIG MONEY BOYS","75TGweOMGsk"
"HOUSE/CA21 HERNANDEZ IN VERY HARD TIMES","NoMatch"
"HOUSE/CA21 HERNANDEZ JOBS FIRST REV","NoMatch"
"HOUSE/CA21 HERNANDEZ SAFETY NET","NoMatch"
"HOUSE/CA21 VALADAO FARMER FAMILY LEADER","NoChannel"
"HOUSE/CA21 VALADAO MORE JOBS","NoChannel"
"HOUSE/CA21 VALADAO PRIORITIES","NoChannel"
"HOUSE/CA22 LEE HONORED","Fb4cvCRS-oo"
"HOUSE/CA22 LEE SMALLER GOVERNMENT","YXC9OmW7z1Q"
"HOUSE/CA22 LEE VISALIA TIMES-DELTA SAID","Tep_GSann54"
"HOUSE/CA23 MCCARTHY IS A MAN OF INTEGRITY","2Ic7f8PvmD8"
"HOUSE/CA23 MCCARTHY ROBERT SUTHERLAND MEDALS","9CuX48vOto0"
"HOUSE/CA24 CAPPS FRIENDS","tdxBZncIhtE"
"HOUSE/CA24 CAPPS MALDONADO FALSLEY ATTACKING","qFHHv4SA1-Q"
"HOUSE/CA24 CAPPS MALDONADO WILL SAY ANYTHING","lGgF8bIfl7k"
"HOUSE/CA24 CAPPS NEWSPAPERS REPORT","A4Nik9niixw"
"HOUSE/CA24 CAPPS OUR CHOICE IS CLEAR","n61X8UQl56M"
"HOUSE/CA24 CAPPS SCHWARZENEGGER SAID JUMP","21Xrbw2g2K0"
"HOUSE/CA24 CAPPS STANDS WITH MIDDLE CLASS FAMILIES","R1nuNWMIuL4"
"HOUSE/CA24 CAPPS THOUGHTFUL AND BIPARTISAN","1Lfrfb6a2MI"
"HOUSE/CA24 CAPPS TRUST","gKsZzd3vbjs"
"HOUSE/CA24 MALDONADO&RNC BAD IDEAS","NoMatch"
"HOUSE/CA24 MALDONADO AMERICA","fLuoY2jj00M"
"HOUSE/CA24 MALDONADO ASK CAPPS","NoMatch"
"HOUSE/CA24 MALDONADO OWN","NoMatch"
"HOUSE/CA24 MALDONADO SAVE JOBS FROM CHINA","NoMatch"
"HOUSE/CA24 MALDONADO SET THE RECORD STRAIGHT","NoMatch"
"HOUSE/CA24 MALDONADO SMALL BUSINESS OWNER AND A MOM","NoMatch"
"HOUSE/CA24 MALDONADO THERE'S A TRAIN COMING","NoMatch"
"HOUSE/CA24 MALDONADO TIME FOR YOU TO DECIDE","NoMatch"
"HOUSE/CA26 BROWNLEY STRICKLAND JUST DOESN'T GET IT","NAI-o6_2LFA"
"HOUSE/CA26 BROWNLEY TROUBLING TIMES FOR WOMEN","NoMatch"
"HOUSE/CA26 STRICKLAND JACQUELYN'S STORY","aNvkHeHO8wE"
"HOUSE/CA26 STRICKLAND LIBERAL BROWNLEY","NoMatch"
"HOUSE/CA26 STRICKLAND OUR HOME","afBHDh_y2DU"
"HOUSE/CA26 STRICKLAND PUTS VENTURA COUNTY FIRST","hYFXxdh_les"
"HOUSE/CA26 STRICKLAND THE CHOICE","NoMatch"
"HOUSE/CA33 BLOOMFIELD NATIONAL DEBT","cCRIMVX30hQ"
"HOUSE/CA33 WAXMAN BLOOMFIELD'S RECORD","4P4AOTy2uGc"
"HOUSE/CA36 BONO-MACK GAS PRICES","CoOGZwZFcl4"
"HOUSE/CA36 BONO-MACK MY DAD","G-1oKLMhiQ4"
"HOUSE/CA36 BONO-MACK RUIZ WALKING IN THE LAND OF GIANTS","mbx1XVof114"
"HOUSE/CA36 BONO-MACK SECURITY","eE_tyFUFvrA"
"HOUSE/CA36 BONO-MACK STOP","XjeGp_M5TPM"
"HOUSE/CA36 BONO-MACK THANKSGIVING","w0v8HJREzqs"
"HOUSE/CA36 BONO-MACK UNIQUE RECORD","ZTmiiS_nP7k"
"HOUSE/CA36 RUIZ ACCURATE PICTURE","Bd_PDArF5TI"
"HOUSE/CA36 RUIZ BONO-MACK DIRTIEST CAMPAIGN I'VE EVER SEEN","YMmilQNoupo"
"HOUSE/CA36 RUIZ BONO-MACK DIRTIEST CAMPAIGN I'VE EVER SEEN REV","NoMatch"
"HOUSE/CA36 RUIZ BONO-MACK HAS CHANGED","W5H0SUnZ5Ik"
"HOUSE/CA36 RUIZ EMERGENCY ROOM","jd6Ge09fgrQ"
"HOUSE/CA36 RUIZ IT TAKES SOME BRASS","NoMatch"
"HOUSE/CA36 RUIZ PATIENTS","wznFhYHSqTk"
"HOUSE/CA36 RUIZ PROTECTING NATIVE AMERICAN","Vh92WQ3aZ0s"
"HOUSE/CA36 RUIZ WHAT'S HAPPENED TO BONO-MACK","qTqL8jRghno"
"HOUSE/CA36 RUIZ WHO'S SIDE","ZhQ18Pwicu0"
"HOUSE/CA38 CAMPOS CERTAINTY CLARITY AND STABILITY 60","NoChannel"
"HOUSE/CA52 BILBRAY&RNC PETERS CUT MEDICARE","NoChannel"
"HOUSE/CA52 BILBRAY BRIANA TERMINAL CANCER","NoChannel"
"HOUSE/CA52 BILBRAY SURFED THESE WATERS","NoChannel"
"HOUSE/CA52 BILBRAY WHISTLEBLOWER EXPOSED PETERS","NoChannel"
"HOUSE/CA52 PETERS&DCCC ANOTHER DAY","jx817_BsT6k"
"HOUSE/CA52 PETERS BILBRAY AFTER TWENTY YEARS","Ra4gY5U3oew"
"HOUSE/CA52 PETERS JOELLE","vcgWX3CA6G8"
"HOUSE/CA52 PETERS KIDS","hsfAyDc63gk"
"HOUSE/CO03 PACE&DCCC NEARBY","ZAY7S6nenic"
"HOUSE/CO03 PACE AMERICAN STEEL","fb1V4-9CCiE"
"HOUSE/CO03 PACE REGULAR DAY","TRiFH3JDZx4"
"HOUSE/CO03 PACE SCORCHED EARTH","l9gutJu7RNg"
"HOUSE/CO03 TIPTON&NRCC MEDICARE PROMISE","PdwZ3juXmd4"
"HOUSE/CO03 TIPTON PACE HURTING SENIORS","LKM8hEYR9sQ"
"HOUSE/CO03 TIPTON PACE LOVES TAXES","2S-la5mNzbM"
"HOUSE/CO03 TIPTON PACE WE KNOW","k9UNQpcFKug"
"HOUSE/CO05 ANDERSON LEGITIMATE RAPE","NoMatch"
"HOUSE/CO06 COFFMAN KATIE'S LAW","WsD2CDI3fnU"
"HOUSE/CO06 COFFMAN MIDDLE CLASS","oDTiUDM2XYE"
"HOUSE/CO06 COFFMAN MIKLOSI'S NEGATIVE CAMPAIGN","NoMatch"
"HOUSE/CO06 COFFMAN PARENTS","t8pVkTVEHtU"
"HOUSE/CO06 COFFMAN SERVICE ABOVE SELF","oRqwSlXRwaM"
"HOUSE/CO06 COFFMAN THE ONLY WAY TO STOP A SERIAL PREDATOR","NoMatch"
"HOUSE/CO06 MIKLOSI&DCCC STEAMROLLING","NoMatch"
"HOUSE/CO06 MIKLOSI THINK YOU KNOW","Pjvo44arN_U"
"HOUSE/CO06 MIKLOSI WHEN","QCsTkaBqrco"
"HOUSE/CO07 COORS CAR","gtqt1NwbV2U"
"HOUSE/CO07 COORS PERLMUTTER'S RECORD IS SIMPLE","OuuXFoxYhSI"
"HOUSE/CO07 COORS PERLMUTTER EXTREME","jlS6MWGfo5Q"
"HOUSE/CO07 COORS PERLMUTTER WORK THE SYSTEM","OEAOZv0XMkg"
"HOUSE/CO07 COORS THAT'S NOT ME","-MtJUPt-Lng"
"HOUSE/CO07 PERLMUTTER&DCCC DIFFERENT IDEA","NoMatch"
"HOUSE/CO07 PERLMUTTER COORS DESPICABLE THINGS","NoMatch"
"HOUSE/CO07 PERLMUTTER COORS MONEY WHERE HIS MOUTH IS","NoMatch"
"HOUSE/CO07 PERLMUTTER DEANNE AND CHAD STORY","Bowl1_miR0A"
"HOUSE/CT02 COURTNEY COMMITMENT","bGN7WhcgJt0"
"HOUSE/CT02 COURTNEY SUBMARINE CONSTRUCTION","JGfNRC-96lk"
"HOUSE/CT05 ESTY&DCCC WALKS THE WALK","NoMatch"
"HOUSE/CT05 ESTY ON THE BACKS OF THE ELDERLY","ScpFc8uqpNc"
"HOUSE/CT05 ESTY RORABACK SMEAR NOT TRUE","5D3gvjEPJ8M"
"HOUSE/CT05 ESTY WHEN WASHINGTON REPUBLICANS CALL","lrVJyrw6ZsA"
"HOUSE/CT05 RORABACK ESTY FALSE ATTACKS","NoMatch"
"HOUSE/CT05 RORABACK ESTY MOVE OUT","NoMatch"
"HOUSE/CT05 RORABACK ESTY TOLD SENIORS","NoMatch"
"HOUSE/CT05 RORABACK SOLUTIONS","NoMatch"
"HOUSE/FL02 LAWSON&DCCC SOUTHERLAND OUT OF TOUCH","naM3SA8Z_fI"
"HOUSE/FL02 LAWSON AT LUNCH TIME","NoMatch"
"HOUSE/FL02 LAWSON LOST EVERYTHING BIO","-4anziJalhA"
"HOUSE/FL02 LAWSON SOUTHERLAND PROMISED TO CHANGE CONGRESS","NoMatch"
"HOUSE/FL02 LAWSON SOUTHERLAND TURNED HIS BACK ON WOMEN","P-QMpvzCsD4"
"HOUSE/FL02 LAWSON TALLAHASSEE DEMOCRAT","-rs8fTDbbC4"
"HOUSE/FL02 SOUTHERLAND&NRCC HAPPY WITH WASHINGTON","NoMatch"
"HOUSE/FL02 SOUTHERLAND&NRCC PEOPLE COME FIRST","NoMatch"
"HOUSE/FL02 SOUTHERLAND&NRCC WE HELP PEOPLE","NoMatch"
"HOUSE/FL02 SOUTHERLAND LAWSON DOWN IN THE POLLS","NoMatch"
"HOUSE/FL02 SOUTHERLAND MEET SAMANTHA","C1KwTMX7yPo"
"HOUSE/FL02 SOUTHERLAND PELOSI LOVES LAWSON","NoMatch"
"HOUSE/FL03 YOHO PIGS AT THE TROUGH REV","HkVG1StqOzQ"
"HOUSE/FL03 YOHO TED'LL DO WHAT'S RIGHT","toOoshlb_X0"
"HOUSE/FL09 GRAYSON LONG RAISE AGE","NoChannel"
"HOUSE/FL09 GRAYSON SOCIAL SECURITY","NoChannel"
"HOUSE/FL09 GRAYSON TAKE ON","NoChannel"
"HOUSE/FL09 GRAYSON TOM LUPO ENDORSEMENT","NoChannel"
"HOUSE/FL10 DEMINGS A LOT OF NOISE OUT THERE","NoChannel"
"HOUSE/FL10 DEMINGS PRAISED","NoChannel"
"HOUSE/FL10 DEMINGS SET ASIDE THE EXCUSES","NoChannel"
"HOUSE/FL10 DEMINGS WEBSTER WATCHLIST","NoChannel"
"HOUSE/FL12  BILIRAKIS WASHINGTON IN GRIDLOCK","UjRJMk1xMAQ"
"HOUSE/FL13 EHRLICH YOUNG HE'S LOST TOUCH","NoChannel"
"HOUSE/FL13 YOUNG FOUGHT TO KEEP MACDILL OPEN","NoChannel"
"HOUSE/FL13 YOUNG YEAR AFTER YEAR","NoChannel"
"HOUSE/FL13 YOUNG YEAR AFTER YEAR REV","NoChannel"
"HOUSE/FL16 BUCHANAN AMERICA'S CAN DO SPIRIT","TnpLH5w-0dY"
"HOUSE/FL16 BUCHANAN FITZGERALD SUPPORTS RAIDING","NoMatch"
"HOUSE/FL16 FITZGERALD&DCCC ABSOLUTELY SICK","R2aWFhhapuo"
"HOUSE/FL16 FITZGERALD MIDDLE CLASS FAMILY LIKE MINE 60","jKpoHdVp9hE"
"HOUSE/FL18 MURPHY&DCCC TWICE","E06Ix1ogPSg"
"HOUSE/FL18 MURPHY AWFUL PICTURE","NoMatch"
"HOUSE/FL18 MURPHY CPA","pilEfJrxNTQ"
"HOUSE/FL18 MURPHY GET RIGHT DOWN TO IT","NoMatch"
"HOUSE/FL18 MURPHY KIDS PLAYGROUND","PbPUUSJluNQ"
"HOUSE/FL18 MURPHY TIME OUT","td1KSZ4yqRw"
"HOUSE/FL18 MURPHY TRUTH BY THE NUMBERS","NoMatch"
"HOUSE/FL18 MURPHY TRUTH ON JOBS","NoMatch"
"HOUSE/FL18 MURPHY WEST FACTS","NoMatch"
"HOUSE/FL18 MURPHY WEST TAKE IT AWAY","NoMatch"
"HOUSE/FL18 MURPHY WEST WRONG FOR WOMEN","NoMatch"
"HOUSE/FL18 WEST ANGELA WEST","obsLfaEtT1A"
"HOUSE/FL18 WEST GREATEST COUNTRY ON EARTH","NoMatch"
"HOUSE/FL18 WEST IRAN THREATENING ISRAEL AND AMERICA","NoMatch"
"HOUSE/FL18 WEST JOBS","NoMatch"
"HOUSE/FL18 WEST JUST GETTING STARTED 60","eqGlutCQNFA"
"HOUSE/FL18 WEST MURPHY'S JOBS PLAN","NoMatch"
"HOUSE/FL18 WEST MURPHY A COWARD","RHK_BPiL7eE"
"HOUSE/FL18 WEST MURPHY CAN'T BE TRUSTED","NoMatch"
"HOUSE/FL18 WEST MURPHY CUT MEDICARE","NoMatch"
"HOUSE/FL18 WEST MURPHY DETAILS SHOCKING","NoMatch"
"HOUSE/FL18 WEST MURPHY IS DESPERATE","NoMatch"
"HOUSE/FL18 WEST MURPHY ISN'T BEING HONEST","NoMatch"
"HOUSE/FL18 WEST MURPHY ISN'T TELLING YOU THE TRUTH","NoMatch"
"HOUSE/FL18 WEST ROBERT DELGADO 60","NoMatch"
"HOUSE/FL18 WEST ROGER DUNSHEE","NoMatch"
"HOUSE/FL18 WEST SENIORS","NoMatch"
"HOUSE/FL18 WEST SHAMEFUL","NoMatch"
"HOUSE/FL18 WEST THAT NIGHT","NoMatch"
"HOUSE/FL18 WEST VETERANS","NoMatch"
"HOUSE/FL18 WEST WE HAVE A RESPONSIBILITY","NoMatch"
"HOUSE/FL18 WEST WE KNOW MURPHY SUPPORTS OBAMACARE","NoMatch"
"HOUSE/FL18 WEST WHO IS PATRICK MURPHY","NoMatch"
"HOUSE/FL19 RADEL AT HOME WE BALANCE OUR BUDGET","NoChannel"
"HOUSE/FL19 ROACH ACTION NOT TALK","NoChannel"
"HOUSE/FL20 TERRY A VOTE FOR DEAD BABIES","NoChannel"
"HOUSE/FL20 TERRY BROKEN SEX TOY","NoChannel"
"HOUSE/FL20 TERRY IS YOUR BABY A PUNISHMENT 15","NoChannel"
"HOUSE/FL20 TERRY MUSLIM TERRORISTS","NoChannel"
"HOUSE/FL22 FRANKEL HASNER NEVER ON OUR SIDE","wq7YNwezcCE"
"HOUSE/FL22 FRANKEL HASNER REAL","HZ5fEh6O-9I"
"HOUSE/FL22 FRANKEL KIDS LEARN BUT NOT LIKE THIS","bM4h8-In52A"
"HOUSE/FL22 FRANKEL MEDICARE FRAUD","gHdaGombNd0"
"HOUSE/FL22 HASNER&NRCC FRANKEL CORRUPTION","L8tNGKF25xs"
"HOUSE/FL22 HASNER FRANKEL GOTTA GO","1qAYbJaapbI"
"HOUSE/FL22 HASNER IT'S ABOUT MATH","LqyHzYn9VkI"
"HOUSE/FL22 HASNER START","v_hIyxRyvXk"
"HOUSE/FL23 HARRINGTON FAILED POLICIES","NoMatch"
"HOUSE/FL23 HARRINGTON FOR OVER THIRTY YEARS","uaNLp6pTl1Q"
"HOUSE/FL23 WASSERMAN-SCHULTZ AS A MOM","UR1ffzg4qOM"
"HOUSE/FL26 RIVERA GARCIA POLITICAL CORRUPTION","NoChannel"
"HOUSE/GA01 KINGSTON BALANCING THE BUDGET","TxnXztOs1xA"
"HOUSE/GA01 KINGSTON HERE'S WHAT PEOPLE ARE SAYING","inUYc5wuU4Y"
"HOUSE/GA01 KINGSTON HOPING FOR A CHANGE","NoMatch"
"HOUSE/GA01 MESSINGER FOCUS RESOURCES","q4EqHA-1lQY"
"HOUSE/GA02 BISHOP I KNOW WHO MY FRIENDS ARE","NoChannel"
"HOUSE/GA02 BISHOP ROBERT WALKER AGENT ORANGE","NoChannel"
"HOUSE/GA02 HOUSE THREE THINGS","NoChannel"
"HOUSE/GA12 ANDERSON&NRCC BARROW LIES","NoChannel"
"HOUSE/GA12 ANDERSON&NRCC BROMANCE","NoChannel"
"HOUSE/GA12 ANDERSON&NRCC YOU DON'T SIT AROUND","NoChannel"
"HOUSE/GA12 ANDERSON BARROW LIES","NoChannel"
"HOUSE/GA12 ANDERSON BROMANCE","NoChannel"
"HOUSE/GA12 ANDERSON YOU DON'T SIT AROUND","NoChannel"
"HOUSE/GA12 BARROW ANDERSON ON TAXES","NoMatch"
"HOUSE/GA12 BARROW CUT WASTEFUL SPENDING","NoMatch"
"HOUSE/GA12 BARROW HOW IS JOHN DIFFERENT","NoMatch"
"HOUSE/GA12 BARROW INSTITUTE","NoMatch"
"HOUSE/GA12 BARROW IS READY TO DEBATE","NoMatch"
"HOUSE/GA12 BARROW MY GUNS","YvR5qTUOTuY"
"HOUSE/GA12 BARROW SINCE I WAS HERE LAST TIME","NoMatch"
"HOUSE/GA12 BARROW SOME PEOPLE LIKE ME","NoMatch"
"HOUSE/GA12 BARROW WHEN","NoMatch"
"HOUSE/GA12 BARROW WOULD NEVER DO THAT","NoMatch"
"HOUSE/GA12 BARROW YOU'RE WORKING HARD","NoMatch"
"HOUSE/HI01 DJOU DAWN","NoChannel"
"HOUSE/HI01 DJOU I BELIEVE","NoChannel"
"HOUSE/HI01 DJOU I BELIEVE REV","NoChannel"
"HOUSE/HI01 DJOU I SEE MY KIDS' FACES","NoChannel"
"HOUSE/HI01 DJOU NEW FEELING OF HOPE AND PROGRESS","NoChannel"
"HOUSE/HI01 DJOU PROUD OF MY SON IN LAW","NoChannel"
"HOUSE/HI01 DJOU STACEY","NoChannel"
"HOUSE/HI01 DJOU THINGS HAVE GOT TO CHANGE","NoChannel"
"HOUSE/HI01 DJOU WORKING TOGETHER 15","NoChannel"
"HOUSE/HI01 HANABUSA DANIEL AKAKA ENDORSEMENT","iJXMR59ZH1A"
"HOUSE/HI01 HANABUSA DEDICATION","8f-E6zOBAw4"
"HOUSE/HI01 HANABUSA SUCH A SPECIAL PLACE","NoMatch"
"HOUSE/HI01 HANABUSA THIS ELECTION IS PIVOTAL","Ll1e4mAKXRQ"
"HOUSE/HI01 HANABUSA VETERANS RECOGNIZE","vbBgfTjbjig"
"HOUSE/HI01 HANABUSA YOUR VOICE","XCX78YyJ1eM"
"HOUSE/IA01 BRALEY BRASS","NoChannel"
"HOUSE/IA01 BRALEY BROOKLYN IOWA","NoChannel"
"HOUSE/IA01 BRALEY GROWING UP","NoChannel"
"HOUSE/IA01 BRALEY GROWING UP 60","NoChannel"
"HOUSE/IA01 BRALEY HAVING A JOB","NoChannel"
"HOUSE/IA01 BRALEY LANGE A LOT OF NEW PLANS","NoChannel"
"HOUSE/IA01 BRALEY LANGE HAS A DIFFERENT PLAN","NoChannel"
"HOUSE/IA01 BRALEY LANGE WOULD END MEDICARE","NoChannel"
"HOUSE/IA01 BRALEY MY DAD","NoChannel"
"HOUSE/IA01 BRALEY NURSING HOME CARE","NoChannel"
"HOUSE/IA01 BRALEY ON TAXES A CLEAR CHOICE","NoChannel"
"HOUSE/IA01 HUGHES IT'S TIME WE KICK","NoChannel"
"HOUSE/IA01 KRAIL INNOCENT BLOOD","NoChannel"
"HOUSE/IA01 LANGE&NRCC BRALEY'S BROKEN PROMISES","NoChannel"
"HOUSE/IA01 LANGE&NRCC BRALEY THE TRUTH","NoChannel"
"HOUSE/IA01 LANGE BRALEY BEING DISHONEST","NoChannel"
"HOUSE/IA01 LANGE BRALEY GUTLESS","NoChannel"
"HOUSE/IA01 LANGE GOING BROKE","NoChannel"
"HOUSE/IA01 LANGE IOWANS DESERVE THE TRUTH","NoChannel"
"HOUSE/IA01 LANGE QUASKY VALUES","NoChannel"
"HOUSE/IA02 ARCHER LOEBSACK GONE TOO FAR","ESewpV1pzV8"
"HOUSE/IA02 ARCHER NEXT GENERATION","q8tZOdGIjHA"
"HOUSE/IA02 AVERSA INNOCENT BLOOD","NoChannel"
"HOUSE/IA02 LOEBSACK&DCCC ARCHER UNFAIR TRADE","q9h6X8BeB-8"
"HOUSE/IA02 LOEBSACK ANOTHER JOB","y4LpqpQ5OY4"
"HOUSE/IA02 LOEBSACK ARCHER WHOA","y4Op6NofnHo"
"HOUSE/IA02 LOEBSACK THEY FOUGHT FOR US","NoMatch"
"HOUSE/IA02 LOEBSACK WHAT'S RIGHT","wGFfUpocfno"
"HOUSE/IA03 BOSWELL DEAL","NoChannel"
"HOUSE/IA03 BOSWELL DEAL CONTINUED","NoChannel"
"HOUSE/IA03 BOSWELL LATHAM MOVED JOBS","NoChannel"
"HOUSE/IA03 BOSWELL NO ONE GETS LEFT BEHIND","NoChannel"
"HOUSE/IA03 BOSWELL WHO WINS WHO LOSES","NoChannel"
"HOUSE/IA03 LATHAM BOSWELL'S RECORD","SXBUTvljJrs"
"HOUSE/IA03 LATHAM BOSWELL ATTACKING","pmmpiq_JKt4"
"HOUSE/IA03 LATHAM BOSWELL LOOK AT HIS RECORD","qG37Cd4ye7A"
"HOUSE/IA03 LATHAM BOSWELL YOU MAKE YOUR CHOICE","QC1u0ZZ9SUA"
"HOUSE/IA03 LATHAM BOSWELLS ALLIES","n89tbXzm3xA"
"HOUSE/IA03 LATHAM IN THE LAST FOUR YEARS","KgiQ92mvim8"
"HOUSE/IA03 LATHAM IOWA COMMON SENSE","9FgGwwUAHn8"
"HOUSE/IA03 LATHAM REAL WORLD CONSEQUENCES","cP9oQ-8lAxE"
"HOUSE/IA03 LATHAM SUSAN JAENKE KILLED IN IRAQ","Z1GZQd3mdsA"
"HOUSE/IA04 KING&NRCC LIKE HIM","GQlDxT5IBIQ"
"HOUSE/IA04 KING LAND 60","JWCXEgv5miE"
"HOUSE/IA04 KING MARILYN","97b5iet9LAE"
"HOUSE/IA04 KING ON THE BRINK","2r2HVEU2yck"
"HOUSE/IA04 KING THAT'S WHAT LIBERALS DO","VBNv3dQ7JDc"
"HOUSE/IA04 KING TRUTH","fXeYdWsDhDI"
"HOUSE/IA04 KING WELL IT'S ALMOST OVER","BLt0z1r_btM"
"HOUSE/IA04 VILSACK&DCCC BILL CLINTON ENDORSEMENT","xcZDyOEdYrc"
"HOUSE/IA04 VILSACK 7 LAYER SALAD","mgReeVaG1CQ"
"HOUSE/IA04 VILSACK KING VOTED WITH THEM","FxJXpseWyac"
"HOUSE/IA04 VILSACK PROTECT","DyFItYWMbgw"
"HOUSE/IA04 VILSACK SPEAK","XLNQ1EM4iRo"
"HOUSE/IA04 VILSACK SPENT WHOLE LIFE AS TEACHER","3qzc77LCMqs"
"HOUSE/ID02 LEFAVOUR SET POLITICS ASIDE","toufttkEpZo"
"HOUSE/ID02 LEFAVOUR WORKED TO STOP BILLS","Hr6l5wHB7sw"
"HOUSE/ID02 SIMPSON PARTISAN POLITICS","NoChannel"
"HOUSE/ID02 SIMPSON TIRELESS ADVOCATE REV","NoChannel"
"HOUSE/IL08 DUCKWORTH&DCCC WALSH DEABEAT DAD","NoMatch"
"HOUSE/IL08 DUCKWORTH EXTRA MILE","NoMatch"
"HOUSE/IL08 DUCKWORTH MY DAD WAS A PROUD MAN","O9L-19OQS04"
"HOUSE/IL08 DUCKWORTH THE HARD WAY","NoMatch"
"HOUSE/IL08 DUCKWORTH WALSH TOO EXTREME","NoMatch"
"HOUSE/IL08 WALSH JOE WALSH JR","NoChannel"
"HOUSE/IL08 WALSH THE REAL JOE 60","NoChannel"
"HOUSE/IL08 WALSH YOU'VE PROBABLY HEARD","NoChannel"
"HOUSE/IL10 DOLD MODERATE","NoMatch"
"HOUSE/IL10 DOLD SCHNEIDER ATTACKS LAUGHABLE","NoMatch"
"HOUSE/IL10 DOLD SCHNEIDER STICK US WITH THE BILL","NoMatch"
"HOUSE/IL10 SCHNEIDER&DCCC DOLD TEA PARTY","NoChannel"
"HOUSE/IL10 SCHNEIDER&DCCC PRESIDENT JOHNSON MEDICARE","NoChannel"
"HOUSE/IL10 SCHNEIDER&DCCC SOME THINGS DON'T MAKE SENSE","NoChannel"
"HOUSE/IL11 BIGGERT FOSTER LAID OFF WORKERS","NoMatch"
"HOUSE/IL11 FOSTER BIGGERT A WHOPPER","l_wHzEbaR64"
"HOUSE/IL11 FOSTER BIGGERT NOW FALSE ATTACKS","NoMatch"
"HOUSE/IL11 FOSTER BIGGERT THIRTY YEARS IN POLITICS","NoMatch"
"HOUSE/IL11 FOSTER IF YOU LOOK AT THE FACTS","uMf83oi9ok8"
"HOUSE/IL11 FOSTER STRONG MIDDLE CLASS","KRoCsW4dwv8"
"HOUSE/IL12 ENYART&DCCC PLUMMER CLAIM","NoMatch"
"HOUSE/IL12 ENYART&DCCC PLUMMER CUT TAXES FOR MILLIONAIRES","NoMatch"
"HOUSE/IL12 ENYART&DCCC TRACK","YRGl0Yn_uDk"
"HOUSE/IL12 ENYART LEVEL","H4BFXlWyhSM"
"HOUSE/IL12 ENYART PLUMMER A MYTH","NoMatch"
"HOUSE/IL12 ENYART STARTED OUT AT CATERPILLAR","MILVA-CD-xg"
"HOUSE/IL12 PLUMMER&NRCC BUT I DO","NoMatch"
"HOUSE/IL12 PLUMMER AT A CROSSROADS","VuVy6PA6xdY"
"HOUSE/IL12 PLUMMER CHOICES","nvURbRS5bJk"
"HOUSE/IL12 PLUMMER ECONOMY HURTING","NoMatch"
"HOUSE/IL12 PLUMMER UNEMPLOYMENT CLIMBING","NoMatch"
"HOUSE/IL13 DAVIS&NRCC GILL ISN'T TELLING TRUTH","NoMatch"
"HOUSE/IL13 DAVIS CANCER","8ICV8oKgkEY"
"HOUSE/IL13 DAVIS EVERY CHILD IN AMERICA","NoMatch"
"HOUSE/IL13 DAVIS FOR THEM","kKQnNoJSbdw"
"HOUSE/IL13 DAVIS GILL ON SPENDING","NoMatch"
"HOUSE/IL13 DAVIS GILL WASTING TAX DOLLARS","NoMatch"
"HOUSE/IL13 DAVIS GILL WE KNOW","NoMatch"
"HOUSE/IL13 DAVIS JOBS","Xikzcy9vxCA"
"HOUSE/IL13 GILL&DCCC LEGALIZED BRIBERY","CSor1Zkn024"
"HOUSE/IL13 GILL ALL THE NASTY TV COMMERCIALS","FYKUoXymEM8"
"HOUSE/IL13 GILL DISHES","_6JwAA2Ak-Q"
"HOUSE/IL13 GILL POLLY","TH4tQAbMLGQ"
"HOUSE/IL13 GILL SPELL","j88Wy0oU7D0"
"HOUSE/IL13 GILL SUSAN","6R4ASYgfRAs"
"HOUSE/IL13 HARTMAN IF WE'RE REALLY GOING TO BE SERIOUS","NoChannel"
"HOUSE/IL15 MICHAEL WAR ON WOMEN","NoChannel"
"HOUSE/IL17 BUSTOS&DCCC COURT","ZWWjxSZVMpU"
"HOUSE/IL17 BUSTOS EVERY SINGLE PAYCHECK","y8whJSM32nY"
"HOUSE/IL17 BUSTOS MY FAMILY","NoMatch"
"HOUSE/IL17 BUSTOS SCHILLING HOW LOW","1otea1kjY64"
"HOUSE/IL17 BUSTOS TOO MANY PEOPLE WORK HARD","THwCgUMMvS4"
"HOUSE/IL17 SCHILLING BUSTOS RECKLESS RIDE","NoMatch"
"HOUSE/IL17 SCHILLING JOBS","NoMatch"
"HOUSE/IL17 SCHILLING JOBS 45","NoMatch"
"HOUSE/IL17 SCHILLING LEADS BY EXAMPLE","wj-qJ1h0huc"
"HOUSE/IL17 SCHILLING LEADS BY EXAMPLE REV","l-lml1P02YA"
"HOUSE/IL17 SCHILLING LET'S GET REAL","QmnZePvKRgQ"
"HOUSE/IL17 SCHILLING WE HAVE TO SAVE MEDICARE","hwQ-PPbirAo"
"HOUSE/IL18 SCHOCK FARMING","NoMatch"
"HOUSE/IL18 SCHOCK HELPS VETERANS","XXjdEewI_jg"
"HOUSE/IL18 SCHOCK WHY CONGRESS","Y2uMIwUnWGw"
"HOUSE/IN02 MULLEN&IDCVC UP AGAINST","7sGbzfnNj1w"
"HOUSE/IN02 MULLEN&IDCVC WALORSKI TURNED HER BACK","gSWQiHmE3xY"
"HOUSE/IN02 MULLEN FOR WHAT'S RIGHT","6Yg3y1jqSjw"
"HOUSE/IN02 MULLEN HIDDEN BEHIND THESE ADS","z12vTOUV-H0"
"HOUSE/IN02 MULLEN LUMBER YARD","eJFbvfb74Ec"
"HOUSE/IN02 MULLEN RUNNING","Nc-PZNhpOtM"
"HOUSE/IN02 MULLEN WASHINGTON BICKERING POLITICIANS","3NA1ZM1rH7A"
"HOUSE/IN02 RUIZ AMERICA'S HISTORY A JOURNEY","NoChannel"
"HOUSE/IN02 WALORSKI&NRCC AFTER FIVE YEARS","3hPPAWaN4rA"
"HOUSE/IN02 WALORSKI AMERICA'S DEBT","aoUvGW-IUH8"
"HOUSE/IN02 WALORSKI BREAST CANCER","o3bouxK8LlU"
"HOUSE/IN02 WALORSKI COMMITMENT","XstHTSt0d8A"
"HOUSE/IN02 WALORSKI DC INSIDER","q6nuiTElf04"
"HOUSE/IN02 WALORSKI FALSE ATTACKS","buRNAu7flVQ"
"HOUSE/IN02 WALORSKI HOOSIERS WEIGH IN","uPqSYa2QHLQ"
"HOUSE/IN02 WALORSKI MEDICAL DEVICES","DehY-fsyQDs"
"HOUSE/IN02 WALORSKI ON OUR SIDE","Bte-2itzfyk"
"HOUSE/IN02 WALORSKI ONE OF US","-mXLGUvh-u4"
"HOUSE/IN02 WALORSKI THE DIFFERENCE","45raGSWyez8"
"HOUSE/IN03 STUTZMAN THE OTHER DAY","NoChannel"
"HOUSE/IN03 STUTZMAN YOU JUST FIXED IT","NoChannel"
"HOUSE/IN05 BROOKS SHE GETS TO WORK","NoChannel"
"HOUSE/IN07 CARSON TRYING HARDER THAN EVER","NoChannel"
"HOUSE/IN08 BUCSHON COORKS MY GUY REV","NoMatch"
"HOUSE/IN08 BUCSHON CROOKS MY GUY","NoMatch"
"HOUSE/IN08 BUCSHON DEFIBRILLATOR","3X8moK3Q1HE"
"HOUSE/IN08 BUCSHON OATH","aSyJhccZnPw"
"HOUSE/IN08 BUCSHON SACRED","FQQ_AU146VA"
"HOUSE/IN08 CROOKS&DCCC ROMNEY AND OBAMA","OBBsIUiI3HM"
"HOUSE/IN08 CROOKS CHINA","m3YyKME0HlI"
"HOUSE/IN08 CROOKS DIFFERENCE ON JOBS","KGJYn5GBR-o"
"HOUSE/IN08 CROOKS HOOSIER STORY","2hCgdJnyKZ8"
"HOUSE/IN08 CROOKS HOW MANY YEARS","-uHww3NyRDA"
"HOUSE/IN08 CROOKS PAKISTAN DISGUSTING","KPKuBn9Abqo"
"HOUSE/IN09 YODER FOR GENERATIONS","tBR7m4syIMI"
"HOUSE/IN09 YODER YOUNG COMPROMISE DIRTY WORD","d2sVO21bNVU"
"HOUSE/IN09 YOUNG CALL IT OBAMACARE","kE9kaOhaJJ0"
"HOUSE/IN09 YOUNG DAVID DECKARD","NoMatch"
"HOUSE/IN09 YOUNG THIS PLANT HELPED","96GizktJJGc"
"HOUSE/IN09 YOUNG YOU DON'T JUST HAVE A CONGRESSMAN","Each3d8gbVY"
"HOUSE/KS02 JENKINS AMERICAN FACES BIG CHALLENGES","NoChannel"
"HOUSE/KY02 BEACHAM OBAMA DECEIVED US","NoChannel"
"HOUSE/KY02 BEACHAM VOTE FOR A MURDERER","NoChannel"
"HOUSE/KY02 BEACHAM WAR ON WOMEN","NoChannel"
"HOUSE/KY03 YARMUTH A SHINING EXCEPTION","NoChannel"
"HOUSE/KY04 LEWIS INNOCENT BLOOD","NoChannel"
"HOUSE/KY04 LEWIS MUSLIM NIGHTMARE","NoChannel"
"HOUSE/KY06 BARR&NRCC ECONOMY STRUGGLING","bB0QrShwGKM"
"HOUSE/KY06 BARR BETTER FUTURE","jmiihCCTPuE"
"HOUSE/KY06 BARR CAROL BARR BIRTH","NoMatch"
"HOUSE/KY06 BARR CHANDLER DESPERATE LIE","NoMatch"
"HOUSE/KY06 BARR CHANDLER LIES TO KEEP HIS JOB","sJjJkjLryZw"
"HOUSE/KY06 BARR CHANDLER SURE CAN PICK 'EM","NoMatch"
"HOUSE/KY06 BARR COAL MINERS SPEAK OUT","qi53_ma6Hd0"
"HOUSE/KY06 BARR DEVASTATING","LjYk6R4SHt0"
"HOUSE/KY06 BARR HALLOWEEN","PsZrDy6hWeA"
"HOUSE/KY06 BARR I'VE SAID FOR WEEKS NOW 60","_9N5UjN3n34"
"HOUSE/KY06 BARR MADE A MISTAKE IT WAS DUMB","s3eKepOKCFs"
"HOUSE/KY06 BARR SAVES IT","esCXucIlU-8"
"HOUSE/KY06 BARR SMALL BUSINESSES","2KMbRsHt5Vg"
"HOUSE/KY06 BARR THE TRUTH","NoMatch"
"HOUSE/KY06 CHANDLER&DCCC BARR NO SHAME","DhvmrKOd1nA"
"HOUSE/KY06 CHANDLER BARR GOT CAUGHT","NoMatch"
"HOUSE/KY06 CHANDLER BARR WHAT'S REALLY DUMB","TMstSkLZZcY"
"HOUSE/KY06 CHANDLER BELIEF","RaA3R1Zr4fM"
"HOUSE/KY06 CHANDLER BICKERING KIDS","Hu2Xyv-hfBY"
"HOUSE/KY06 CHANDLER BIG LIE","Nbv2lfWrnWc"
"HOUSE/KY06 CHANDLER BOB ORBACH","9zEWzAF0B98"
"HOUSE/KY06 CHANDLER GINGER SANDERS","bMWAh-enazU"
