creative,uid,f_picture,f_dist,o_picture,o_dist
USSEN/MA BROWN RAY FLYNN ENDORSEMENT,ysTh7eQlCTw,1,0.434055068366079,0,0.6871050083945822
USSEN/MA BROWN SPRINGFIELD TORNADOES,Q_GX1NtbD_k,0,0.5767584153679771,0,0.6212812060087533
USSEN/MA BROWN SUPPORTS WOMEN,5kUdnLx5n5Y,1,0.4140085294445635,0,0.6778803147952042
USSEN/MA BROWN THE CHOICE,w9CETXKuPoU,1,0.4073711793561267,1,0.41014683953522013
USSEN/MA BROWN THOMAS HUDNER,Si38w4LZscs,1,0.41789343115834865,0,0.6989141124945562
USSEN/MA BROWN TOUGH ON THE MIDDLE CLASS,07Pid6Am69I,1,0.44444942721879077,0,0.5987303901959399
USSEN/MA BROWN VOTE THE PERSON,waEOB6v76A8,1,0.42470335227002187,0,0.5212883794371342
USSEN/MA BROWN VOTE THE PERSON 60,otMMS-lrg2A,1,0.35480003238492963,0,0.5690516151539446
USSEN/MA MARKEY HARD TO BELIEVE,HpXae-GKzf4,1,0.3992512294748147,0,0.600687350778445
USSEN/MA MARKEY TOGETHER,i9zJf56gTCw,1,0.3376072233000226,0,0.6712410926996709
USSEN/MA WARREN ATTACKING MY FAMILY,4oIVinDXzOw,1,0.2830465952923163,0,0.8128476972592577
USSEN/MA WARREN CLEAR CHOICE,hcAql-GCCwI,1,0.45112712556639806,0,0.5139611821206934
USSEN/MA WARREN CORPORATE INTERESTS,U4PLPC75bco,1,0.4422673672154318,0,0.6097428322052647
USSEN/MA WARREN JUST ONE VOTE,L5kwaViRFWU,1,0.37622195065795144,1,0.44600723519333424
USSEN/MA WARREN MENINO ENDORSEMENT,ljXva87fDqc,1,0.3866605454059491,0,0.6082082864205084
USSEN/MA WARREN MESOTHELIOMA VICTIMS,eUDWjSNyTLI,1,0.4032948157025395,0,0.7074007001320431
USSEN/MA WARREN MESOTHELIOMA VICTIMS 2,mn9G7ZS_2Uo,1,0.4127090803086475,0,0.6364014147709137
USSEN/MA WARREN MY FIGHT IS FOR YOU,EOgpW0CxKJo,1,0.3448390857261361,0,0.5860988623656332
USSEN/MA WARREN NOT A BAD GUY 60,l7EIBzZ6sxo,1,0.2979213859508748,0,0.7683882237726063
USSEN/MA WARREN REAL FIGHTER,W8Lp66KISa4,1,0.41626369764483456,0,0.5889944143675144
USSEN/MA WARREN SAME OLD BATTLES,gDPcAbqCdR8,1,0.35305064114671797,0,0.8282858969061806
USSEN/MA WARREN STANDS UP FOR PEOPLE,OWoy9wceXl4,1,0.376348268045392,0,0.6294410839695291
USSEN/MA WARREN STUDENT LOAD DEBT,1sLZD0Ne6_8,1,0.29033847540045404,0,0.5948281014689565
USSEN/MA WARREN THE PEOPLE'S SIDE,OIm351vhQmU,1,0.4146134200866343,0,0.5775353071996208
USSEN/MA WARREN WOMEN'S ISSUES,GNpDs2o_J8c,0,0.620328630886819,0,0.6510292100696009
USSEN/MD CARDIN HEAVY LIFTING,TE8sPAyegFo,1,0.4401294675520335,0,0.6509622940361084
USSEN/MD CARDIN LUCKY,Uw0Tef_HgsM,1,0.43970903106429743,0,0.6280185164748405
USSEN/ME BELLOWS CONVERSATION,AF8N1iEq7Rk,0,0.5852656806796199,0,0.6030977136207668
USSEN/ME BELLOWS FRANK,EbyPhDkVQfs,0,0.5893517127327144,0,0.6794562878051165
USSEN/ME BELLOWS I WOULD,G3uTHvjvJys,1,0.3714082270694798,0,0.7990760967047861
USSEN/ME BELLOWS LILLIAN,vXofTZzDQZE,1,0.4370098340890974,0,0.6591711441781802
USSEN/ME BELLOWS MAINE ROOTS,2OWWMMYVT3A,1,0.35200007175972314,0,0.6255766523326323
USSEN/ME BELLOWS MAKING IT,U_M2W80wfac,1,0.4260409758589879,0,0.6874019610521074
USSEN/ME BELLOWS STAND WITH YOU,-et__psVgNk,1,0.4135733389690223,0,0.6591743686037913
USSEN/ME BELLOWS STEPHEN KING,kej8f6wa9Xk,1,0.2846011252284507,1,0.4090376940748687
USSEN/ME BELLOWS WALK,uQhFggwJtDg,1,0.3999390614930551,0,0.7094892014925398
USSEN/ME COLLINS ADVOCATE,4dt1mH7o640,1,0.3563491075332925,0,0.5941657818833145
USSEN/ME COLLINS ALWAYS THERE,P6wQUV0U5vo,1,0.36798930561520765,0,0.5994832731947103
USSEN/ME COLLINS BATH IRON WORKS 60,HdfVBkuNEwc,1,0.36430764314421354,0,0.6333400194689082
USSEN/ME COLLINS EDUCATION AND TRAINING,UUiuSDJMbSs,1,0.4023102073583539,0,0.6349199989611952
USSEN/ME COLLINS FEED 60,vVn-4AvjAao,1,0.37550567159482634,0,0.5873129793463632
USSEN/ME COLLINS LEAD THE WAY,3mnRFVY2wmU,1,0.09181624625582903,0,0.6102687150921223
USSEN/ME COLLINS OUR SENATOR,xRm2fkgtMo4,1,0.3213807524239341,0,0.5633607177972964
USSEN/ME COLLINS OUR SENATOR BANGOR,H_jorY4_Bus,1,0.47553029506345235,0,0.6358445572514198
USSEN/ME COLLINS OUR SENATOR PORTLAND,yys4NKRb-o0,1,0.39887488946146354,0,0.6593726250358024
USSEN/ME COLLINS REMEMBER,Da9DWdFDqBM,1,0.3471533587444508,0,0.5517412481184173
USSEN/ME COLLINS SAVED,n2mGe2dx9zk,1,0.33531455883874123,0,0.6220642094745722
USSEN/ME COLLINS THE JOURNEY,VTEvyoz2_-Y,1,0.3933903784200163,0,0.6782218061260163
USSEN/ME KING GODZILLA,pTyD7k8ZS7o,1,0.33308672395784716,0,0.6033701935045906
USSEN/ME KING KNOW THE TRUTH,UMYIXQglB3I,1,0.34038538964032244,0,0.5305077021663556
USSEN/ME KING NEW INDEPENDENT DIRECTION,FuJ6kz_OvpU,1,0.3105643404722396,0,0.5908344442057288
USSEN/ME KING STAKES ARE HUGE,iJcGyS7sJDk,1,0.2856948925941757,0,0.6045306013659628
USSEN/ME KING THERE THEY GO AGAIN,fZgmydmDduk,1,0.32668078188818167,0,0.6208661204865578
USSEN/ME KING THINKS INDEPENDENTLY,-mSr7xr30-k,1,0.48249763601803647,0,0.5178559820779965
USSEN/ME KING UNIQUE LIFE,c-JCOuhNpBc,1,0.371054687530868,1,0.48486790433671123
USSEN/ME NRSC&SUMMERS LIVED IT,wLnHnYUdtdk,1,0.4025466779476572,0,0.5473002558556248
USSEN/ME NRSC&SUMMERS WORST THING WE COULD DO,e4qqNaZKP3E,1,0.37182570090359973,1,0.3561668289689547
USSEN/ME SUMMERS BUDGET SHORTFALL,lahBNPT4IPM,1,0.4414715548237013,1,0.4522552449297473
USSEN/ME SUMMERS MEET CHARLIE,CJm-Q4EfMbI,1,0.4907199614177393,0,0.5384218984870617
USSEN/ME SUMMERS SOCIAL SECURITY AND MEDICARE,6UkPs1n66qM,1,0.433509162953983,0,0.5845552998926778
USSEN/MI LAND BAD LOANS,F3WOFHcre20,1,0.34347268580744,1,0.4064039879094271
USSEN/MI LAND BORDER CRISIS,SXPi-RbYj5g,1,0.33735810019734785,1,0.3408672282214546
USSEN/MI LAND CRISIS AT THE BORDER,5lp5KRd36bU,1,0.3608757265962305,1,0.3552185817726819
USSEN/MI LAND I PLEDGE,rkqKqcQE3nc,1,0.3925541587393305,0,0.6089964995064938
USSEN/MI LAND MICHIGAN FIRST,-FfQpL-S0hI,1,0.3643366731670081,0,0.5963249120759806
USSEN/MI LAND MICHIGAN FIRST PLAN,WSKcJrcZ6HQ,1,0.3352365488674335,0,0.7394121308424143
USSEN/MI LAND MOMS GET THINGS DONE,vm2rAUaubxw,1,0.3400463733303082,0,0.6923500520655868
USSEN/MI LAND PROFITING FROM POLLUTION,q4bMJa8b0gk,1,0.34832673093834177,1,0.309635835180631
USSEN/MI LAND REALLY,dc_AAje-4l0,1,0.3802782439440672,0,0.7107009754559762
USSEN/MI LAND ROADBLOCK,E4qfpe81114,1,0.38948440855944466,1,0.450388867031918
USSEN/MI LAND STOP FIGHTING START LISTENING,iWbfqEUf0Qo,1,0.3264332795386101,0,0.6751789821098189
USSEN/MI LAND SUCCESS STORY,E2hpSswMoqc,1,0.37107508718562393,1,0.49843499489119764
USSEN/MI LAND WAR ON MICHIGAN,sgREGcJ-OTc,1,0.36888960896934414,0,0.5577337276861706
USSEN/MI LAND&NRSC SIPHONED OFF,dXvWkdyx8ro,1,0.31938320464701114,1,0.5073057901702112
USSEN/MI PETERS FRUGAL,Njz0Dqc0EbU,1,0.2849804023432974,0,0.6247476574305616
USSEN/MI PETERS SON OF A WORLD WAR II VETERAN,EMBQQBUoY-0,1,0.3123393010743877,0,0.6239197239405703
USSEN/MI PETERS&DSCC HEROIC 60,YwVKxoybOUk,1,0.2881760553616918,0,0.6070000556242653
USSEN/MI STABENOW COUNTERFEIT CHINESE PRODUCTS,dcNDu2bBsHU,1,0.3904799310419872,0,0.5770422488053969
USSEN/MI STABENOW CUT MEDICARE,LxA4wd2b1Do,1,0.3259639281763135,1,0.33033829747769344
USSEN/MI STABENOW DISHONEST AND RIDICULOUS,BgPs8bPW9KI,1,0.3802850043441161,1,0.3508293816818467
USSEN/MI STABENOW FARM BILL,Or3WQRW4Kq4,1,0.40470039006691755,0,0.5770807519571495
USSEN/MI STABENOW FARMERS,9vTp_G9lJLI,1,0.41445400196405263,0,0.6125557926020544
USSEN/MI STABENOW NEWSPAPER ENDORSEMENTS,SIHByr5aS3Q,1,0.37109489924706474,0,0.5696969464667296
USSEN/MI STABENOW ROGERS FOAM,x4cXoodCFvY,1,0.35249412057386764,0,0.6077498127481977
USSEN/MN FRANKEN ALL TOGETHER,uTYtmPYUKdA,1,0.33986992904451413,0,0.6272845684881392
USSEN/MN FRANKEN BERMUDA,Zg3rbEbrRqc,0,0.5238671806807941,1,0.11494119894500457
USSEN/MN FRANKEN COMMON DECENCY,afXNiDsMTwo,1,0.46891540823956956,0,0.7055021559194264
USSEN/MN FRANKEN FOOD SAFETY 60,6R8l9WaHd4o,0,0.5464851981837219,0,0.6070101003382615
USSEN/MN FRANKEN GRIDLOCK,CAk3W7VhU74,1,0.41183684307496693,0,0.6086022576745476
USSEN/MN FRANKEN HEAD DOWN,oSyzwg_v7u4,1,0.3360821071336379,0,0.6235373075825381
USSEN/MN FRANKEN HOLLY 60,LzGRSFy09HI,1,0.2862699656062858,0,0.6376481558195519
USSEN/MN FRANKEN JOBS,b0ZfQ3QQY0A,1,0.4000726848278978,0,0.6794716917841704
USSEN/MN FRANKEN LUCKY,J4S0ZarnyMI,1,0.47156233914562046,1,0.12361230238847126
USSEN/MN FRANKEN MENTAL ILLNESS,49FCZlXk9_o,1,0.3598421928973955,0,0.696874887826753
USSEN/MN FRANKEN POSTCARDS,QsHqB4CPu40,1,0.4393110341235346,1,0.11312826814002805
USSEN/MN FRANKEN RIGGED,Mzh9KTh2KrU,1,0.3832643431086106,0,0.6744250592280463
USSEN/MN FRANKEN SERIOUS,xuJm0BnbcSQ,1,0.42033442711723995,1,0.4193742514061736
USSEN/MN FRANKEN SIGNED INTO LAW,hgwHVTv6rvY,1,0.3554739526231616,0,0.6401086855483055
USSEN/MN FRANKEN SPECIAL BREAKS,3BbAiy_QVf8,1,0.33165936393316603,0,0.7414430681967032
USSEN/MN FRANKEN THE MILL 60,X4N0nF4mSbk,1,0.49957651903316236,1,0.5035855081747475
USSEN/MN KLOBUCHAR BETSY SATHERS,G65k72N9Z4I,1,0.3782736206748743,0,0.6427349840125637
USSEN/MN KLOBUCHAR CHAMPION,FHdhSYf_IwM,0,0.5848807553681847,0,0.6112212787559741
USSEN/MN KLOBUCHAR GET THE ECONOMY MOVING,2b63Mqi99uk,1,0.3766226348119955,0,0.6402706068427922
USSEN/MN KLOBUCHAR MY MOM,wpUY6gwDHMM,1,0.44126242449494535,0,0.5749441927423004
USSEN/MN KLOBUCHAR PAUL WALSER,NELmhoBwO-4,1,0.398066179935948,0,0.5377514720622955
USSEN/MN KLOBUCHAR VETERANS BENEFITS,L66I6mQXkRQ,1,0.3935203546085099,0,0.6086890473433517
USSEN/MN MCFADDEN 97 PERCENT,uO9jwADqGpg,1,0.43458850915979524,1,0.4245688146787996
USSEN/MN MCFADDEN CLUE,4AtS0rtrlzk,1,0.4004726123654245,1,0.46197703671488527
USSEN/MN MCFADDEN DEBATE PART ONE,4kE4Z36nL7M,1,0.4399017589327756,0,0.7091731639428915
USSEN/MN MCFADDEN DEBATE PART TWO,JZNZMyycYo0,1,0.4731094521273718,0,0.6269184714326602
USSEN/MN MCFADDEN HIDING 15,ANqhltykvXQ,1,0.4995281311796649,1,0.45533927133956253
USSEN/MN MCFADDEN IT'S TIME,2FvbJjYuMX4,0,0.5754119138111288,0,0.6204857543848132
USSEN/MN MCFADDEN MISSED THE MARK,6vD8oDRy5dc,1,0.38647717731618314,0,0.7213583877426352
USSEN/MN MCFADDEN MOLLY,m00WdJOfeao,1,0.3534792753961819,0,0.5646920037018259
USSEN/MO AKIN 6 YEAR RECORD,7KEyweLBzrs,1,0.38582881457798013,0,0.8543574877493931
USSEN/MO AKIN BROKE OUR TRUST,WxAFTbwqVW8,1,0.3851228441242499,1,0.4345320456203662
USSEN/MO AKIN CORRUPT CLAIRE,lWi178102lo,1,0.39865968147914266,1,0.48348696988827067
USSEN/MO AKIN GETTING RICH OFF US,NYG8pXyT1n8,1,0.39572104603426245,1,0.44588637336641895
USSEN/MO AKIN HUCKABEE ENDORSEMENT 3,oqTepM3We_U,1,0.38834513992693775,0,0.5911766367198927
USSEN/MO AKIN I APOLOGIZE,R57E3S8RO7A,1,0.41088389543336545,0,0.8009987589083818
USSEN/MO AKIN MISLEADING DECEPTIVE FALSE,OPtwl08gCME,1,0.4472143570445739,1,0.44329961929874645
USSEN/MO AKIN SELLING US OUT,ESAZbG4V8Co,1,0.39614531816761633,0,0.8232284915528123
USSEN/MO AKIN STRONGER FAMILIES,9LD24QJaDuU,1,0.39995463559395733,0,0.6036656373926504
USSEN/MO MCCASKILL CHINESE TRADE VIOLATIONS,XlpIuI0vDbA,1,0.38943655888437023,0,0.5953968687016792
USSEN/MO MCCASKILL COMMON SENSE WAY,MrhfG0BT2KU,1,0.31343000054763676,0,0.5525857992707627
USSEN/MO MCCASKILL EMERGENCY CONTRACEPTION,PcpvqEtn-qU,1,0.3883151873377641,1,0.43135058458777853
USSEN/MO MCCASKILL EMERGENCY CONTRACEPTION 2,ySuGj2vA8_E,1,0.38879028138453536,0,0.7641704105575129
USSEN/MO MCCASKILL EMERGENCY CONTRACEPTION 3,sxLuYfylgN4,1,0.38067418053048147,0,0.766294059100594
USSEN/MO MCCASKILL FAMILY AND MO FIRST,Q63ih_EuTic,1,0.3714571055971251,0,0.5922711975359016
USSEN/MO MCCASKILL NOT FROM AROUND HERE,1AM4OjHVuKo,1,0.37479375232200735,0,0.6172898024806832
USSEN/MO MCCASKILL NUMBER 50,jrqAIuC4Yr0,1,0.3763140874555953,1,0.5053162836512765
USSEN/MO MCCASKILL SCARY,Ag0iHDkXNrg,0,0.5602548042236363,1,0.48590492414124925
USSEN/MO MCCASKILL SHARED VALUES,1Ml6kP3TIzg,1,0.3271515436425805,0,0.5819355047773023
USSEN/MO MCCASKILL SHARED VALUES REV,PIH_Xzvm24k,0,0.5353901215640915,0,0.6561271999479342
USSEN/MO MCCASKILL SOCIAL SECURITY AND MEDICARE,b5uiezh0dqE,0,0.5897372750865952,0,0.5606767373279868
USSEN/MO MCCASKILL STUDENT LOANS,a1BTJ11-o2k,1,0.41078279215674385,1,0.39294601949172203
USSEN/MO MCCASKILL TIMELINE,uT3wcMsb8GA,0,0.6781540089643683,1,0.44014470071735795
USSEN/MO MCCASKILL TRUE COLORS,VmaEDYPLS2s,1,0.3913957583441192,0,0.7635523287345537
USSEN/MO MCCASKILL VETERANS AFFAIRS,pJ5mY7Y0nbI,1,0.3862712671150833,0,0.6063346549395079
USSEN/MS COCHRAN SO MUCH AT STAKE,Z_YZgDg3J88,1,0.3076137650987696,0,0.547311660323948
USSEN/MS COCHRAN WORKING,VHXjbgkbJGs,1,0.33094349300536285,0,0.618342953801872
USSEN/MT CURTIS ONE OF US,yy4jOjfxSDg,1,0.3654391743817458,0,0.6428870883596185
USSEN/MT CURTIS WE HAVE TO FIGHT,9kEunDRv1KI,1,0.34280840372975147,0,0.6735747786096995
USSEN/MT DAINES BALANCED BUDGET,WNgAr7lxCXA,1,0.271681688503617,0,0.6725894371928075
USSEN/MT DAINES CHARACTER,FwTHMcUpGU4,1,0.41675446649873715,0,0.592670818373731
USSEN/MT DAINES CINDY REV,vp-4LNN_fsU,1,0.2563448971927007,0,0.6026402321988799
USSEN/MT DAINES ED REGAN,RMd8Lr3cmlM,0,0.5867071946208913,0,0.6756021003131668
USSEN/MT DAINES INJUSTICE,J-n2gIM3KNM,1,0.350630552503801,0,0.6686360862360594
USSEN/MT DAINES MONTANA JOBS,oMFjPLSdt9c,0,0.6067342988597655,0,0.5935373253019801
USSEN/MT DAINES MOTIVATION,enDMt5fzAaw,1,0.27303441717880034,0,0.5742006224178748
USSEN/MT DAINES PUBLIC LAND,xJ7eZwbXhvI,1,0.4504667562431952,0,0.6344609717423275
USSEN/MT DAINES SOLEMN,u0ZUX4DdHQg,1,0.3373054703201719,0,0.6780924157873436
USSEN/MT NRSC&REHBERG ENGINES OF ECONOMIC GROWTH,9uAUFSEs6YI,1,0.46994602169764177,0,0.6344077959765957
USSEN/MT REHBERG BALONEY 3,14J2g_lgmQo,1,0.3515767977837745,1,0.3368151400151777
USSEN/MT REHBERG BALONEY 4,aJXnistC8rk,1,0.3470294789142557,0,0.7260135154046482
USSEN/MT REHBERG COAL REGULATIONS,tAjFNueAS7k,1,0.34700158160692607,0,0.6532726715600492
USSEN/MT REHBERG GIVE IT THEIR ALL,vSnhMy4cMD4,1,0.3781073895611389,0,0.6418597783088874
USSEN/MT REHBERG JUST DOESN'T GET IT,2DRmzn6mnTM,1,0.42714923044092584,0,0.668691816974923
USSEN/MT REHBERG LINDA & MARSHA FREY,y5L7-nAVWYQ,1,0.3575016854755691,0,0.6933033223263726
USSEN/MT REHBERG NIGHT AND DAY,eG2HgLugl00,1,0.3083609113979948,0,0.857416562844333
USSEN/MT REHBERG NOT TRUE,Qa3Vkx7mXzY,1,0.47697853671970486,0,0.5301660432523111
USSEN/MT REHBERG ROMNEY ENDORSEMENT,oVSv6lD227Y,1,0.34328140972062815,0,0.7826306777883202
USSEN/MT REHBERG TALK IS CHEAP,WDC11geqCZA,1,0.5045961884300977,0,0.6206637141268214
USSEN/MT REHBERG TRADED OUR VALUES,CErRmd6VqRI,1,0.34674018612735547,0,0.5609439227007958
USSEN/MT REHBERG VOTES WITH US,zbfgVu3POOw,1,0.3527343836789747,0,0.5836103224254245
USSEN/NC HAGAN ANNA,hlE-rGmI2uM,1,0.29833293255782733,1,0.36551205400311904
USSEN/NC HAGAN ATTACKING FAMILY,pDC9TiSzW54,1,0.30173008933563916,1,0.3625571735029775
USSEN/NC HAGAN EDUCATION MEANS OPPORTUNITY,UvwDMcHq7qM,1,0.33208516288870354,1,0.3089478783355235
USSEN/NC HAGAN FABRIC,Uu5WrnsXeUA,1,0.31198802374822293,0,0.6879010123558249
USSEN/NC HAGAN FOR JANEY,6kGZvwVlWlQ,1,0.31109900918330596,0,0.6657749577771632
USSEN/NC HAGAN LOW,SasFja3vFtQ,1,0.3047260042998496,1,0.35220928856495526
USSEN/NC HAGAN MAJOR NEWSPAPERS,813N-Y-rmJQ,1,0.3050981921606395,0,0.6374645779183282
USSEN/NC HAGAN NEVA,jrNF4VGfmvc,1,0.2998625680908949,1,0.2891262175701399
USSEN/NC HAGAN SAME TEAM,Y4OQZ1I6xVg,1,0.3000689526303908,0,0.5813267270064898
USSEN/NC HAGAN TELL THOM TILLIS ANNA,KPJel1qFStU,1,0.29736449474946647,1,0.34426306445468213
USSEN/NC HAGAN TELL THOM TILLIS JUSTIN,WA2e5sOcRyA,1,0.2980084416567765,1,0.2791115839114753
USSEN/NC HAGAN TELL THOM TILLIS MEGAN,Z7ZKmpZpr-E,1,0.29749574780527344,0,0.5320931072731967
USSEN/NC HAGAN TELL THOM TILLIS SHEREE,jXjyKU_V0TA,1,0.2972649475993445,1,0.29348986034818536
USSEN/NC HAGAN TOUGH ENOUGH,VIn9Jzn1rss,1,0.29994312447292243,0,0.6939977676398346
USSEN/NC HAGAN VAIN,dgT6s67Jsas,1,0.2884632035722136,0,0.6832360660955751
USSEN/NC HAGAN&DSCC IMPORTANT ISSUES,7pRwnjLAAf0,1,0.30338314381708714,1,0.40082560758939456
USSEN/NC HAGAN&DSCC RECORD,5IlKNIu4uTQ,1,0.30481578848451796,1,0.3304670528483514
USSEN/NC NRSC&TILLIS MATH,PHIuN0b0QzA,1,0.29404411853213513,0,0.5848387097480361
USSEN/NC TILLIS CHANGE DIRECTION,4L-FCU_TbCE,1,0.3683351696904316,1,0.3883748687325471
USSEN/NC TILLIS KAY HAGAN DID COCKTAILS,ER2fcFiCPy8,1,0.43749735518809224,1,0.4610000255229239
USSEN/NC TILLIS LONG CAMPAIGN,fkcUDPnYvFY,1,0.2820732032777167,0,0.7532422504699395
USSEN/NC TILLIS NANCY ANDERSON,nLTHt3NRJDg,0,0.5974785206913528,1,0.30282303433729296
USSEN/NC TILLIS PUSHED FOR STIMULUS,f2eM40W6PME,1,0.2761916263101449,1,0.4080325562185119
USSEN/NC TILLIS&NRSC KITCHEN,ZaJa4VFsAfQ,1,0.3193651907280279,0,0.5928713955737831
USSEN/ND HEITKAMP BATTING CAGE,gVr9cirHglk,0,0.5822204069468353,0,0.7168754101102391
USSEN/ND HEITKAMP COLLEGE AID,yJrO2_zN390,1,0.4129365435730054,0,0.6269204365123943
USSEN/ND HEITKAMP HEROES HEALTH CARD,QtGhZJYoZzU,1,0.3624153019810341,0,0.6265567242641377
USSEN/ND HEITKAMP OIL REFINERY,8HNoavveI8o,1,0.40589456845539784,0,0.8570976811394625
USSEN/ND HEITKAMP ONLY ANSWER TO YOU,6hZH5G1e26Y,1,0.437414384720913,0,0.8400692235502716
USSEN/ND HEITKAMP PAY OUR OWN WAY,z9ToeIhKgXc,1,0.4276231831222068,0,0.6840664226277607
USSEN/ND HEITKAMP STRENGTHEN MEDICARE,BV0S9VN7cT0,1,0.38020460438427583,0,0.6720455717626092
USSEN/ND HEITKAMP VOTE FOR THE PERSON,pk2BrRdDUdI,1,0.3780683427883801,0,0.8566708599588444
USSEN/NE DOMINA BUSINESS AS USUAL,i6M5jZGxwxs,1,0.35366871704433195,0,0.7007933774927759
USSEN/NE KERREY A CHOICE,pb7TUVyU5V0,1,0.3148546256965694,0,0.6403692071534138
USSEN/NE KERREY BORN AND BRED,wdXgLwudgeQ,1,0.3192157268392379,0,0.6484357037549261
USSEN/NE KERREY BOTH WRONG,tiBfCiam1qI,1,0.3052955199394279,0,0.5781583632247793
USSEN/NE KERREY CHUCK HAGEL ENDORSEMENT,-4S2roTsLkw,1,0.33235277542634845,0,0.6828674766961498
USSEN/NE KERREY KIMES RANCH 2,rTKFlcubJCo,1,0.4778978814747627,1,0.4526751584307539
USSEN/NE KERREY KIMES RANCH 60,it_Bfj0oKtQ,1,0.5039621032836236,1,0.43213840253191094
USSEN/NE KERREY NO SUBSTITUTE,3t2XbavAmSo,1,0.30217039283974506,0,0.6740191448821375
USSEN/NE KERREY RELENTLESS DETERMINATION,NDLbQDFbQrE,1,0.33609654696110725,0,0.6374744209763947
USSEN/NE KERREY WASHINGTON IS A MESS,PM2E78gtD9k,1,0.33920708589378284,0,0.6073611255719632
USSEN/NE SASSE BEN'S NEBRASKA 60,zx1g79Kd-iQ,0,0.5569815443985847,1,0.5081051287977894
USSEN/NE SASSE NINETY-THREE,ZLl0CxuWmxA,0,0.5265809285056219,1,0.5051967440969134
USSEN/NH BROWN BROKEN PROMISES,4lLRvkLxkwE,1,0.3860538638359803,1,0.33700104533402053
USSEN/NH BROWN ECONOMY NOT WORKING,QOIRIYlj7ns,1,0.44944215193199627,0,0.5681521729009771
USSEN/NH BROWN FOR NEW HAMPSHIRE,a0JuRRnzWfw,1,0.38696893976940344,1,0.3687807691986067
USSEN/NH BROWN INDEPENDENCE,cgwWljY4YcI,1,0.38422545166743205,0,0.793689900020915
USSEN/NH BROWN INDEPENDENT,VIfUcw65G1g,1,0.30787489900072595,1,0.3402152277437154
USSEN/NH BROWN KEEP AMERICA SAFE,sM6iFb2yJbI,1,0.37896688044449184,1,0.3389974735213709
USSEN/NH BROWN MAKING ENDS MEET 15,cXrf295CXg4,0,0.6069151366942013,1,0.36780277555744983
USSEN/NH BROWN MAKING ENDS MEET ENERGY TAX 15,Nu0Ou8i0qhY,0,0.5966939421503159,1,0.354040910721148
USSEN/NH BROWN PROTECTING AMERICA'S FREEDOM,jLEclXiQ_ks,1,0.41374279496207483,1,0.4390483274443727
USSEN/NH BROWN ROLL CALL 15,0e6Ot6qDkPs,1,0.3818639118403446,1,0.31036432053783675
USSEN/NH BROWN SECURE BORDERS,WQi4WBSc-hk,1,0.38858456139578684,0,0.8106194081553041
USSEN/NH BROWN SHAHEEN'S SMEAR,jvrDKLw9PyE,1,0.45227366569013255,0,0.8071788824484303
USSEN/NH BROWN&NRSC LEEANN,9gc_67f2w8U,0,0.569877370042304,0,0.6248838844241538
USSEN/NH BROWN&NRSC LEEANN 60,wNCfa3f03FU,1,0.45663196417734503,0,0.6425249414702711
USSEN/NH SHAHEEN BATTLING,7ONzIzXzQZs,1,0.354283276697803,0,0.5997092462281965
USSEN/NH SHAHEEN BREAKTHROUGH,pOMd9BHey-A,1,0.33339613559071657,0,0.6547897150566266
USSEN/NH SHAHEEN CARED,PwzZCdWhTXQ,1,0.4014641450715686,0,0.6261903075848521
USSEN/NH SHAHEEN CARED 60,rRcwLSUjcTw,1,0.4051577469605191,0,0.5929179409359281
USSEN/NH SHAHEEN FOR YOU,S-VrSszsTL0,1,0.3347197315172571,0,0.6325375994891667
USSEN/NH SHAHEEN FORCED,q8na2LUlymY,1,0.40610631136416575,1,0.3992373781936014
USSEN/NH SHAHEEN GRANITE STATE,jwDJRvoNrdo,1,0.360089362237279,0,0.6340637674223115
USSEN/NH SHAHEEN KIDS,Kn_MynC-Kso,1,0.3028260804634291,0,0.5883839665601746
USSEN/NH SHAHEEN MAKES A DIFFERENCE,je3b7C1bUQo,1,0.3597005601485724,0,0.6129982866456058
USSEN/NH SHAHEEN NATIONAL SECURITY,NBxOzgYpGA4,1,0.33478273201476827,1,0.48220813103870086
USSEN/NH SHAHEEN NOT HOW HE VOTES,JtI9pOHK5rI,1,0.35153765910974966,1,0.4632902927131591
USSEN/NH SHAHEEN OPEN,0m7ND7Ep53E,1,0.35911569871523563,0,0.6412917178234289
USSEN/NH SHAHEEN PROFITABLE,1mroNmJWvr8,1,0.3324930739930613,1,0.4457832823673042
USSEN/NH SHAHEEN PROOF,hnYnnnsNEC0,1,0.4406994198556347,0,0.5921225487747331
USSEN/NH SHAHEEN REALLY FOR NH,M2FUYeOWDYY,1,0.35292586676046833,1,0.4089492167899721
USSEN/NH SHAHEEN SELLING OUT,Wzfmij9zGH4,1,0.33437511642001616,1,0.378441022875188
USSEN/NH SHAHEEN STEEL,rWSLytnNi6c,1,0.3864496248107746,0,0.6161169028757756
USSEN/NH SHAHEEN STUDENT DEBT,z91iKJhsDKc,1,0.31889856379733955,0,0.65503254363734
USSEN/NH SHAHEEN&NHDP THERE'S A CLEAR CHOICE,UTK0-RC-B6U,1,0.43993919293351924,0,0.6123061294900434
USSEN/NJ MENENDEZ ALL ABOUT FAMILY,5NpDhOINxuo,1,0.27801445730823005,0,0.6091308295312857
USSEN/NJ MENENDEZ EDUCATION SPENDING,ODk2fE8TTeU,1,0.3874653444111855,0,0.6645208726095034
USSEN/NJ MENENDEZ MIDDLE CLASS UNDER ATTACK,OfjfJSjkWIY,1,0.3492499399881855,0,0.6127559296142732
USSEN/NJ MENENDEZ REBUILD THE MIDDLE CLASS,G29LU2TN0SU,1,0.3997313037060389,0,0.6150120236762462
USSEN/NJ MENENDEZ THIS IS WHO I AM,BM9WeKIPhZo,1,0.37266095024942364,0,0.6004031771919567
USSEN/NM HEINRICH 14 YEARS AGO,tH2uY5dhrd4,1,0.41775383506351377,1,0.37381518197239433
USSEN/NM HEINRICH A LONG TIME,U6FBcByIc5o,1,0.48533775912520843,1,0.416198431051634
USSEN/NM HEINRICH DIRECTION,5d5d4YsBTM4,1,0.42999425382219536,0,0.5415382816964163
USSEN/NM HEINRICH HERE THEY COME,ujtQKUURbrI,1,0.43545249154764076,1,0.4084355297787739
USSEN/NM HEINRICH KNOWS WHAT'S IMPORTANT,hIWa6NgStso,1,0.37726575697697357,0,0.6521608211027706
USSEN/NM HEINRICH LIVING WITH DIGNITY,mcLPWrOCVrM,1,0.37952122270104915,0,0.5556156100398221
USSEN/NM HEINRICH MILITARY FAMILIES,O9-3M1Lwzfs,1,0.42351505807702805,0,0.6890297681193682
USSEN/NM HEINRICH PRIORITIES,fka_UisLg0I,1,0.37102883407310694,0,0.625223218637551
USSEN/NM HEINRICH STRUGGLING TO GET BY,8NIJ1LRCvsU,1,0.37687938211802996,0,0.6246470855481772
USSEN/NM HEINRICH TO DO LIST,Yjd-0191xs4,1,0.4238643717089577,0,0.5437415880084373
USSEN/NM HEINRICH TOP 5 WAYS,x4JCQjMS2s8,1,0.33380499063509744,0,0.6515851089361147
USSEN/NM HEINRICH VALUES & PRIORITIES,8o0oDEMmI9Q,1,0.4610924952053949,0,0.5670729222105184
USSEN/NM NMDP&HEINRICH LEVEL PLAYING FIELD,RL2_jeNkVLQ,0,0.6243250629134443,1,0.40176658399371784
USSEN/NM UDALL BEST PART,JG8C_9yLHvw,1,0.4374563958502646,0,0.611329066873591
USSEN/NM UDALL DOESN'T FLY,jCdN-QrxVdw,1,0.5019995076734799,0,0.6130421969029715
USSEN/NM UDALL GOOD MAN,uMI7CFKhr2I,0,0.5452288074924098,0,0.6188905063892375
USSEN/NM UDALL SCARY IDEA,_foJB3KQbZ8,0,0.6588570838575917,1,0.3948258227179741
USSEN/NM UDALL SO WHAT,ckbCql-yDI8,0,0.6409942319006579,1,0.4224372758662388
USSEN/NM UDALL VOIDED,VrixJTUCaEM,1,0.41831933354075823,1,0.40879471519066485
USSEN/NM UDALL WHAT KIND OF SENATOR,BD8kyolrc78,0,0.6578606386756493,1,0.4514477184191739
USSEN/NM WEH BECKY'S STORY,dk34KntxfWM,1,0.3776548601099258,0,0.6210342382226975
USSEN/NM WEH NEGATIVE ATTACKS 15,LUjcvsXrWCI,1,0.3389876933568418,0,0.6674964791784117
USSEN/NM WEH RESTORING LEADERSHIP,ICrfQLVyeCo,1,0.38813315424063954,1,0.4193598369732024
USSEN/NM WEH SO WHAT,fxTCP1T7cjo,1,0.43823404779041897,0,0.6278871859085821
USSEN/NM WEH THEY'RE PAYING FOR IT,mbkQaRYEx-U,0,0.596772016197526,1,0.4589695668979989
USSEN/NM WEH UDALL FOR OBAMACARE,WqNoAbZuV9E,1,0.4464006929458689,1,0.3207461776313176
USSEN/NM WEH WASHINGTON IS BROKEN,5WBzikrjTwc,0,0.7939186869936857,0,0.8071521857050838
USSEN/NM WEH WHAT DOES THAT TELL YOU 15,xilEuODUiWc,1,0.41655379677445836,0,0.6579813106598057
USSEN/NM WEH WHO'S DOING BETTER,d0KV6S3_100,1,0.4930520124647623,1,0.35553927194979984
USSEN/NM WILSON AIR FORCE ACADEMY,VZos36SgHL8,1,0.3176072025344522,0,0.8620184734286921
USSEN/NM WILSON BARRIERS WERE MEANT TO BE BROKEN,EJ5bcNCOL-w,1,0.3201417134826071,0,0.7565056639643934
USSEN/NM WILSON DEFENSE CUTS,SGA6V1u-17k,1,0.3450840101358182,0,0.7643427813775678
USSEN/NM WILSON DEMOCRATS,BY6igjxj0Fc,1,0.44348973795255664,0,0.8065454654959566
USSEN/NM WILSON EXTREMIST LEFT WING POLITICS,p62fBLbRUeg,1,0.3703656527921853,1,0.44437533065008655
USSEN/NM WILSON HONOR CODE,dsi8BhRFflE,1,0.4454118706611936,0,0.6882587543613388
USSEN/NM WILSON HOW I SEE IT,WSHRuQlD0qQ,1,0.30895509765380474,0,0.8563225326027107
USSEN/NM WILSON KNOWINGLY,mcNOhUkbYG4,1,0.2918957602719144,1,0.4099949830375875
USSEN/NM WILSON MAKING THINGS WORSE,WhhwvVaAClo,1,0.29263689938559573,0,0.841218957013328
USSEN/NM WILSON OUR MOM,Vo14mTfFmhU,1,0.3474104826069096,0,0.7226592625986854
USSEN/NM WILSON SOCIAL SECURITY CARD,qj2eu9d0lZI,1,0.43273326301795023,0,0.7318028774424522
USSEN/NM WILSON STICK TO A BUDGET,WAo6OXtRXHM,1,0.35885992728617055,0,0.7410562236841778
USSEN/NM WILSON STILL WAITING,N_wQ4Qi2TSQ,1,0.46790976366168935,0,0.6481547603824077
USSEN/NM WILSON THE WASHINGTON DIRECTION,BdyYyMETGjA,1,0.41069844209430395,1,0.44128984004250665
USSEN/NM WILSON WALL STREET BONUSES,nHlgrCSedpE,1,0.3861186453886443,0,0.618096000207462
USSEN/NV BERKLEY NEVER BEEN FOR YOU,kOZ-AwWSc3Q,1,0.33727470252393227,1,0.2884255264277089
USSEN/NV BERKLEY REALLY NOT FOR YOU,eQfK8x6qR4A,1,0.46673202887191856,1,0.42648101104580627
USSEN/NV BERKLEY STRENGTHENED MEDICARE,PXToogaNIio,1,0.3052527091206653,1,0.29428114172193365
USSEN/NV BERKLEY TWISTED AND NOT TRUE,JO5i4LAnESw,1,0.35946839580543805,1,0.33678465105623534
USSEN/NV BERKLEY VETERAN MENTAL HEALTH 60,LwuftdKFIBQ,1,0.3135216397789366,0,0.7359647701179964
USSEN/NY GILLIBRAND 9-11 HEALTH BILL,Hs_zvj5H7Ns,1,0.3482949525429844,0,0.6255686751827662
USSEN/NY GILLIBRAND EXACT SAME RULES,3W3GiJatLg4,1,0.2902997268196016,0,0.6235502739919438
USSEN/NY GILLIBRAND MANUFACTURING PLANTS,4z_KA8VScos,1,0.2922564360442361,0,0.6587868013772241
USSEN/NY GILLIBRAND REBUILD OUR ECONOMY,U8iVTQRa3es,1,0.2929118836685803,0,0.6161589808252401
