creative,uid,f_picture,f_dist,o_picture,o_dist
USSEN/NY GILLIBRAND WOMEN'S ISSUES,WMp6bIu4oHY,1,0.3607822143428776,0,0.6172833684703478
USSEN/OH BROWN A REAL CHOICE,YCphesc_LLM,0,0.5690847038795365,1,0.3789120712690916
USSEN/OH BROWN BOTH FROM OHIO,uebRNfk5td4,1,0.41617331913944416,0,0.5863038803267703
USSEN/OH BROWN DISPATCH ENDORSEMENT,OwkSYQVgvZs,1,0.5048477585741026,0,0.6303215886431282
USSEN/OH BROWN ENQUIRER ENDORSEMENT,AmPcVYnCy30,0,0.5242364037717046,1,0.4152921704879917
USSEN/OH BROWN FAIR CHINA TRADE,1k9z7WwaJQY,1,0.40237449548569504,0,0.6417789567190741
USSEN/OH BROWN JOHN BETTS 60,RxZTZuVuVak,0,0.5437165349473313,0,0.618744273407205
USSEN/OH BROWN JOHN GLENN ENDORSEMENT,GBlJvSqgVHo,1,0.4831277054305186,0,0.6068512521049806
USSEN/OH MANDEL ABSENTEE SENATOR,M0SGsDB0Hfc,1,0.3848035660866318,1,0.4945693286588031
USSEN/OH MANDEL DEAD WRONG,goa5HYWQDBo,1,0.368995499571793,0,0.6683982032621044
USSEN/OH MANDEL FALSE DECEIVING DISHONEST,LJBp5dAEMck,1,0.31876652900346136,0,0.6434121580620724
USSEN/OH MANDEL NOT PAYING HIS TAXES,BrjhDx8Ooxk,1,0.3351687096250563,0,0.5841599499586441
USSEN/OH MANDEL THE REAL MANDEL,LV65bydhoCU,1,0.4236523051270859,0,0.581643206308752
USSEN/OH MANDEL TIME FOR A CHANGE,GNIfjJUZxFU,1,0.320437581094523,1,0.417371185408091
USSEN/OK INHOFE AIR,z0Xl1UFaUpg,1,0.44864970843038526,0,0.6741539876748802
USSEN/OK INHOFE DEEDS 60,N9P7qI5H56g,1,0.35740477148751754,0,0.5919135767860239
USSEN/OK INHOFE FLIGHT,jOSL-O8hM3o,1,0.339295741052957,0,0.6384872607657822
USSEN/OK INHOFE MARIE,H1Sauu2l45o,1,0.3311613001315636,0,0.7134749154032654
USSEN/OR MERKLEY FIGHTER,1rIiBOQB9SM,1,0.30578777135224644,0,0.6823742677164738
USSEN/OR MERKLEY FIRST,jWqveyTo0lA,1,0.3758551408240973,0,0.6666641514645161
USSEN/OR MERKLEY GARAGE,l_fb28L3x2Y,1,0.4316342008540011,0,0.6890967953832613
USSEN/OR MERKLEY HANDS,VP_7GF1mdXY,1,0.3918171490475245,0,0.677350043643061
USSEN/OR MERKLEY MILLIONS,CtK5mr63PaE,1,0.45018000273136344,1,0.3169639116281778
USSEN/OR MERKLEY ON OUR SIDE,zEafzuHDbNY,1,0.4045217836192615,1,0.4500388251856765
USSEN/OR MERKLEY VALUES,Algbk5SA9Qg,1,0.4140962951741852,0,0.7136292054383273
USSEN/OR MERKLEY WORD FOR WORD,YUtHaHYb8IQ,0,0.7530636107280555,1,0.41239920322627255
USSEN/OR WEHBY ACCOUNTABILITY,B50HvR0x3Bw,1,0.3935647568270653,0,0.6623498713455682
USSEN/OR WEHBY BEN WEST,qAQ6fH1CFwg,1,0.4334092267629758,0,0.5548406121699475
USSEN/OR WEHBY DO WHAT'S RIGHT,1AP93RFsVDI,1,0.41422466410277076,0,0.5237530858936666
USSEN/OR WEHBY RIDICULOUS,ElVUzplkx6s,1,0.4105005693291472,1,0.4634930584769901
USSEN/PA CASEY COMPLETELY FALSE,IcMb5M3-kSA,1,0.4380407522956894,0,0.6795354224708677
USSEN/PA CASEY CREDIT,vza-rXC3MuU,1,0.4248324430754675,0,0.6648702748754266
USSEN/PA CASEY DEFENSE CONTRACTORS 60,-HbCGg6dUmU,0,0.6285145356584143,0,0.6320350807578221
USSEN/PA CASEY MILITARY STEEL,Vt2ZffE05cc,1,0.35816746578323366,0,0.7135207626734394
USSEN/PA CASEY ONE-SIDED TRADE DEALS,xatqfrylyCY,1,0.3480494335943807,1,0.43557888067304723
USSEN/PA CASEY WHEN I WAS A KID,SliqJpKqldA,1,0.3353681084341781,0,0.6373218498764304
USSEN/PA NRSC&SMITH RECORD OF FAILURE,PJ5R7CRXEz8,1,0.3257001336839285,0,0.6702110520849232
USSEN/PA SMITH FAILED CAREER POLITICIAN,yP4uHMHe3_M,1,0.39520663745081547,1,0.349797959196407
USSEN/PA SMITH FED UP,s5hAzjyrBYY,1,0.43529021753713903,0,0.7444104872183547
USSEN/PA SMITH NOT TRUE,Lkq6he8oGRM,1,0.39860477945580897,1,0.28069808443022864
USSEN/PA SMITH PLAN,RN0Oy7wmFpI,1,0.4206506824173426,1,0.3279592791417744
USSEN/PA SMITH PROTECT SS AND MEDICARE,7jTednijVcs,1,0.40021997314510765,0,0.6527476882942638
USSEN/PA SMITH WAR ON COAL,gdmvY9bkxGc,0,0.5371133505439668,1,0.32758970647006497
USSEN/RI HINCKLEY HUNDREDS OF JOBS,vxS0DeazBW0,1,0.46293672625429927,1,0.3908769157887871
USSEN/RI HINCKLEY INSIDER TRADING,aX_EQYEyygE,0,0.6356270596624524,1,0.2861259643170295
USSEN/RI HINCKLEY MORE JOBS LESS POLITICS,GXnV13XyxRI,1,0.3869082107371734,1,0.35556846888652177
USSEN/RI REED RHODE ISLAND'S DEFENDER,wjcN0YmzeP0,1,0.3311394998889837,0,0.5724125394573568
USSEN/RI REED SERVICE 60,7ojkh2Rv7F0,1,0.3522323213791221,0,0.6277491105131787
USSEN/RI REED STUDENT LOANS,SzR_hG-POy8,1,0.3571965438774127,0,0.6559629907021622
USSEN/RI REED SUBS,Q-zkImVYLfo,1,0.35213225688589916,0,0.6395034731859153
USSEN/RI WHITEHOUSE MEDICARE CUTS,G5OhiTWKvJc,1,0.3366608330206175,0,0.5738892542604302
USSEN/RI WHITEHOUSE NEVER STOPPED 60,kKEpfBZxJjE,1,0.3563869505102941,0,0.5416420153644049
USSEN/RI WHITEHOUSE OUTSOURCING,qvLEMPos3o4,1,0.3867537994257624,0,0.5964486268762715
USSEN/RI WHITEHOUSE PELL GRANTS,nDidx9Xxayo,1,0.40080346444906984,0,0.5519994735027328
USSEN/RI WHITEHOUSE SACRED PROMISE REV,9bBDTS6FGTo,1,0.33854476123312177,0,0.6046066905643404
USSEN/RI WHITEHOUSE STORIES OF RI 60,TyEbCUGTnEw,1,0.3861322723458324,0,0.5990018566301187
USSEN/SC GRAHAM BEST EXPERIENCE OF MY LIFE,cVfZ0EbUpK8,1,0.3799337522947292,0,0.621948339416525
USSEN/SC GRAHAM PROVEN CONSERVATIVE LEADER,OF0HH_aA1AA,1,0.39207676916742085,0,0.5316457658996541
USSEN/SC HUTTO HEADLINES,PhQTgegprZk,1,0.41024751520625846,1,0.4537185967496083
USSEN/SC HUTTO LISTENING,W_QKJGphaQo,1,0.43333752072831816,0,0.5249300677698866
USSEN/SD ROUNDS HERE THEY GO AGAIN,NnEgnlEO-7w,1,0.286791145861245,0,0.6171140425323455
USSEN/SD ROUNDS HOMESTAKE LAB,JZYKGic1-Yo,1,0.4747820422250682,0,0.6214225495130662
USSEN/SD ROUNDS KEY ISSUES 60,kwhJ8wWrsCk,1,0.37930750710831584,0,0.573218790703652
USSEN/SD ROUNDS OUR VALUES AND KEYSTONE,rLyyfsb3-ik,1,0.36221886708083745,1,0.4382571622988743
USSEN/SD ROUNDS PROTECT SOUTH DAKOTA,mONmV9vwzNU,1,0.3952049192605235,1,0.48136431569744276
USSEN/SD ROUNDS SHAME ON RICK,dBYBIE_MK6E,1,0.4787620328748291,0,0.5547902277871946
USSEN/SD ROUNDS THAT'S ALL THEY'VE GOT 60,y8obbOQi0lM,1,0.4346184032092708,0,0.61095782946951
USSEN/SD ROUNDS THE TRUTH,a01Z5lImHpQ,1,0.47557870722508905,0,0.6287059948168352
USSEN/SD ROUNDS THUNE SUPPORTS ROUNDS,CCt1ugS-9l4,1,0.38724782443406575,0,0.6350271538896993
USSEN/SD ROUNDS TRUST,fxP92mc2xn0,1,0.4363633210101029,0,0.5799928608355834
USSEN/SD ROUNDS VETERANS,eL6AiJZclew,1,0.4426112885372609,0,0.592515772109544
USSEN/SD ROUNDS WORK ETHIC,bMpIikYOkrQ,1,0.2744230778086511,0,0.5626004184273291
USSEN/SD ROUNDS&NRSC WHO WE SEND,KYRJ3ehVi1Y,1,0.47005763634860553,0,0.5487773221174654
USSEN/SD WEILAND ABACUS 15,5_az6hO8FQk,1,0.4228667728156248,0,0.666441633377077
USSEN/SD WEILAND AUCTION,jIvQT3hFLD8,0,0.524809344863746,0,0.5960186833221088
USSEN/SD WEILAND DAVID VS GOLIATH 15,qOAF7akjieo,1,0.46553104135775136,0,0.6704698300548284
USSEN/SD WEILAND EVERYDAY PEOPLE,I_BHyGE1QrY,1,0.38475577109241593,0,0.5875569986356748
USSEN/SD WEILAND HARD WORK,6DFRIM-suXI,1,0.41800380307395424,0,0.6288491824910886
USSEN/SD WEILAND HEADLINES 15,TwDM0XIBgqA,1,0.3791246374999859,0,0.6471925122347436
USSEN/SD WEILAND INCREDIBLY FAST 15,zzqHGEeBTLY,1,0.428533180721169,0,0.6270845135605119
USSEN/SD WEILAND INCREDIBLY FAST 15 2,CRySuHUWvNU,1,0.412424388877349,0,0.636065138171636
USSEN/SD WEILAND MIDDLE CLASS,0TZZj_pq1b8,1,0.5129038728300621,0,0.5180275351371381
USSEN/SD WEILAND MY NAME IS,1ABR_fapWLU,1,0.46534835880020115,0,0.6016688129558325
USSEN/SD WEILAND REST OF US,pdvcE-WMrqw,1,0.40720281475332964,0,0.5875728765308362
USSEN/SD WEILAND SHOWING UP 15,oZHVS1qWCbM,1,0.43862020415564895,0,0.5669667810113449
USSEN/TN ALEXANDER I'VE SEEN WHAT CAN HAPPEN,plzj8XC3ges,1,0.3303900216290674,0,0.5587225248483945
USSEN/TN ALEXANDER SERIOUS TIMES,CCm2UN57RqQ,1,0.306233212817012,0,0.6930108592753607
USSEN/TN ALEXANDER SLICK TALK,fGUjeQ1x8v0,1,0.4795723684312335,1,0.40249304817440623
USSEN/TN ALEXANDER VOTE FOR A NEW SENATE MAJORITY,f4dZJGGyFh0,1,0.3261888987671099,0,0.7161823816022739
USSEN/TN BALL OUT OF TUNE,uVEVxZLoNkE,1,0.4449355447651267,1,0.491824855342913
USSEN/TX CRUZ LAND OF OPPORTUNITY,W9qUiCw4QNs,1,0.25805519709795194,0,0.5595718119217642
USSEN/TX CRUZ THE AMERICAN DREAM,e66tJxvInzE,1,0.3319259569273691,0,0.5467701352411123
USSEN/TX SADLER TEA PARTY SENATE SEAT,VBALvQ25xPE,1,0.2809235396192787,1,0.32511379582690186
USSEN/UT HATCH AT A CROSSROADS 60 REV,fs9noqfkXgo,1,0.3058944591270261,0,0.5755527097258359
USSEN/UT HATCH ROMNEY ENDORSEMENT 60 3,B-rDqJ57itg,1,0.2994743760612764,0,0.6452948958621346
USSEN/UT HOWELL PARTY BEFORE PEOPLE,YIboHsM7iQE,1,0.33981808163693383,0,0.677542586850888
USSEN/VA ALLEN AMERICA AT A CROSSROADS,L86yeztK4Bg,1,0.39302704599096994,0,0.6394733041929734
USSEN/VA ALLEN COAL QUOTES,jx7sPWWiaUY,0,0.5367965451461896,1,0.47660676812265396
USSEN/VA ALLEN COAL REGULATIONS,-de9Pr2k5-k,1,0.39738422635638315,0,0.7796612831351873
USSEN/VA ALLEN COAL REGULATIONS 2,NSfnzrGl1lg,0,0.5176433226168226,0,0.6334824309189446
USSEN/VA ALLEN COMEBACK,q0wVGh9oapc,1,0.4034700247549499,1,0.43278501453679796
USSEN/VA ALLEN DEATH BENEFITS,1cfc3VD2Y9c,0,0.6811200822945228,0,0.5986790981074286
USSEN/VA ALLEN DEFENSE CUTS,Th586XLig_o,1,0.3747785194032682,1,0.36872769092497276
USSEN/VA ALLEN DEVASTATING,KjtSjw5Ju7o,1,0.3899911051244428,0,0.6739181025533189
USSEN/VA ALLEN DIVISIONS IN WASHINGTON,Lk-BJjxvrak,1,0.3494460096164495,0,0.7471322474584088
USSEN/VA ALLEN KAY COLES JAMES,jD_CF_P6XbI,0,0.5674726116581421,0,0.5922219245200415
USSEN/VA ALLEN RHONDA WINFIELD 60,3xvFzq90Dd0,0,0.5155956883151012,0,0.6019206309155825
USSEN/VA DSCC&KAINE PATRIOTISM AND UNITY,ykGjZRPFSxc,1,0.43727035467918524,0,0.66969593490872
USSEN/VA KAINE LEAD BY EXAMPLE,5s-2RuZ-OVM,1,0.326396849488162,0,0.5608371871818564
USSEN/VA KAINE MORE PARTNERSHIP,I8HH7lz0aOc,1,0.3200543005599148,0,0.6701310637790542
USSEN/VA WARNER DISGRACEFUL,tBSL_qh_Hd0,1,0.3901645665615864,1,0.38519966845224207
USSEN/VA WARNER ENRON,OZ2aRBhntgg,1,0.38812220959644295,0,0.5835921512538216
USSEN/VA WARNER GO HOKIES,sBDKFynVN4s,1,0.41554821361205,0,0.7180934736106778
USSEN/VA WARNER INSOURCING,uen_YStIIyw,1,0.3744442637954092,0,0.632578221176307
USSEN/VA WARNER JOHN WARNER,JkMRZLmIuXI,1,0.4088703067483568,0,0.6875876579158019
USSEN/VA WARNER NEXT GENERATION,x97zqmSwcH0,1,0.36166417600610246,0,0.5915555691332895
USSEN/VA WARNER PROBLEM SOLVER 60,7j1jnYgiLbk,1,0.36243169825266347,0,0.6046004796826482
USSEN/VA WARNER STRONGER,K_ItfxwEwmo,1,0.37517928745320706,0,0.6162651618499899
USSEN/VA WARNER SUPER LOBBYIST,gIxFcBSCHDo,1,0.41957474622764734,1,0.3627829279109276
USSEN/VA WARNER TRUTH,B1lC7FA74Sg,1,0.36516429005972306,1,0.41821484060304914
USSEN/VA WARNER VETERANS,iPRLyikAjB0,1,0.3822570108658308,0,0.7038501885715484
USSEN/VA WARNER YOU ALREADY KNOW,X3XJLk2asYc,1,0.39456023061957474,1,0.4254718350549367
USSEN/WA CANTWELL AEROSPACE INDUSTRY REV,R8KV3mh9sp8,1,0.35376865905081867,0,0.6654150879012255
USSEN/WA CANTWELL KEYS TO SUCCESS,_xqGsow5paI,1,0.4098367642699233,0,0.6474288127734913
USSEN/WI BALDWIN ALWAYS STAND UP FOR YOU,R_O59V0FWvs,1,0.4194898437333936,0,0.7411093605973725
USSEN/WI BALDWIN BEHIND CLOSED DOORS,rLDSVvrdXmI,0,0.5399575591656707,1,0.41465531535228217
USSEN/WI BALDWIN BUFFETT RULE,NWQi40FVbho,1,0.4650033062478576,0,0.660986732129983
USSEN/WI BALDWIN CLINTON ENDORSEMENT,-z_avpyd0j0,1,0.448139214058929,0,0.619250609807979
USSEN/WI BALDWIN COLLEGE AID,1goue4eiFmI,0,0.541331805830813,0,0.6162012448760368
USSEN/WI BALDWIN DISGRACE,5bwR2e7eCZM,0,0.5308231280174804,1,0.43867662560723525
USSEN/WI BALDWIN LABEL ME,IOz20N91ni0,1,0.4030828063236312,0,0.7581222313122867
USSEN/WI BALDWIN NEWSPAPER ENDORSEMENTS,cakPpQu51s0,1,0.5013240524268595,1,0.42647954642565394
USSEN/WI BALDWIN NOT FOR YOU ANYMORE,1XeNgesMpA8,1,0.4138016354600392,1,0.40968624492734335
USSEN/WI BALDWIN NOT FOR YOU ANYMORE 2,7ihWIy1YiSg,1,0.49006404435019646,1,0.4095851066018242
USSEN/WI BALDWIN NOT FOR YOU ANYMORE 3,cTGFrUk1-k4,1,0.4346255381608789,1,0.2877604720155802
USSEN/WI BALDWIN OUTSOURCING,VRABUyZQngI,1,0.4329673345223724,0,0.60251328357312
USSEN/WI BALDWIN SWEETHEART DEAL,gedxPcBeQr0,1,0.46250676249221545,1,0.40904474374576816
USSEN/WI BALDWIN TOMMY INC,K1OtwbGQR7s,1,0.4291082340843749,1,0.3910158079153145
USSEN/WI BALDWIN WHAT'S HAPPENED,xhZyrE3o4Ng,0,0.5516309715310506,1,0.3998165043616848
USSEN/WI BALDWIN&DSCC TAX RETURNS,nvpAsrw0DYs,0,0.5483621462146706,1,0.49353497026553556
USSEN/WV CAPITO BIGGEST FAN,fhMHBVM7g8E,1,0.4527149513545799,0,0.6099279661872345
USSEN/WV CAPITO EVERYDAY,69qm8Op-dIo,1,0.4104525417013781,0,0.6248832757416309
USSEN/WV CAPITO FIGHTING FOR THE HOME TEAM,3EKJCEgs_Ys,1,0.39720843894215047,1,0.3868836025371461
USSEN/WV CAPITO MEDALS,YEV3zyV3ihc,1,0.37634772890645035,0,0.6684949420184912
USSEN/WV CAPITO NEVER EVER,gdhRcZdUVJk,1,0.3674856262658432,1,0.33633375304405166
USSEN/WV CAPITO OBAMACARE,T5mTfw2Gdio,1,0.34930317247697684,1,0.3947613956483716
USSEN/WV CAPITO WELCOME SIGN,B6YJ3cXazGY,1,0.42140751820908623,0,0.6121336848555353
USSEN/WV CAPITO WHAT I HEAR,v12bCMJOu3k,1,0.33502809747498596,0,0.6407429628085103
USSEN/WV MANCHIN CAP AND TRADE BILL,yKYXr1P7h-g,1,0.27336557143119766,0,0.5842452734671751
USSEN/WV MANCHIN COUNTRY BEFORE POLITICS,1fFdgYls31o,1,0.33142683220926294,0,0.6574322174842102
USSEN/WV MANCHIN HAIRCUT,PpTpz-9Ustw,1,0.3410452677417953,0,0.6418775897231829
USSEN/WV MANCHIN HONOR AND DIGNITY,v0B2vI_7AeQ,1,0.2653805841202014,0,0.5151508725560341
USSEN/WV RAESE CAP AND TRADE BILL,IZiC88UI8lk,1,0.22557200149974244,1,0.31114449698977004
USSEN/WV RAESE GANG OF FOUR,JkE0dEIT8xA,1,0.4097150357078,1,0.4668476035040751
USSEN/WV RAESE JANE,AUYY_H3NIus,1,0.45210138125525456,0,0.6871573054729204
USSEN/WV RAESE MOST IMPORTANT ELECTION,tieNWv0UaRk,1,0.16529746863760672,0,0.5289587822104499
USSEN/WV TENNANT COURTHOUSE,cNo9rZ8YpA8,1,0.3933684479403035,0,0.6613931453789077
USSEN/WV TENNANT DELANEY'S STORY,k9m2DaUrry4,1,0.3164493097277443,0,0.6508579191518903
USSEN/WV TENNANT MESSAGE,doe_nTBQ4MY,1,0.43813126494332905,0,0.6341997853349939
USSEN/WV TENNANT WALL STREET'S SECRET WEAPON,G02lUlkTVgY,0,0.5239958863571038,1,0.4248080097136964
USSEN/WV TENNANT WHAT DO WE KNOW,BI_YsHRdp0g,1,0.5084452814443119,1,0.40354209743299285
